isbn_or_asin,book_title,author,publisher,published_date
4767434858,英語句動詞分類辞典,"クリストファ・バーナード,クリストファ・バーナード 著・文・その他","研究社,研究社","Sun, 9 Feb 2025 18:27:00 +0900"
4407316969,情報セキュリティ教本 : 組織の情報セキュリティ対策実践の手引き,"土居,範久,1939- 情報処理推進機構",実教出版,200903
4065386470,線形代数の半歩先　データサイエンス・機械学習に挑む前の30話 / KS理工学専門書,"大久保 潤,大久保 潤 著・文・その他",講談社,"Mon, 3 Feb 2025 18:28:00 +0900"
4326251816,予言がはずれるとき　新装版 : この世の破滅を予知した現代のある集団を解明する,"レオン・フェスティンガー,ヘンリー・W・リーケン,スタンレー・シャクター,水野　博介,釈　徹宗,レオン・フェスティンガー 著・文・その他,ヘンリー・W・リーケン 著・文・その他,スタンレー・シャクター 著・文・その他,水野　博介 翻訳,釈　徹宗 解説",,"Sun, 9 Feb 2025 18:27:00 +0900"
4560073767,中世のパン / 白水Uブックス,"Desportes, Françoise,見崎, 恵子, 1951-,フランソワーズ・デポルト [著],見崎恵子 訳",白水社,"Fri, 25 Jul 2014 07:02:52 +0900"
4798183962,つくって、壊して、直して学ぶKubernetes入門,"高橋,あおい 五十嵐,綾",翔泳社,202404
4065383153,ヴォイニッチ写本　世界一有名な未解読文献にデータサイエンスが挑む,安形麻理 安形輝,,
4074616750,妖精教授　最後の授業　魔法の世界,"井村君江,井村君江 著・文・その他","主婦の友社,主婦の友社","Sat, 8 Feb 2025 18:36:00 +0900"
4103559918,図書館を建てる、図書館で暮らす : 本のための家づくり,橋本麻里 山本貴光,新潮社,
110759166X,Academic Vocabulary in Use Edition with Answers,"Michael McCarthy,Felicity O'Dell",Cambridge University Press,2016-02-12
4122069297,一杯のおいしい紅茶 : ジョージ・オーウェルのエッセイ オ3-1 (中公文庫),"Orwell,George,1903-1950 小野寺,健,1931-2018",中央公論新社,202008
404605252X,バイリンガルITエンジニアの英語,mayuko,,2025-01-18
4297132125,情報処理安全確保支援士午後問題徹底解説 : 「ネットワーク」+「認証」がわかれば絶対合格!,,技術評論社,202301
4046061979,ゼロからスタート!教育系YouTuberまさるの情報処理安全確保支援士1冊目の教科書,,KADOKAWA,202309
4046058153,アメリカ人教授に学ぶ英文ライティングのメタモルフォーゼ = ENGLISH WRITING METAMORPHOSIS LEARNING FROM AN AMERICAN PROFESSOR,,KADOKAWA,202301
4756921655,英語ライティングの鬼100則 : 論理的思考をつきつめる,,明日香出版社,202108
4801307337,教養としてのハイブランド,とあるショップのてんちょう／著,彩図社,20240927
4909718133,ZERRO[ゼロ] 増補新装版,松田行正／著,牛若丸,20241204
1506271189,1100 Words You Need to Know + Online Practice: Build Your Vocabulary in just 15 minutes a day!,"Rich Carriero,Murray Bromberg,Melvin Gordon",Barrons Educational Services,2022-06-07
4794224192,カルチャロミクス : 文化をビッグデータで計測する エ2-1 (草思社文庫),"Aiden,Erez Michel,Jean-Baptiste 阪本,芳久,1950-",草思社,201910
4907162200,魔術の文法学: 記号論的エッセー,"前野, 佳彦,前野佳彦著",テクネ,"Fri, 11 Oct 2024 09:04:52 +0900"
4576240471,津山三十人殺し最終報告書,"石川,清",二見書房,202411
4798074144,"ハロー“Hello, World” OSと標準ライブラリのシゴトとしくみ 第2版",坂井弘亮,秀和システム,
4087455955,謎の独立国家ソマリランド : そして海賊国家プントランドと戦国南部ソマリア た58-16 (集英社文庫),"高野,秀行,1966-",集英社,201706
4582764975,「定本」発禁本 : 書物とその周辺 (平凡社ライブラリー. Offシリーズ),"城,市郎,1922-2016",平凡社,200404
4873768888,映像の原則 : ビギナーからプロまでのコンテ主義,"富野, 由悠季,富野由悠季 著",キネマ旬報社,"Wed, 25 Dec 2024 11:36:21 +0900"
4867800570,西洋文学にみる魔術の系譜,田中千惠子／著・編集,小鳥遊書房,20241210
4766138511,ノスタルジア酒場 : 東欧旧社会主義国のお酒とおつまみ事情＆レシピ70,イスクラ,グラフィック社,
4150506132,謎のチェス指し人形「ターク」 (ハヤカワ文庫NF),トム・スタンデージ 服部桂,,
4621061623,対称性からの群論入門,"Armstrong,M.A.(MarkAnthony) 佐藤,信哉",丸善出版,201205
4774183857,Linuxエンジニア養成読本 : IoTもクラウドも、システムの基礎と基盤はLinux! / Software Design plus. 10年先も役立つ力をつくる,,技術評論社,"Wed, 7 Sep 2016 23:23:14 +0900"
4297138891,LATEX美文書作成入門,"奥村,晴彦,1951- 黒木,裕介,1982-",技術評論社,202312
4297145464,［作って学ぶ］ブラウザのしくみ──HTTP、HTML、CSS、JavaScriptの裏側,土井麻未,技術評論社,
4781651062,とんねるずと『めちゃイケ』の終わり : 〈ポスト平成〉のテレビバラエティ論 106 (イースト新書),ラリー遠田,イースト・プレス,201808
4798153222,プログラマのためのDocker教科書 : インフラの基礎知識&コードによる環境構築の自動化,"阿佐,志保 山田,祥寛",翔泳社,201804
4798071501,開発系エンジニアのためのDocker絵とき入門 : 定番技術の基本をビジュアルで理解する : Dockerの「なぜ」を解決!,"鈴木,亮,pub.2024",秀和システム,202401
4576221477,オカルト・クロニクル = OCCULT CHRONICLE : 奇妙な事件奇妙な出来事奇妙な人物,"松閣,オルタ",二見書房,202210
4873117208,作ることで学ぶ : Makerを育てる新しい教育のメソッド (Make : Japan Books),"Martinez,SylviaLibow Stager,Gary 阿部,和広 酒匂,寛,1958-",オーム社,201503
4910038965,創られたキリシタン像 (西南学院大学博物館研究叢書),鬼束芽依／編集,西南学院大学博物館,20240830
4910315314,とるにたらない美術,原田裕規／著,ケンエレブックス,20231128
4845913143,ラッセンとは何だったのか? : 消費とアートを越えた「先」,"原田, 裕規, 1989-,原田裕規 編著",フィルムアート社,"Fri, 8 Mar 2024 17:31:33 +0900"
4344948203,SEの悲鳴 : ITエンジニアを食い物にする多重下請け構造の闇,"田中, 宏明, 1978-,田中宏明 著","幻冬舎メディアコンサルティング,幻冬舎","Wed, 25 Sep 2024 00:11:54 +0900"
4798177849,絵で見てわかるLinuxカーネルの仕組み (絵で見てわかる),市川正美 大岩尚宏 島本裕志 武内覚 田中隆久 丸山翔平,翔泳社,
4167257033,田宮模型の仕事 (文春文庫),"田宮,俊作,1934-",文藝春秋,200005
4908468702,エセ商標権事件簿 Vol.2 (過剰権利主張ケーススタディーズ),友利昴／著,パブリブ,20231215
441662378X,スイッチバック大全 : 日本の“折り返し停車場”140ヶ所の魅力と歴史を全紹介,江上英樹 栗原景,誠文堂新光社,
4480427457,絶滅寸前季語辞典,夏井いつき／著,筑摩書房,20100801
4163918949,コード・ブッダ = CODE BUDDHA : 機械仏教史縁起,"円城,塔",文藝春秋,202409
4297143097,深層ニューラルネットワークの高速化,佐藤竜馬,技術評論社,
4903474496,コンピュータグラフィックス = Computer graphics,画像情報教育振興協会,画像情報教育振興協会,201503
4903474577,ビジュアル情報処理 : CG・画像処理入門 : CGエンジニア検定・画像処理エンジニア検定ベーシック対応書籍,画像情報教育振興協会,画像情報教育振興協会,"Thu, 22 Jun 2017 02:37:43 +0900"
4839984166,大規模データセットのためのアルゴリズムとデータ構造 (Compass),DzejlaMedjedovic EminTahirovic InesDedovic ほか,マイナビ出版,
456962457X,素人のように考え、玄人として実行する : 問題解決のメタ技術,"金出,武雄,1945-",PHP研究所,200306
4297125625,コンセプトから理解するRust,"原,旅人,1975-",技術評論社,202202
4798635758,アクションポーズ大全　アクション漫画家が欲しかった魅せるポーズ5000,霧月,ホビージャパン,
4480430695,中華料理の文化史,張競／著,筑摩書房,20130601
0714111538,Ancient Board Games in Perspective,Irving Finkel,British Museum Press,2007
4845921324,映像クリエイターのための完全独学マニュアル,,フィルムアート社,20221026
4845921170,色のコードを読む,ポール・シンプソン／著 中山ゆかり／翻訳,フィルムアート社,20221224
482400702X,ただのぽんこつ母さんだと思っていたらADHDグレーでした。 (はちみつコミックエッセイ),はなゆい,オーバーラップ,202401
477752275X,よくわかる世界のサイバー犯罪 : フェイクニュース、スパイウェア、個人情報の流出から身を守る : サイバー犯罪の現在を知り自分の身を守ろう (I/O BOOKS),"御池,鮎樹",工学社,202404
4864260524,調査されるという迷惑　増補版,宮本常一 安渓遊地,みずのわ出版,
4791714636,特集民俗学の現在,,青土社,"Thu, 28 Nov 2024 11:15:10 +0900"
4774143731,3分間ネットワーク基礎講座 : 世界一わかりやすいネットワークの授業,"網野,衛二",技術評論社,201010
4802613903,発達障害・メンタル不調などに気づいたときに読む本 : 精神科の受診や特徴までがわかる,"浜内,彩乃",ソシム,202212
4150506094,ヴィクトリア朝時代のインターネット (ハヤカワ文庫NF),トムスタンデージ 服部桂,,
4908686106,Webブラウザセキュリティ : Webアプリケーションの安全性を支える仕組みを整理する,"米内, 貴志,米内貴志 著",ラムダノート,"Tue, 6 Apr 2021 19:33:35 +0900"
4005007929,キリスト教入門 792 (岩波ジュニア新書),"山我,哲雄,1951-",岩波書店,201412
4798068853,Blender Python完全ガイド,ぬっち,秀和システム,202401
4022618655,関西人の正体 い45-4 (朝日文庫),"井上,章一,1955-",朝日新聞出版,201607
4263731638,マイナーエマージェンシー,"大滝,純司,1958- 齊藤,裕之 Buttaravoli,PhilipM Leffler,StephenM",医歯薬出版,201503
4480512233,ガロアの夢 群論と微分方程式 ク-36-1 (ちくま学芸文庫),久賀道郎／本文,筑摩書房,20231211
4635140075,感謝されない医者 : ある凍傷Dr.のモノローグ,"金田,正樹,1946-2019",山と溪谷社,200703
4798069744,ストレンジコード : 難解プログラミング言語を巡る不思議な旅,"Kneusel,RonaldT 水野,貴明,1973- 竹迫,良範,1977-",秀和システム,202402
4908686165,プログラマーのためのCPU入門 : CPUは如何にしてソフトウェアを高速に実行するか,"Takenobu Tani,Takenobu Tani 著",ラムダノート,"Fri, 8 Mar 2024 18:48:48 +0900"
4313180656,公務員の議会答弁言いかえフレーズ,"森下,寿",学陽書房,202110
4560096392,ヨーロッパ中世象徴史,"Pastoureau,Michel,1947- 篠田,勝英,1948-",白水社,201805
4621061453,統計のための行列代数 1 上,,丸善出版,201201
4621061526,統計のための行列代数 2 下,,丸善出版,201201
4901007092,家政婦は見られた! : 土曜ワイド劇場(テレビ朝日系列)家政婦は見た!公式ガイドブック,"柴, 英三郎, 1926-,大沢家政婦研究所,柴英三郎 監修,大沢家政婦研究所 編",音羽出版,"Sat, 20 Mar 2010 08:59:59 +0900"
4815604975,図解入門TCP/IP = An Illustrated Introduction to TCP/IP : 仕組み・動作が見てわかる,"みやた,ひろし",SBクリエイティブ,202012
4815618593,体験しながら学ぶネットワーク技術入門,"みやた,ひろし",SBクリエイティブ,202401
4130606077,光の物理　新装版,小林浩一／著,東京大学出版会,20231102
484437849X,はじめて学ぶバイナリ解析 : 不正なコードからコンピュータを守るサイバーセキュリティ技術 / Next Publishing. OnDeck Books,"小林, 佐保,岡田, 怜士,浅部, 佑,満永, 拓邦,小林佐保, 岡田怜士, 浅部佑, 満永拓邦 著","インプレスR&D,インプレス (発売)","Fri, 16 Oct 2020 04:54:12 +0900"
4594062539,マンガけもの道 : まんだらけ中野店副店長の珍作発掘探訪,"岩井, 道,岩井道 著",扶桑社,"Wed, 13 Oct 2010 00:10:12 +0900"
1786347849,Science Research Writing: For Native And Non-native Speakers Of English (second Edition),Hilary Glasman-deal,WSPC (EUROPE),2020-11-27
4469244082,これでいいのか大学入試英語 下,"Watkins,Gareth",大修館書店,199710
4469244074,これでいいのか大学入試英語 上,"Watkins,Gareth",大修館書店,199710
4309419267,屋根裏に誰かいるんですよ。 : 都市伝説の精神病理 か17-4 (河出文庫),"春日,武彦,1951-",河出書房新社,202210
4295013498,スーパーユーザーなら知っておくべきLINUXシステムの仕組み,"Ward,Brian,1972- 柴田,芳樹,1959-",インプレス,202203
4094083359,実録死体農場 / 小学館文庫,"Bass, William M,Jefferson, Jon,相原, 真理子, 1947-2010,ビル・バス, ジョン・ジェファーソン 著,相原真理子 訳",小学館,"Thu, 24 Jan 2013 07:02:29 +0900"
4775313010,図解魔術の歴史 No.048 (F FILES),"草野,巧,1956-",新紀元社,201503
4867660264,予言獣大図鑑,長野栄俊／編著 岩間理紀／著 笹方政紀／著 峰守ひろかず／著,文学通信,20231206
4873117437,メタプログラミングRuby,"Perrotta,Paolo 角,征典",オーム社,201510
4876872112,鉄道重大事故の歴史,"久保田,博,1924-",グランプリ出版,200006
4876874123,鉄道重大事故の歴史 : 鉄道事故に見る安全技術の進化,"久保田,博",グランプリ出版,202401
4274227553,凸解析と最適化理論 = Convex Analysis and Optimization Theory,"田中,謙輔,1933-2000",オーム社,202109
490868605X,数式組版,"木枝, 祐介,木枝祐介 著",ラムダノート,"Wed, 13 Jun 2018 18:33:52 +0900"
4789837513,ディジタル回路の設計入門 : ハードウェアの動きを理解しながら学ぶ (トランジスタ技術special no.90),湯山俊夫,CQ出版,2005-4-1
4478117764,大学図鑑! 2024,,ダイヤモンド社,202303
4044007527,神秘学講義 G124-1 (角川ソフィア文庫),"高橋,巌,1928-2024",KADOKAWA,202303
4906529925,信州の秘境駅・小駅を巡る : 近代化から過疎化への100年旅,"久保田,稔,1960-",川辺書林,202203
4299042387,クセがスゴい不動産,あなたの理想不動産,宝島社,202306
4802213050,秘境駅で途方に暮れた,"カベルナリア吉田,1965-",イカロス出版,202306
4065332834,中世ヨーロッパの色彩世界 2784 (講談社学術文庫),"徳井,淑子,1949-",講談社,202309
4798027979,わかる!電子工作の基本100,"遠藤,敏夫,1949-",秀和システム,201012
0071752064,Practice Makes Perfect English Articles and Determiners Up Close (Practice Makes Perfect Series),Mark Lester,McGraw-Hill Education,2013-08-07
4480056599,読み書きの技法 / ちくま新書,"小河原, 誠, 1947-,小河原誠 著",筑摩書房,"Tue, 30 Jul 1996 09:00:00 +0900"
4480084886,日本文学史序説　（下）,加藤周一／著,筑摩書房,19990401
4480084878,日本文学史序説　（上）,加藤周一／著,筑摩書房,19990401
4309416845,日本の偽書 ふ19-1 (河出文庫),"藤原,明,1958-",河出書房新社,201905
4798179809,なっとく!関数型プログラミング : 関数型プログラミングの基本概念の全容を把握し活用したい開発者に,"Płachta,Michał クイープ",翔泳社,202308
1837639965,Architecture and Design of the Linux Storage Stack: Gain a deep understanding of the Linux storage landscape and its well-coordinated layers,Muhammad Umer,Packt Publishing,2023-07-28
4102184716,ケプラー予想 : 四百年の難問が解けるまで シ-38-12 (新潮文庫),"Szpiro,George,1950- 青木,薫,1956-",新潮社,201401
4905033314,プロジェクト・シン・エヴァンゲリオン : 実績・省察・評価・総括,"カラー,カラー 編","カラー,グラウンドワークス","Thu, 10 Aug 2023 06:20:19 +0900"
4065324017,プリキュアコスチュームクロニクル = Precure Costume Chronicle : プリキュア20周年アニバーサリー,東映アニメーション株式会社,講談社,202310
9811379661,"Kawaii Engineering: Measurements, Evaluations, and Applications of Attractiveness (Springer Series on Cultural Computing)","Ohkura,Michiko (edt)",Springer,2020-08-15
4309419690,日本怪談実話 た52-1 (河出文庫),"田中,貢太郎,1880-1941",河出書房新社,202306
4309419712,戦前のこわい話 : 怪奇実話集 し10-3 (河出文庫),"志村,有弘,1941-",河出書房新社,202306
4331150526,プログラム学習による基礎電気工学 交流編 / 電気基礎講座 ; 3,"松下電器工学院,松下電器工学院 編著","松下電器産業,広済堂出版","Thu, 17 Apr 1997 00:00:00 +0900"
4331150518,プログラム学習による基礎電気工学 直流編 / 電気基礎講座 1,"松下電器工学院,松下電器工学院 編著",松下電器産業,"Thu, 3 Dec 2009 09:00:00 +0900"
433115050X,基礎電子工学 : プログラム学習による 電子回路編　１ ５ (電気基礎講座),松下電器工学院 末武国弘,松下電器産業,1975
4800307961,元報道記者が見た昭和事件史 : 歴史から抹殺された惨劇の記録,"石川,清,1964-",洋泉社,201511
4863135629,絶対に停まらない世界の廃墟駅 (NATIONAL GEOGRAPHIC),"Ross,David(DavidSoutherland) 大島,聡子",日経BPマーケティング (発売),202305
4761101857,仙人ワンダーランド : 和漢仙人列伝,"影山,純夫,1947-",河原書店,202305
4390114956,フランス怪奇民話集 / 現代教養文庫 ; 1495,"植田, 祐次, 1936-,山内, 淳, 1951-,植田祐次, 山内淳 訳編",社会思想社,"Wed, 30 Mar 1994 09:00:00 +0900"
4040667956,東京大学の学術遺産捃拾帖 103 (メディアファクトリー新書),"モリナガ,ヨウ,1966-",KADOKAWA,201406
4837967701,あなたの知らない「ヘン」な法律 A86-1 (王様文庫),"なかむら,いちろう",三笠書房,201512
4295003255,新人エンジニアのためのインフラ入門 / Think IT BOOKS,"BFT,BFT 著",インプレス,"Mon, 9 Apr 2018 23:56:19 +0900"
400500850X,聖徳太子 : ほんとうの姿を求めて 850 (岩波ジュニア新書),"東野,治之,1946-",岩波書店,201704
4834013871,昔話の語法,"小沢,俊夫,1930-",福音館書店,199910
4908468605,エセ著作権事件簿 Vol.1 (過剰権利主張ケーススタディーズ),友利昴／著,パブリブ,20220711
4061592432,ケルト妖精学 (講談社学術文庫),"井村,君江,1932-",講談社,199608
4480087966,ケルト妖精学 / ちくま学芸文庫,"井村, 君江, 1932-,井村君江 著",筑摩書房,"Tue, 20 Jan 2004 01:54:48 +0900"
4862464831,ゲームエンジンアーキテクチャ,"Gregory,Jason 今給黎,隆,1972- 湊,和久 大貫,宏美 田中,幸,翻訳家",ボーンデジタル,202012
4865280685,わたしが先生の「ロリータ」だったころ,アリソン・ウッド／著者 服部理佳／訳者,左右社,20220307
4798068160,"Good Code,Bad Code : 持続可能な開発のためのソフトウェアエンジニア的思考","Long,Tom 秋,勇紀 高田,新山 山本,大祐,1983-",秀和システム,202302
1680502549,Domain Modeling Made Functional: Tackle Software Complexity with Domain-Driven Design and F#,Scott Wlaschin,Pragmatic Bookshelf,2018-03-06
4764905132,IT技術者の長寿と健康のために,"情報通信医学研究所 長野,宏宣,1945- 中川,晋一,1961- 蒲池,孝一,1947-",近代科学社,201606
0312383215,What People Wore When: A Complete Illustrated History of Costume from Ancient Times to the Nineteenth Century for Every Level of Society,Melissa Leventon,St. Martin's Griffin,2008-07-08
4798061700,実践Rustプログラミング入門 = introduction to rust programming,"初田,直也 山口,聖弘 吉川,哲史 豊田,優貴 松本,健太郎,webエンジニア 原,将己 ほか",秀和システム,202009
4562072547,世界を騙した女詐欺師たち,"Telfer,Tori 富原,まさ江,1965-",原書房,202302
4344953304,幼なじみ萌え : ラブコメ恋愛文化史,"玉井,建也",幻冬舎,201711
3031004418,General Game Playing (Synthesis Lectures on Artificial Intelligence and Machine Learning),"Michael Genesereth,Michael Thielscher",Springer,2014-03-18
4798125393,実践プログラミングDSL : ドメイン特化言語の設計と実装のノウハウ (Programmer's SELECTION),"Ghosh,Debasish,1953- 佐藤,竜一,1972-",翔泳社,201206
4839967091,囲碁ディープラーニングプログラミング,"Pumperla,Max Ferguson,Kevin 山岡,忠夫",マイナビ出版,201904
4309460631,ホームズ贋作展覧会 / 河出文庫,"各務, 三郎, 1936-,各務三郎 編",河出書房新社,"Thu, 5 Oct 1989 09:00:00 +0900"
0321842685,Hacker's Delight,"Warren, Henry S.",Addison-wesley,2012-09-25
4434046683,ハッカーのたのしみ : 本物のプログラマはいかにして問題を解くか,"Warren,HenryS 滝沢,徹",星雲社,200409
4774153265,人間に勝つコンピュータ将棋の作り方,コンピュータ将棋協会,技術評論社,201211
4814400160,自分だけのボードゲームを作ろう : ゲームをデザインして、作って、みんなでプレイする (Make : Japan Books),"Daniels,JesseTerrance 金井,哲夫,1958-",オーム社 (発売),202212
4480438319,神田神保町書肆街考 か－２７－２ (ちくま文庫),鹿島茂／著,筑摩書房,20221013
4787210130,ボンデージ進化論,北原童夢／著,青弓社,19920401
4297102838,逆引きPIC電子工作やりたいこと事典,"後閑, 哲也, 1947-,後閑哲也 著",技術評論社,"Thu, 13 Jun 2019 19:43:25 +0900"
4816357688,オールカラー普通免許〈ひっかけ対策〉問題集 : そのまま本試験,,ナツメ社,201502
4588276476,鉄道旅行の歴史　〈新装版〉,W.シヴェルブシュ／著 加藤二郎／訳,法政大学出版局,20111209
4758017832,中谷友紀子東映アニメーションプリキュアワークス = Nakatani Yukiko TOEI ANIMATION PRECURE WORKS 2,"中谷,友紀子,1986-",講談社 (発売),202210
4297130343,リアルタイムグラフィックスの数学 = Mathematics of Real-Time Graphics : GLSLではじめるシェーダプログラミング,"巴山,竜来,1982-",技術評論社,202209
4320122992,量子情報科学入門 = Introduction to Quantum Information Science,"石坂,智 小川,朋宏 河内,亮周",共立出版,201206
4297129140,作って学ぶコンピュータアーキテクチャ : LLVMとRISC-5による低レイヤプログラミングの基礎,"木村,優之",技術評論社,202207
4484121034,性欲の科学 : なぜ男は「素人」に興奮し、女は「男同士」に萌えるのか,"Ogas,Ogi Gaddam,Sai 坂東,智子,1955-",阪急コミュニケーションズ,201202
4121506197,サラブレッドに「心」はあるか 619 (中公新書ラクレ),"楠瀬,良,1951-",中央公論新社,201804
4297128462,達人が教えるWebパフォーマンスチューニング : ISUCONから学ぶ高速化の実践,"藤原,俊一郎 馬場,俊彰 中西,建登 長野,雅広 金子,達哉,1991- 草野,翔",技術評論社,202206
490381419X,これならわかる工学部で学ぶ数学,"千葉,逸人,1982-",プレアデス出版,200902
4478013322,完全独習ベイズ統計学入門,"小島,寛之,1958-",ダイヤモンド社,201511
4758017115,高橋晃東映アニメーションプリキュアワークス = : TAKAHASHI AKIRA TOEI ANIMATION PRECURE WORKS,"高橋,晃,1971-",講談社 (発売),202102
4806714453,〈図説〉日本の結び,"藤原,覚一,1895-1990",築地書館,201210
479806338X,最新アニメ業界の動向とカラクリがよ～くわかる本 : 業界人、就職、転職に役立つ情報満載 (図解入門業界研究. How-nual),"谷口,功,1954- 麻生,はじめ,1955-",秀和システム,202012
4295000965,Goプログラミング実践入門 : 標準ライブラリでゼロからWebアプリを作る (impress top gear),"鄭,兆雄 武舎,広幸 阿部,和也 上西,昌弘",インプレス,201703
4765318699,診察室の陰性感情,"加藤, 温,加藤温 著",金芳堂,"Wed, 23 Jun 2021 19:16:34 +0900"
458276763X,職人歌合 763 (平凡社ライブラリー),"網野,善彦,1928-2004",平凡社,201205
4798044784,"ハロー""Hello,World""OSと標準ライブラリのシゴトとしくみ : たった7行のCプログラムから解き明かす","坂井,弘亮,1973-",秀和システム,201509
4774146129,C言語入門書の次に読む本 (プログラミングの教科書),"坂井,弘亮,1973-",技術評論社,201105
4779516269,なぜあなたは国際誌に論文を掲載できないのか : 誰も教えてくれなかった本当に必要なこと,"加藤,司,心理学",ナカニシヤ出版,202203
0472034758,Academic writing for graduate students : essential tasks and skills (Michigan series in English for academic and professional purposes),"Swales,John Feak,ChristineB.",University of Michigan Press,c2012-01
4101311013,河童が覗いたヨーロッパ (新潮文庫),"妹尾,河童,1930-",新潮社,198307
4065250390,アート展「初音ミク・クロニクル」公式ビジュアルブック,,講談社,202110
4044004951,秘境旅行 [J110-4] ([角川ソフィア文庫]),"芳賀,日出男,1921-",KADOKAWA,202001
