full_name,html_url,description,stargazers_count
"gchenfc/sci-hub-now","https://github.com/gchenfc/sci-hub-now","Free access to academic papers with just a single click! Abolish publishers, long live the open access movement! ðŸ¦…",17
"rubenvereecken/py-vgdl","https://github.com/rubenvereecken/py-vgdl","VGDL 2.0: A video game description language for AI research",30
"ossf/criticality_score","https://github.com/ossf/criticality_score","Gives criticality score for an open source project",658
"trekhleb/javascript-algorithms","https://github.com/trekhleb/javascript-algorithms","ðŸ“ Algorithms and data structures implemented in JavaScript with explanations and links to further readings",90850
"glinscott/fishtest","https://github.com/glinscott/fishtest","Stockfish testing",139
"beurtschipper/Depix","https://github.com/beurtschipper/Depix","Recovers passwords from pixelized screenshots",13632
"mikf/gallery-dl","https://github.com/mikf/gallery-dl","Command-line program to download image galleries and collections from several image hosting sites",2755
"cpojer/js-codemod","https://github.com/cpojer/js-codemod","Codemod scripts to transform code to next generation JS",1036
"nmrugg/stockfish.js","https://github.com/nmrugg/stockfish.js","The Stockfish chess engine in Javascript",300
"nozaq/shogi-rs","https://github.com/nozaq/shogi-rs","A Bitboard-based shogi library in Rust. Board representation, move generation/validation and time control utilities.",16
"airbnb/javascript","https://github.com/airbnb/javascript","JavaScript Style Guide",103163
"jasonwebb/morphogenesis-resources","https://github.com/jasonwebb/morphogenesis-resources","Comprehensive list of resources on the topic of digital morphogenesis (the creation of form through code). Includes links to major articles, code repos, creative projects, books, software, and more.",1115
"utkusen/urlhunter","https://github.com/utkusen/urlhunter","a recon tool that allows searching on URLs that are exposed via shortener services",802
"sadanandpai/javascript-code-challenges","https://github.com/sadanandpai/javascript-code-challenges","A collection of JavaScript modern interview code challenges for beginners to experts",1500
"TadaoYamaoka/DeepLearningShogi","https://github.com/TadaoYamaoka/DeepLearningShogi",,71
"facebook/jscodeshift","https://github.com/facebook/jscodeshift","A JavaScript codemod toolkit.",5937
"suragnair/alpha-zero-general","https://github.com/suragnair/alpha-zero-general","A clean implementation based on AlphaZero for any game in any framework + tutorial + Othello/Gobang/TicTacToe/Connect4 and more",2146
"HiraokaTakuya/apery_rust","https://github.com/HiraokaTakuya/apery_rust","USI shogi engine written in Rust",42
"pahen/madge","https://github.com/pahen/madge","Create graphs from your CommonJS, AMD or ES6 module dependencies",4515
"imbushuo/uboot","https://github.com/imbushuo/uboot","U-Boot for HP Prime G2",11
"zephray/prinux","https://github.com/zephray/prinux","Tools and scripts for running Linux on HP Prime calculator",23
"imbushuo/PrimeG2Pkg","https://github.com/imbushuo/PrimeG2Pkg","Running Windows on smartphone is not new. How about a calculator?",65
"zephray/cpuid-nspire","https://github.com/zephray/cpuid-nspire","CPUID tool for TI-Nspire series of calculators (for now)",2
"Arnie97/clock-tuner","https://github.com/Arnie97/clock-tuner","Tweaks clock frequency of HP 39gs to play retro System RPL games",14
"Bogdan-Lyashenko/js-code-to-svg-flowchart","https://github.com/Bogdan-Lyashenko/js-code-to-svg-flowchart","js2flowchart - a visualization library to convert any JavaScript code into beautiful SVG flowchart. Learn otherâ€™s code. Design your code. Refactor code. Document code. Explain code.",5919
"aozorahack/aozorabunko_text","https://github.com/aozorahack/aozorabunko_text","text-only archives of www.aozora.gr.jp",14
"itchyny/rexdep","https://github.com/itchyny/rexdep","Roughly extract dependency relation from source code",158
"defunkt/gist","https://github.com/defunkt/gist","Potentially the best command line gister.",3556
"lebab/lebab","https://github.com/lebab/lebab","Turn your ES5 code into readable ES6. Lebab does the opposite of what Babel does.",5355
"rhasumi/dynamicmodels","https://github.com/rhasumi/dynamicmodels","ã€Žå‹•å­¦ãƒžã‚¯ãƒ­çµŒæ¸ˆå­¦ã¸ã®ã„ã–ãªã„ã€ãƒ—ãƒ­ã‚°ãƒ©ãƒ ",4
"AssemblyScript/assemblyscript","https://github.com/AssemblyScript/assemblyscript","Definitely not a TypeScript to WebAssembly compiler ðŸš€",10658
"sindresorhus/css-in-readme-like-wat","https://github.com/sindresorhus/css-in-readme-like-wat","Style your readme using CSS with this simple trick",4217
"liamg/gitjacker","https://github.com/liamg/gitjacker","ðŸ”ª :octocat: Leak git repositories from misconfigured websites",1155
"glinscott/Garbochess-JS","https://github.com/glinscott/Garbochess-JS","A strong javascript chess engine using WebWorkers",265
"gsingh93/gdl-parser","https://github.com/gsingh93/gdl-parser","A parser for GDL (game description language)",6
"GlukKazan/DagazServer","https://github.com/GlukKazan/DagazServer",,2
"LipersInSlums/LipersInSlums.github.io","https://github.com/LipersInSlums/LipersInSlums.github.io",,1
"p-ranav/awesome-hpp","https://github.com/p-ranav/awesome-hpp","A curated list of awesome header-only C++ libraries",1060
"azu/awesome-commit-english","https://github.com/azu/awesome-commit-english","ã‚³ãƒŸãƒƒãƒˆè‹±èªžã«ã¤ã„ã¦ã®è¨˜äº‹ã¾ã¨ã‚",767
"sindresorhus/github-markdown-css","https://github.com/sindresorhus/github-markdown-css","The minimal amount of CSS to replicate the GitHub Markdown style",5161
"AlDanial/cloc","https://github.com/AlDanial/cloc","cloc counts blank lines, comment lines, and physical lines of source code in many programming languages.",10716
"emilk/hobogo","https://github.com/emilk/hobogo","Rust + WASM experiment",27
"emilk/egui","https://github.com/emilk/egui","egui: Immediate mode GUI written in Rust, made for WASM",1271
"niklasf/python-chess","https://github.com/niklasf/python-chess","A pure Python chess library with move generation and validation, PGN parsing and writing, Polyglot opening book reading, Gaviota tablebase probing, Syzygy tablebase probing and UCI/XBoard engine communication",1217
"yadox666/The-Hackers-Hardware-Toolkit","https://github.com/yadox666/The-Hackers-Hardware-Toolkit","The best hacker's gadgets for Red Team pentesters and security researchers.",1705
"edsu/itstimeihadsometimealone","https://github.com/edsu/itstimeihadsometimealone","Some code to examine and modify your experience of Twitter.",10
"moebooru/moebooru","https://github.com/moebooru/moebooru","Moebooru, a fork of danbooru1 that has been heavily modified",333
"sozysozbot/cerke","https://github.com/sozysozbot/cerke","ãƒ‘ã‚¤ã‚°å°†æ£‹/æœºæˆ¦/cerke/cetkaik/cet2 kaik",3
"sozysozbot/cerke_modeling","https://github.com/sozysozbot/cerke_modeling",,1
"sindresorhus/awesome","https://github.com/sindresorhus/awesome","ðŸ˜Ž Awesome lists about all kinds of interesting topics",149567
"Bogdan-Lyashenko/codecrumbs","https://github.com/Bogdan-Lyashenko/codecrumbs","Learn, design or document codebase by putting breadcrumbs in source code. Live updates, multi-language support and more.",2418
"Gedevan-Aleksizde/20190703_ML_ECON","https://github.com/Gedevan-Aleksizde/20190703_ML_ECON","Tokyo.R #80 è¨ˆé‡çµŒæ¸ˆå­¦ã¨æ©Ÿæ¢°å­¦ç¿’ã®é–¢ä¿‚ â€“AI ã¯ã•ã ã‚, ã•ã ã‚ã¯åäº‹å®Ÿ ",4
"QwerbyKing/VC-US","https://github.com/QwerbyKing/VC-US","Visual Chess: Undercarriage Syndicate is a chess framework designed with compatibility with Betza Notation",1
"isoraqathedh/betza","https://github.com/isoraqathedh/betza","Item for transforming betza notation into movement diagrams.",1
"bookmarks-tools/bookmarks-parser","https://github.com/bookmarks-tools/bookmarks-parser",":bookmark: Parses Firefox/Chrome HTML bookmarks files",19
"PKSHATechnology-Research/tdmelodic","https://github.com/PKSHATechnology-Research/tdmelodic","A Japanese accent dictionary generator",40
"mrDIMAS/rg3d","https://github.com/mrDIMAS/rg3d","3d game engine written in Rust",1417
"mi-g/jocly","https://github.com/mi-g/jocly","Javascript library and tools to provide user interface (2D, 3D, VR) and engine for playing board games",38
"slatedocs/slate","https://github.com/slatedocs/slate","Beautiful static documentation for your API",31787
"kgtkr/block-checker","https://github.com/kgtkr/block-checker",,2
"Taraflex/Back2stackoverflow","https://github.com/Taraflex/Back2stackoverflow","Userscript for redirect to stackoverflow.com from machine-translated sites",196
"ornicar/chessground","https://github.com/ornicar/chessground","Mobile/Web chess UI for lichess.org",443
"trozler/myFourierEpicycles","https://github.com/trozler/myFourierEpicycles","An article thats lets the user draw their own fourier epicycle. The site also gives a brief explanation of the mathematics connecting fourier series and revolving epicycles.",27
"GlukKazan/GlukKazan.github.io","https://github.com/GlukKazan/GlukKazan.github.io","Dagaz Demo",9
"GlukKazan/Dagaz","https://github.com/GlukKazan/Dagaz",,32
"yaneurao/MyShogi","https://github.com/yaneurao/MyShogi","ãƒžã‚¤ãƒŠãƒ“ã•ã‚“ã‹ã‚‰ç™ºå£²ã—ãŸã€Žå°†æ£‹ç¥žã‚„ã­ã†ã‚‰çŽ‹ã€(2018å¹´ç™ºå£²)ã®å°†æ£‹ç”¨GUIã§ã™ã€‚",58
"gunyarakun/python-shogi","https://github.com/gunyarakun/python-shogi","A pure Python shogi library with move generation and validation and handling of common formats.",126
"Ludeme/LudiiExampleAI","https://github.com/Ludeme/LudiiExampleAI","Project with examples for the implementation of third-party AI algorithms / agents for the Ludii general game system.",19
"snakajima/game-compiler","https://github.com/snakajima/game-compiler","Game 80 compiler, which I've created when I was 18 ('79)",16
"akicho8/shogi-player","https://github.com/akicho8/shogi-player","å°†æ£‹ã®æ£‹è­œã‚’å†ç”Ÿã—ãŸã‚Šç›¤é¢ã‚’ç·¨é›†ã—ãŸã‚Šã—ã¾ã™",25
"yaneurao/Ayane","https://github.com/yaneurao/Ayane","python Adaptor to YaneuraOu",22
"ymgaq/AQ","https://github.com/ymgaq/AQ","A Go game engine. Download here: http://github.com/ymgaq/AQ/releases",297
"ymgaq/Pyaq","https://github.com/ymgaq/Pyaq","Pyaqã¯Pythonã®ã¿ã§å®Ÿè£…ã•ã‚ŒãŸå›²ç¢ãƒ—ãƒ­ã‚°ãƒ©ãƒ ã§ã™ã€‚æ·±å±¤å­¦ç¿’ã‚’å­¦ã¶ãŸã‚ã®æ•™è‚²ç›®çš„ã®ã‚³ãƒ¼ãƒ‰ã§ã™ã€‚",108
"boardgameio/boardgame.io","https://github.com/boardgameio/boardgame.io","State Management for Turn-Based Games",8367
"ddugovic/Stockfish","https://github.com/ddugovic/Stockfish","Multi-variant fork of popular UCI chess engine",99
"ianfab/Fairy-Stockfish","https://github.com/ianfab/Fairy-Stockfish","chess variant engine supporting Xiangqi, Shogi, Janggi, Makruk, S-Chess, Crazyhouse, Bughouse, and many more",99
"j6k1/USIAgent","https://github.com/j6k1/USIAgent","USIãƒ—ãƒ­ãƒˆã‚³ãƒ«ã«å¯¾å¿œã—ãŸå°†æ£‹AIã‚’é–‹ç™ºã™ã‚‹ãŸã‚ã®ãƒ•ãƒ¬ãƒ¼ãƒ ãƒ¯ãƒ¼ã‚¯",1
"makudenki/libshogi","https://github.com/makudenki/libshogi",,10
"Omega-Numworks/Omega","https://github.com/Omega-Numworks/Omega","Omega 1.20, the next evolution of Epsilon! Now available for your Numworks calculator!",94
"david-pfx/Polygamo","https://github.com/david-pfx/Polygamo","Polygamo is a language compiler and general player for abstract games and puzzles.",8
"mi-g/joclyboard","https://github.com/mi-g/joclyboard","Multiplatform 3D/2D desktop application for playing board games",29
"greymd/teip","https://github.com/greymd/teip","Select partial standard input and replace with the result of another command efficiently",263
"jw0k/serial2ti83","https://github.com/jw0k/serial2ti83","A program for Arduino Uno that makes it possible to connect a TI-83 calculator to a computer",26
"jwasham/coding-interview-university","https://github.com/jwasham/coding-interview-university","A complete computer science study plan to become a software engineer.",149867
"yaneurao/YaneuraOu","https://github.com/yaneurao/YaneuraOu","YaneuraOu is the World's Strongest Shogi engine(AI player) , WCSC29 1st winner , educational and USI compliant engine.",290
"na2hiro/Shogi.js","https://github.com/na2hiro/Shogi.js","A simple shogi library for JavaScript / TypeScript",38
"fulldecent/system-bus-radio","https://github.com/fulldecent/system-bus-radio","Transmits AM radio on computers without radio transmitting hardware.",5605
"na2hiro/json-kifu-format","https://github.com/na2hiro/json-kifu-format","JSONæ£‹è­œãƒ•ã‚©ãƒ¼ãƒžãƒƒãƒˆ(JKF)ã®å®šç¾©ã¨KIF, KI2, CSAã‹ã‚‰ã®å¤‰æ›ãƒ©ã‚¤ãƒ–ãƒ©ãƒª",67
"chromedp/chromedp","https://github.com/chromedp/chromedp","A faster, simpler way to drive browsers supporting the Chrome DevTools Protocol.",5652
"postmanlabs/newman","https://github.com/postmanlabs/newman","Newman is a command-line collection runner for Postman",4915
"approvers/RADWIMPS","https://github.com/approvers/RADWIMPS","å›ã® then-then-then ä¸–ã¯ Promise ã§ Future",219
"LumaKernel/dotfiles","https://github.com/LumaKernel/dotfiles","â­ My own world.",6
"subhra74/xdm","https://github.com/subhra74/xdm","Powerfull download accelerator and video downloader",1912
"tanakh/easy-scraper","https://github.com/tanakh/easy-scraper","Easy scraping library",157
"fujitsu/A64FX","https://github.com/fujitsu/A64FX",,338
"gfngfn/SATySFi","https://github.com/gfngfn/SATySFi","A statically-typed, functional typesetting system",788
"Neutrino-1/esp-oled-firebase","https://github.com/Neutrino-1/esp-oled-firebase","0.91"" inch OLED and an esp8266-12E, which is integrated to firebase to fetch text file and send and receive a text message",79
"go-shiori/shiori","https://github.com/go-shiori/shiori","Simple bookmark manager built with Go",4636
"omegasisters/homepage","https://github.com/omegasisters/homepage","ãŠã‚ã‚·ã‚¹ã®ãƒ›ãƒ¼ãƒ ãƒšãƒ¼ã‚¸ã‚’ä½œã‚ŠãŸã„",540
"yusukesaitoh/calm-twitter","https://github.com/yusukesaitoh/calm-twitter","This extension hides trending information from twitter timelines to make your mind calm.",77
"eramdam/BetterTweetDeck","https://github.com/eramdam/BetterTweetDeck","A browser extension to improve TweetDeck with a lot of features",524
"FujiMakoto/twitter-saucenao","https://github.com/FujiMakoto/twitter-saucenao","A Twitter bot that utilizes the SauceNao API to find the source of images or anime screencaps",143
"ceceradio/twitter-block-chain","https://github.com/ceceradio/twitter-block-chain","Chrome extension to block all users on a followers/following page.",180
"IndieVisualLab/UnityGraphicsProgrammingSeries","https://github.com/IndieVisualLab/UnityGraphicsProgrammingSeries","æ›¸ç±ã€ŒUnity Graphics Programmingã€ã‚·ãƒªãƒ¼ã‚ºã®PDFã‚³ãƒ¬ã‚¯ã‚·ãƒ§ãƒ³",523
"mitmath/18337","https://github.com/mitmath/18337","18.337 - Parallel Computing and Scientific Machine Learning",712
"Reputeless/Xoshiro-cpp","https://github.com/Reputeless/Xoshiro-cpp","Header-only Xoshiro/Xoroshiro PRNG wrapper library for modern C++ (C++17/C++20)",68
"akameco/pixiv-app-api","https://github.com/akameco/pixiv-app-api","Promise base pixiv API client",167
"bokuweb/lifegameboy","https://github.com/bokuweb/lifegameboy","ðŸ¦€ Conway's Game of Life written in Rust on GameBoyAdvance",48
"acorn/twitter-bookmarks-search","https://github.com/acorn/twitter-bookmarks-search","WebExtension that adds ability search all your bookmarked tweets!",53
"soulmachine/machine-learning-cheat-sheet","https://github.com/soulmachine/machine-learning-cheat-sheet","Classical equations and diagrams in machine learning",3920
"onitama/OpenHSP","https://github.com/onitama/OpenHSP","Hot Soup Processor",91
"nagadomi/waifu2x","https://github.com/nagadomi/waifu2x","Image Super-Resolution for Anime-Style Art",20103
"lltcggie/waifu2x-caffe","https://github.com/lltcggie/waifu2x-caffe","waifu2xã®Caffeç‰ˆ",5442
"jsvine/markovify","https://github.com/jsvine/markovify","A simple, extensible Markov chain generator.",2634
"yuiseki/twint-gyazo","https://github.com/yuiseki/twint-gyazo","Pythonã§æ›¸ã‹ã‚ŒãŸã€Twitterã®æŒ‡å®šã—ãŸãƒ¦ãƒ¼ã‚¶ãƒ¼ã®ç”»åƒã‚’å…¨éƒ¨Gyazoã«ã‚¢ãƒƒãƒ—ãƒ­ãƒ¼ãƒ‰ã™ã‚‹ã‚¹ã‚¯ãƒªãƒ—ãƒˆ",40
"koshian2/DeepCreamPyBook","https://github.com/koshian2/DeepCreamPyBook",,4
"danbooru/danbooru","https://github.com/danbooru/danbooru","A taggable image board written in Rails 6.",1024
"LandGrey/pydictor","https://github.com/LandGrey/pydictor","A powerful and useful hacker dictionary builder for a brute-force attack",1631
"violentmonkey/violentmonkey","https://github.com/violentmonkey/violentmonkey","Violentmonkey provides userscripts support for browsers. It works on browsers with WebExtensions support.",1832
"5ebec/arcard-template","https://github.com/5ebec/arcard-template","ðŸ“‡ AR Business Card Template",5
"Mottl/GetOldTweets3","https://github.com/Mottl/GetOldTweets3","A Python 3 library and a corresponding command line utility for accessing old tweets",307
"discord/discord-api-docs","https://github.com/discord/discord-api-docs","Official Discord API Documentation",2504
"wenyan-lang/wenyan","https://github.com/wenyan-lang/wenyan","æ–‡è¨€æ–‡ç·¨ç¨‹èªžè¨€ A programming language for the ancient Chinese.",16854
"2SC1815J/ndldl_utils","https://github.com/2SC1815J/ndldl_utils","å›½ç«‹å›½ä¼šå›³æ›¸é¤¨ãƒ‡ã‚¸ã‚¿ãƒ«ã‚³ãƒ¬ã‚¯ã‚·ãƒ§ãƒ³é–²è¦§ç”»é¢å‘ã‘ãƒ¦ãƒ¼ã‚¶ã‚¹ã‚¯ãƒªãƒ—ãƒˆï¼ˆã‚¢ãƒ‰ãƒ¬ã‚¹ãƒãƒ¼ã‚’ç¾åœ¨è¡¨ç¤ºä¸­ã®ã‚³ãƒžã®URLã«æ›´æ–°ãªã©ï¼‰",5
"taspinar/twitterscraper","https://github.com/taspinar/twitterscraper","Scrape Twitter for Tweets",1568
"bisguzar/twitter-scraper","https://github.com/bisguzar/twitter-scraper","Scrape the Twitter Frontend API without authentication.",2632
"twintproject/twint","https://github.com/twintproject/twint","An advanced Twitter scraping & OSINT tool written in Python that doesn't use Twitter's API, allowing you to scrape a user's followers, following, Tweets and more while evading most API limitations.",8843
"akameco/PixivDeck","https://github.com/akameco/PixivDeck",":two_hearts: pixiv client for Desktop like TweetDeck :two_hearts:",401
"Xdynix/PixivPixie","https://github.com/Xdynix/PixivPixie","User-friendly Pixiv API based on PixivPy",19
"kiwibrowser/android","https://github.com/kiwibrowser/android","This repository is archived, and is now transferred to https://github.com/kiwibrowser/src",567
"crclayton/Flat-50G","https://github.com/crclayton/Flat-50G","A modern skin for the emu48 HP-50G emulator. ",19
"dgis/emu48android","https://github.com/dgis/emu48android","Emu48 for Android",18
"mkizka/MTDeck","https://github.com/mkizka/MTDeck","TweetDeckã‚’ã‚¹ãƒžãƒ›ã‚¢ãƒ—ãƒªã®ã‚ˆã†ã«ä½¿ãˆã‚‹ã‚ˆã†ã«ã™ã‚‹UserScript",7
"Rplus/Evangelion-Hexagon-style-calculator","https://github.com/Rplus/Evangelion-Hexagon-style-calculator","Evangelion Hexagon style calculator",2
"kgtkr/twitter-mute-sync","https://github.com/kgtkr/twitter-mute-sync",,2
"dutiyesh/chrome-extension-cli","https://github.com/dutiyesh/chrome-extension-cli","ðŸš€ The CLI for your next Chrome Extension",516
"w3c/danmaku","https://github.com/w3c/danmaku","Bullet Chatting Proposal",204
"internetarchive/liveweb","https://github.com/internetarchive/liveweb","Liveweb proxy of the Wayback Machine project",33
"egotter/egotter","https://github.com/egotter/egotter","egotter",23
"CCharlieLi/bookmark-parser","https://github.com/CCharlieLi/bookmark-parser","Find and parse Firefox/Chrome bookmark HTML and jsonlz4 file into useable JSON object or export as JSON file.",30
"nagix/mini-tokyo-3d","https://github.com/nagix/mini-tokyo-3d","A real-time 3D digital map of Tokyo's public transport system",1398
"upbit/pixivpy","https://github.com/upbit/pixivpy","Pixiv API for Python",988
"jeffersonbailey/web-archive-apis-workshop","https://github.com/jeffersonbailey/web-archive-apis-workshop","Scripts and such for workshops on web archive APIs",4
"iipc/openwayback","https://github.com/iipc/openwayback","The OpenWayback Development",370
"EzoeRyou/cpp-intro","https://github.com/EzoeRyou/cpp-intro","Beginner's guide for C++",530
"bwmarrin/discordgo","https://github.com/bwmarrin/discordgo"," (Golang) Go bindings for Discord",1694
"kawax/headless-chrome-google-login","https://github.com/kawax/headless-chrome-google-login",,2
"dls/house","https://github.com/dls/house","Haskell Operating System",88
"Just-Some-Bots/MusicBot","https://github.com/Just-Some-Bots/MusicBot",":musical_note: The original MusicBot for Discord (formerly SexualRhinoceros/MusicBot)",2179
"geekodour/twitmarks","https://github.com/geekodour/twitmarks","Twitter Bookmarks for the Web and Desktop - Browser Extension",18
"nagataniyoshiki/FDTD_language_comparison","https://github.com/nagataniyoshiki/FDTD_language_comparison","2-D FDTD - Language Comparison",14
"shiguredo/momo","https://github.com/shiguredo/momo","WebRTC Native Client Momo",430
"dc1394/SchracVisualize_Direct3D_11","https://github.com/dc1394/SchracVisualize_Direct3D_11","ã€ŒSchracã€ãªã©ã®è¨ˆç®—çµæžœã®ã‚¢ã‚¦ãƒˆãƒ—ãƒƒãƒˆãƒ•ã‚¡ã‚¤ãƒ«ã‚’èª­ã¿è¾¼ã¿ã€å¯è¦–åŒ–ã™ã‚‹ã‚³ãƒ¼ãƒ‰ã§ã™",7
"bolero-MURAKAMI/Sprout","https://github.com/bolero-MURAKAMI/Sprout","C++11/14 constexpr based Containers, Algorithms, Random numbers, Parsing, Ray tracing, Synthesizer, and others.",710
"0918nobita/Portfolio","https://github.com/0918nobita/Portfolio","ãƒãƒ¼ãƒˆãƒ•ã‚©ãƒªã‚ª",6
"zhanrnl/PyMusAnim","https://github.com/zhanrnl/PyMusAnim","Clone of Stephen Malinowski's Music Animation Machine in Python",22
"ArchiveBox/ArchiveBox","https://github.com/ArchiveBox/ArchiveBox","ðŸ—ƒ The open source self-hosted web archive. Takes browser history/bookmarks/Pocket/Pinboard/etc., saves HTML, JS, PDFs, media, and more...",7720
"sys-fork/helloworld_freestanding","https://github.com/sys-fork/helloworld_freestanding",,4
"joke2k/faker","https://github.com/joke2k/faker","Faker is a Python package that generates fake data for you.",11821
"internetarchive/wayback","https://github.com/internetarchive/wayback","IA's public Wayback Machine (moved from SourceForge)",421
"sunsetyuhi/fem_py","https://github.com/sunsetyuhi/fem_py","FEM programs written in Python 3.",6
"terjanq/JS-Alpha","https://github.com/terjanq/JS-Alpha","Funny project to create an encoder/obfuscator that converts any javascript code into a code that only consist of /[a-z().]/ characters",57
"pastpages/archiveis","https://github.com/pastpages/archiveis","A simple Python wrapper for the archive.is capturing service",133
"ShinyaKato/saizeriya-1000yen-knapsack","https://github.com/ShinyaKato/saizeriya-1000yen-knapsack","ã€Œã‚µã‚¤ã‚¼ãƒªãƒ¤ã§1000å††ã‚ã‚Œã°æœ€å¤§ä½•kcalæ‘‚ã‚Œã‚‹ã®ã‹ã€ã‚’å‹•çš„è¨ˆç”»æ³•ã§è§£ã„ã¦ã¿ãŸ",12
"microsoft/SPTAG","https://github.com/microsoft/SPTAG","A distributed approximate nearest neighborhood search (ANN) library which provides a high quality vector index build, search and distributed online serving toolkits for large scale vector search scenario.",3838
"stewartmcgown/uds","https://github.com/stewartmcgown/uds","Unlimited Drive Storage by splitting binary files into base64",4112
"stefano/wasm-forth","https://github.com/stefano/wasm-forth","A Forth implementation compiling to WebAssembly.",85
"bartobri/no-more-secrets","https://github.com/bartobri/no-more-secrets","A command line tool that recreates the famous data decryption effect seen in the 1992 movie Sneakers.",4793
"oitofelix/8f-userrpl-kernel","https://github.com/oitofelix/8f-userrpl-kernel","8F UserRPL Kernel",2
"scala-text/scala_text","https://github.com/scala-text/scala_text","Scalaå­¦ç¿’ç”¨ãƒ†ã‚­ã‚¹ãƒˆ",438
"Kasugaccho/DungeonTemplateLibrary","https://github.com/Kasugaccho/DungeonTemplateLibrary","ðŸŒ: Dungeon free resources (terrain & roguelike generation)",553
"o2sh/onefetch","https://github.com/o2sh/onefetch","Git repository summary on your terminal",2725
"kenkoooo/AtCoderProblems","https://github.com/kenkoooo/AtCoderProblems","Extend your AtCoder",645
"jiro4989/textimg","https://github.com/jiro4989/textimg","Command to convert from color text (ANSI or 256) to image.",61
"busyloop/lolcat","https://github.com/busyloop/lolcat","Rainbows and unicorns!",4324
"pastpages/savepagenow","https://github.com/pastpages/savepagenow","A simple Python wrapper for archive.org's ""Save Page Now"" capturing service",89
"ArchiveTeam/ArchiveBot","https://github.com/ArchiveTeam/ArchiveBot","ArchiveBot, an IRC bot for archiving websites",204
"leftCoast/RPN_Calculator","https://github.com/leftCoast/RPN_Calculator","Code for the RPN Calculator",5
"ArchiveTeam/grab-site","https://github.com/ArchiveTeam/grab-site","The archivist's web crawler: WARC output, dashboard for all crawls, dynamic ignore patterns",650
"chakravala/Grassmann.jl","https://github.com/chakravala/Grassmann.jl","âŸ¨Leibniz-Grassmann-CliffordâŸ© differential geometric algebra / multivector simplicial complex",276
