isbn_or_asin,book_title,author,publisher,published_date
4802611927,"Pythonによるスクレイピング&機械学習〈開発テクニック〉 : Scrapy,BeautifulSoup,scikit-learn,TensorFlowを使ってみよう",クジラ飛行机,ソシム,201901
4861823730,フェティシズム全書,ジャン・ストレフ／著 加藤雅郁／翻訳 橋本克己／翻訳,作品社,20160510
4022613440,長谷川町子思い出記念館,"長谷川,町子,1920-1992",朝日新聞社,200108
4861008670,"GUMI GRAPHIXXX : The virtual vocalist ""GUMI"" is the character of VOCALOID Megpoid. : GUMI 5th Anniversary Official Art Book",,ビー・エヌ・エヌ新社,201402
410610704X,フィリピンパブ嬢の社会学,"中島,弘象,1989-",新潮社,201702
4873114985,子どもが体験するべき50の危険なこと,"Tulley,Gever Spiegler,Julie 金井,哲夫,1958-",オーム社,201105
4873117518,Make:Analog Synthesizers,"Wilson,Ray,-2016 斉田,一樹,1981- 小池,実,1968- 高橋,達也,1982-",オーム社,201703
4652077904,スパイガール,"Carter, Ally,橋本, 恵, 1964-,アリー・カーター 作,橋本恵 訳",理論社,"Mon, 11 Jul 2022 21:50:04 +0900"
4837957765,全図解アメリカ海軍SEALのサバイバル・マニュアル,"Emerson,Clint 小林,朋子",三笠書房,201703
4837957854,全図解アメリカ海軍SEALのサバイバル・マニュアル 災害・アウトドア編,"Emerson,Clint 竹花,秀春",三笠書房,201712
4576180975,恐い間取り : 事故物件怪談,"松原,タニシ,1982-",二見書房,201807
4562040971,実戦スパイ技術ハンドブック,"Davies,Barry,1944- 伊藤,綺",原書房,200709
4480096302,数学をいかに教えるか,志村五郎／著,筑摩書房,20140801
4061399659,ビアンカ・オーバーステップ 下,"筒城,灯士郎,1989-",講談社,201703
4061399640,ビアンカ・オーバーステップ 上,"筒城,灯士郎,1989-",講談社,201703
4065141974,這い寄る混沌,"Lovecraft,HowardPhillips,1890-1937 森瀬,繚,1972-",講談社,201811
