isbn_or_asin,book_title,author,publisher,published_date
4065163188,未知なるカダスを夢に求めて,"Lovecraft,HowardPhillips,1890-1937 森瀬,繚,1972-",講談社,201909
4908468141,絶対に解けない受験世界史2,稲田義智／著,パブリブ,20170810
4784511016,絶対に解けない受験世界史 : 悪問・難問・奇問・出題ミス集,稲田義智 著,社会評論社,"Mon, 27 Oct 2014 18:49:13 +0900"
4150505489,行動経済学の逆襲 下,"Thaler,RichardH,1945- 遠藤,真美,1963-",早川書房,201910
4150505470,行動経済学の逆襲 上,"Thaler,RichardH,1945- 遠藤,真美,1963-",早川書房,201910
4166612417,総会屋とバブル,"尾島,正洋,1966-",文藝春秋,201911
4775300350,魔導具事典,"山北,篤,1960- 稲葉,義明,1970-",新紀元社,200112
4778316681,信長名鑑,"姫川,榴弾",太田出版,201911
4041035511,旧談,"根岸,守信,1737-1815 京極,夏彦,1963-",KADOKAWA,201601
4795244731,妖怪現わる : 現代妖怪談義,"中山, 市朗, 1959-,中山市朗 著",遊タイム出版,"Tue, 20 Sep 1994 09:00:00 +0900"
4758013241,拘束少女絵巻 学園編,,一迅社,201307
4758014140,拘束少女絵巻,,一迅社,"Fri, 16 Jan 2015 19:17:14 +0900"
4758013624,拘束少女絵巻 日本の歴史編,,一迅社,201404
4758014809,体育少女拘束絵巻,,一迅社,201602
4758012652,拘束少女絵巻 高潔編,,一迅社,201204
4758012113,拘束少女絵巻,,一迅社,201102
4837309127,モダリーナのファッションパーツ図鑑 : デザインの用語や特徴がイラストでわかる,"溝口,康彦 福地,宏子 數井,靖子",マール社,201907
4122065607,本で床は抜けるのか,"西牟田,靖,1970-",中央公論新社,201803
4041059291,外国人ヒットマン,"一橋,文哉",KADOKAWA,201909
4905158680,FANZA BOOK,FANZA／監修,スモール出版,20190730
4044000999,官能小説の奥義,"永田,守弘,1933-",KADOKAWA,201604
4331607739,女豹の危機 : 長篇ポリスミステリー,"竜, 一京, 1941-,龍一京 著",廣済堂出版,"Tue, 15 Aug 2000 00:05:00 +0900"
4062633604,アトポス,"島田,荘司,1948-",講談社,199610
4062632861,眠れぬ夜の殺人,"岡嶋, 二人,岡嶋二人 [著]",講談社,"Tue, 28 Jan 1997 09:00:00 +0900"
4048529080,それをなすもの : 「新世紀エヴァンゲリオン」コンセプトデザインワークス,"山下,いくと,1965-",角川書店ニュータイプ,199803
4791761030,天使の世界,"Godwin, Malcolm,大滝, 啓裕, 1952-,マルコム・ゴドウィン 著,大瀧啓裕 訳",青土社,"Wed, 1 Dec 2004 19:43:05 +0900"
4903713016,新世紀エヴァンゲリオン原画集 ,,,2000-12-22
4903713008,新世紀エヴァンゲリオン原画集,Gainax／著 庵野秀明／監修,ガイナックス,2000-10-14
4903713024,新世紀エヴァンゲリオン原画集 ,,,2001-03-30
4905033071,新世紀エヴァンゲリオンTVアニメーション設定資料集2015 edition,,グラウンドワークス,201508
4760150072,「舞姫」の主人公をバンカラとアフリカ人がボコボコにする最高の小説の世界が明治に存在したので20万字くらいかけて紹介する本,"山下, 泰平, 1977-,山下泰平 著",柏書房,"Thu, 15 Aug 2019 18:51:04 +0900"
4801303722,文豪たちの悪口本 文豪たちの悪口本,彩図社文芸部／編,彩図社,20190524
4756250122,陰翳礼讃,"谷崎,潤一郎,1886-1965 大川,裕弘",パイインターナショナル,201801
4905033209,ヱヴァンゲリヲン新劇場版: 破全記録全集 : 設定資料版,"轟木, 一騎,庵野秀明 企画・監修,轟木一騎 構成・編集,三好寛, 田渕浩久, 神村典子 編","カラー,グラウンドワークス (発売)","Sun, 24 Oct 2021 06:12:50 +0900"
4905033195,ヱヴァンゲリヲン新劇場版: 破全記録全集 : ビジュアルストーリー版,"轟木, 一騎,庵野秀明 企画・監修,轟木一騎 構成・編集,三好寛, 田渕浩久, 神村典子 編","カラー,グラウンドワークス (発売)","Thu, 15 Apr 2021 06:16:42 +0900"
4905033187,ヱヴァンゲリヲン新劇場版: 序全記録全集 : ビジュアルストーリー版・設定資料版,"轟木, 一騎,庵野秀明 企画・監修,轟木一騎 構成・編集,三好寛, 田渕浩久, 神村典子 編","カラー,グランドワークス (発売)","Thu, 26 Sep 2019 01:31:55 +0900"
4596550751,否定と肯定 : ホロコーストの真実をめぐる闘い,"Lipstadt,DeborahE 山本,やよい,1949-",ハーパーコリンズ・ジャパン,201711
4327452920,英文解体新書 : 構造と論理を読み解く英文解釈,,研究社,201907
4791769015,キャラの思考法 : 現代文化論のアップグレード,"さやわか,1974-",青土社,201512
4022505273,サザエさんパンダを見に行く : サザエさんをさがして その4,朝日新聞社,朝日新聞出版,200901
4022503556,またまたサザエさんをさがして,朝日新聞社,朝日新聞社,200711
4022502479,サザエさんをさがして その2,朝日新聞社,朝日新聞社,200612
402250076X,サザエさんをさがして,朝日新聞社,朝日新聞社,200512
4480098003,美少女美術史 人々を惑わせる究極の美,池上英洋／著 荒井咲紀／著,筑摩書房,20170606
4480096523,残酷美術史,池上英洋／著,筑摩書房,20141201
4480096515,官能美術史,池上英洋／著,筑摩書房,20141101
4309416837,グレン・グールド,"吉田,秀和,1913-2012",河出書房新社,201905
4865650075,『宅間守　精神鑑定書』を読む,飢餓陣営・佐藤幹夫／編,言視舎,20141225
4750513105,宅間守 精神鑑定書,岡江晃／著,亜紀書房,20130527
4101306354,残虐記,"桐野,夏生,1951-",新潮社,200708
4344410300,銀行籠城,"新堂, 冬樹, 1966-,新堂冬樹 [著]",幻冬舎,"Mon, 14 Apr 2008 18:13:15 +0900"
4062748851,魔笛,"野沢,尚,1960-2004",講談社,200409
0582237521,Longman dictionary of common errors,"Turton, Nigel D.,Heaton, J. B. (John Brian),N D Turton and J B Heaton",Longman,"Thu, 21 Sep 2023 08:21:44 +0900"
4905325137,現代アニメ「超」講義,,第二次惑星開発委員会／PLANETS,20190630
4768308856,ヒロイン専用スーツ・武器の作りかた = HOW TO MAKE HEROINE SUITS AND WEAPONS,"西脇,直人,1971- 梅森,充 桜田,美和子",玄光社,201708
4480082344,グレン・グールド　孤独のアリア,ミシェル・シュネデール／著 千葉文夫／翻訳,筑摩書房,19950101
404892477X,姉なるもの = The sister of the woods with a Thousand Young 1,"飯田,ぽち",KADOKAWA,201612
4758013551,川村敏江東映アニメーションプリキュアワークス = KAWAMURA TOSHIE TOEI ANIMATION PRECURE WORKS,"川村,敏江",一迅社,201402
4758014221,高橋晃東映アニメーションプリキュアワークス = TAKAHASHI AKIRA TOEI ANIMATION PRECURE WORKS,"高橋,晃,1971-",一迅社,201503
4758015155,香川久東映アニメーションプリキュアワークス = KAGAWA HISASHI TOEI ANIMATION PRECURE WORKS,"香川,久,1963-",一迅社,201608
4758016364,宮本絵美子東映アニメーションプリキュアワークス,"宮本, 絵美子,宮本絵美子 画,東映アニメーション株式会社 監修","一迅社,講談社 (発売)","Thu, 11 Jul 2019 20:18:36 +0900"
433605777X,定本何かが空を飛んでいる,"稲生,平太郎,1954-",国書刊行会,201311
4861826500,夢と幽霊の書,アンドルー・ラング／著 ないとうふみこ／翻訳 吉田篤弘／解説,作品社,20170821
4802611927,"Pythonによるスクレイピング&機械学習〈開発テクニック〉 : Scrapy,BeautifulSoup,scikit-learn,TensorFlowを使ってみよう",クジラ飛行机,ソシム,201901
4896942523,西欧中世宝石誌の世界 : アルベルトゥス・マグヌス『鉱物書』を読む,"Albertus, 1193?-1280,大槻, 真一郎, 1926-2016,澤元, 亙, 1965-,アルベルトゥス・マグヌス [著],大槻真一郎 著,澤元亙 編",八坂書房,"Wed, 12 Sep 2018 07:10:39 +0900"
4861823730,フェティシズム全書,ジャン・ストレフ／著 加藤雅郁／翻訳 橋本克己／翻訳,作品社,20160510
4022613440,長谷川町子思い出記念館,"長谷川,町子,1920-1992",朝日新聞社,200108
4861008670,"GUMI GRAPHIXXX : The virtual vocalist ""GUMI"" is the character of VOCALOID Megpoid. : GUMI 5th Anniversary Official Art Book",,ビー・エヌ・エヌ新社,201402
410610704X,フィリピンパブ嬢の社会学,"中島,弘象,1989-",新潮社,201702
4873114985,子どもが体験するべき50の危険なこと,"Tulley,Gever Spiegler,Julie 金井,哲夫,1958-",オーム社,201105
4873117518,Make:Analog Synthesizers,"Wilson,Ray,-2016 斉田,一樹,1981- 小池,実,1968- 高橋,達也,1982-",オーム社,201703
4652077904,スパイガール,"Carter, Ally,橋本, 恵, 1964-,アリー・カーター 作,橋本恵 訳",理論社,"Mon, 11 Jul 2022 21:50:04 +0900"
4562051256,英国の幽霊伝説 : フォト・ストーリー : ナショナル・トラストの建物と怪奇現象,"Evans,Siân 村上,リコ 田口,未和",原書房,201501
4837957765,全図解アメリカ海軍SEALのサバイバル・マニュアル,"Emerson,Clint 小林,朋子",三笠書房,201703
4837957854,全図解アメリカ海軍SEALのサバイバル・マニュアル 災害・アウトドア編,"Emerson,Clint 竹花,秀春",三笠書房,201712
4576180975,恐い間取り : 事故物件怪談,"松原,タニシ,1982-",二見書房,201807
4562040971,実戦スパイ技術ハンドブック,"Davies,Barry,1944- 伊藤,綺",原書房,200709
4480096302,数学をいかに教えるか,志村五郎／著,筑摩書房,20140801
4061399659,ビアンカ・オーバーステップ 下,"筒城,灯士郎,1989-",講談社,201703
4061399640,ビアンカ・オーバーステップ 上,"筒城,灯士郎,1989-",講談社,201703
4065141974,這い寄る混沌,"Lovecraft,HowardPhillips,1890-1937 森瀬,繚,1972-",講談社,201811
