isbn_or_asin,book_title,author,publisher,published_date
4535540489,データ駆動型回帰分析 : 計量経済学と機械学習の融合,"末石 直也,末石 直也 著・文・その他","日本評論社,日本評論社","Mon, 26 Feb 2024 00:44:29 +0900"
4254161395,Pythonによる気象・気候データ解析Ⅱ : スペクトル解析・EOFとSVD・統計検定と推定,"神山 翼,神山 翼 著・文・その他","朝倉書店,朝倉書店","Mon, 19 Feb 2024 00:39:34 +0900"
4254161387,Pythonによる気象・気候データ解析Ⅰ : Pythonの基礎・気候値と偏差・回帰相関分析,"神山 翼,神山 翼 著・文・その他","朝倉書店,朝倉書店","Mon, 19 Feb 2024 00:39:34 +0900"
4480512233,ガロアの夢 群論と微分方程式,久賀道郎／本文,筑摩書房,20231211
4635140075,感謝されない医者 : ある凍傷Dr.のモノローグ,"金田,正樹,1946-2019",山と溪谷社,200703
4798069744,ストレンジコード,"Ronald T. Kneusel,水野貴明,竹迫良範,Ronald T. Kneusel 著・文・その他,水野貴明 翻訳,竹迫良範 監修","秀和システム,秀和システム","Mon, 19 Feb 2024 00:39:43 +0900"
4908686165,プログラマーのためのCPU入門 : CPUは如何にしてソフトウェアを高速に実行するか,"Tani, Takenobu,Takenobu Tani著",ラムダノート,"Fri, 15 Dec 2023 14:10:48 +0900"
4313180656,公務員の議会答弁言いかえフレーズ,"森下,寿",学陽書房,202110
4863544332,改訂新版 インフラエンジニアの教科書,佐野裕／著,シーアンドアール研究所,20231114
4560096392,ヨーロッパ中世象徴史,"Pastoureau,Michel,1947- 篠田,勝英,1948-",白水社,201805
4901007092,家政婦は見られた! : 土曜ワイド劇場(テレビ朝日系列)家政婦は見た!公式ガイドブック,"柴, 英三郎, 1926-,大沢家政婦研究所,柴英三郎 監修,大沢家政婦研究所 編",音羽出版,"Sat, 20 Mar 2010 08:59:59 +0900"
432745317X,読解のための上級英文法,田上芳彦／著,研究社,20231225
4815618593,体験しながら学ぶ ネットワーク技術入門,みやたひろし／著,ＳＢクリエイティブ,20240113
484437849X,はじめて学ぶバイナリ解析 : 不正なコードからコンピュータを守るサイバーセキュリティ技術,"小林, 佐保,岡田, 怜士,浅部, 佑,満永, 拓邦,小林佐保, 岡田怜士, 浅部佑, 満永拓邦 著","インプレスR&D,インプレス (発売)","Fri, 16 Oct 2020 04:54:12 +0900"
4594062539,マンガけもの道 : まんだらけ中野店副店長の珍作発掘探訪,"岩井, 道,岩井道 著",扶桑社,"Wed, 13 Oct 2010 00:10:12 +0900"
4320115589,組合せゲーム理論の世界 : 数学で解き明かす必勝法,安福智明／著 坂井公／著 末續鴻輝／著,共立出版,20240228
4469244082,これでいいのか大学入試英語 下,"Watkins,Gareth",大修館書店,199710
4469244074,これでいいのか大学入試英語 上,"Watkins,Gareth",大修館書店,199710
4309419267,屋根裏に誰かいるんですよ。 : 都市伝説の精神病理,"春日,武彦,1951-",河出書房新社,202210
4044003505,カクレキリシタン : 現代に生きる民俗信仰,"宮崎,賢太郎,1950-",KADOKAWA,201802
4295013498,スーパーユーザーなら知っておくべきLINUXシステムの仕組み,"Ward,Brian,1972- 柴田,芳樹,1959-",インプレス,202203
4094083359,実録死体農場,"Bass, William M,Jefferson, Jon,相原, 真理子, 1947-2010,ビル・バス, ジョン・ジェファーソン 著,相原真理子 訳",小学館,"Thu, 24 Jan 2013 07:02:29 +0900"
4775313010,図解魔術の歴史,"草野,巧,1956-",新紀元社,201503
4814400586,Rustの練習帳 : コマンドラインツールの作成を通してRustを学ぶ,KenYouens-Clark／著 中山光樹／翻訳,オライリー・ジャパン,20240118
4876872112,鉄道重大事故の歴史,"久保田,博,1924-",グランプリ出版,200006
4876874123,鉄道重大事故の歴史―鉄道事故に見る安全技術の進化,久保田博／著,グランプリ出版,20231212
4562053151,悪魔と悪魔学の事典,"Guiley,Rosemary 金井,美子 木村,浩美 白須,清美,1969-",原書房,201604
490868605X,数式組版,"木枝, 祐介,木枝祐介 著",ラムダノート,"Wed, 13 Jun 2018 18:33:52 +0900"
4780607892,線形代数学,"溝畑,潔 多久和,英樹 浦部,治一郎,1950-",学術図書出版社,201912
4768705251,アントンのやさしい線型代数,"Anton, Howard,山下, 純一, 1948-,H.アントン 著,山下純一 訳",現代数学社,"Mon, 10 Feb 2020 18:58:14 +0900"
4874249582,言語教育における多読,I.S.P.Nation／著 RobWaring／著 MitsueTabata-Sandom／監修 ほか,くろしお出版,20231025
4789837513,ディジタル回路の設計入門 : ハードウェアの動きを理解しながら学ぶ,湯山俊夫,CQ出版,2005-4-1
481440042X,ポートスキャナ自作ではじめるペネトレーションテスト : Linux環境で学ぶ攻撃者の思考,株式会社ステラセキュリティ小竹泰一／著,オライリー・ジャパン,20230920
4274229629,仕事ですぐに使える!DaVinci Resolveによる動画編集,"小寺,信良,1963-",オーム社,202211
4478117764,大学図鑑! 2024,,ダイヤモンド社,202303
4759823522,殺人は容易ではない : アガサ・クリスティーの法科学,CarlaValentine／著 久保美代子／翻訳,化学同人,20231218
4041083265,ゴーストリイ・フォークロア = ghostly folklore : 17世紀～20世紀初頭の英国怪異譚,"南条,竹則,1958-",KADOKAWA,202001
4906529925,信州の秘境駅・小駅を巡る : 近代化から過疎化への100年旅,"久保田,稔,1960-",川辺書林,202203
4299042387,クセがスゴい不動産,あなたの理想不動産,宝島社,202306
4802213050,秘境駅で途方に暮れた,"カベルナリア吉田,1965-",イカロス出版,202306
0071752064,Practice Makes Perfect English Articles and Determiners Up Close,Mark Lester,McGraw Hill Professional,2013-08-07
4791111168,発達障害の精神病理 4,"内海,健,1955- 兼本,浩祐,1957-",星和書店,202306
4480056599,読み書きの技法,"小河原, 誠, 1947-,小河原誠 著",筑摩書房,"Tue, 30 Jul 1996 09:00:00 +0900"
4309416845,日本の偽書,"藤原,明,1958-",河出書房新社,201905
4798179809,なっとく!関数型プログラミング : 関数型プログラミングの基本概念の全容を把握し活用したい開発者に,"Płachta,Michał クイープ",翔泳社,202308
1837639965,Architecture and Design of the Linux Storage Stack: Gain a Deep Understanding of the Linux Storage Landscape and Its Well-coordinated Layers,Muhammad Umer,Packt Publishing,2023-07
4905033314,プロジェクト・シン・エヴァンゲリオン : 実績・省察・評価・総括,"カラー,カラー 編","カラー,グラウンドワークス","Thu, 10 Aug 2023 06:20:19 +0900"
4065324017,プリキュアコスチュームクロニクル = Precure Costume Chronicle : プリキュア20周年アニバーサリー,東映アニメーション株式会社,講談社,202310
9811379661,"Kawaii engineering : measurements, evaluations, and applications of attractiveness","大倉, 典子,Michiko Ohkura, editor",Springer,"Thu, 21 Sep 2023 08:21:44 +0900"
4309419690,日本怪談実話,"田中,貢太郎,1880-1941",河出書房新社,202306
4309419712,戦前のこわい話 : 怪奇実話集,"志村,有弘,1941-",河出書房新社,202306
481440039X,RustとWebAssemblyによるゲーム開発 : 安全・高速・プラットフォーム非依存のWebアプリ開発入門,"Smith,Eric 中田,秀基,1967-",オーム社 (発売),202307
4800307961,元報道記者が見た昭和事件史 : 歴史から抹殺された惨劇の記録,"石川,清,1964-",洋泉社,201511
4814400225,プログラミング文体練習 : Pythonで学ぶ40のプログラミングスタイル,"Lopes,CristinaVideira 菊池,彰",オーム社 (発売),202306
4863135629,絶対に停まらない世界の廃墟駅,"Ross,David(DavidSoutherland) 大島,聡子",日経BPマーケティング (発売),202305
4883673790,デジタルアーカイブの理論と実践 : デジタルアーキビスト入門,"井上,透,1952- 大井,将生 細川,季穂 日本デジタルアーキビスト資格認定機構",樹村房,202304
4761101857,仙人ワンダーランド : 和漢仙人列伝,"影山,純夫,1947-",河原書店,202305
4797681217,亜宗教 : オカルト、スピリチュアル、疑似科学から陰謀論まで,"中村,圭志,1958-",集英社 (発売),202304
4390114956,フランス怪奇民話集,"植田, 祐次, 1936-,山内, 淳, 1951-,植田祐次, 山内淳 訳編",社会思想社,"Wed, 30 Mar 1994 09:00:00 +0900"
4794226144,映画を追え : フィルムコレクター歴訪の旅,"山根,貞男,1939-",草思社,202302
4837967701,あなたの知らない「ヘン」な法律,"なかむら,いちろう",三笠書房,201512
487502553X,キルヒャーの世界図鑑 : よみがえる普遍の夢,"Godwin,Joscelyn,1945- 川島,昭夫,1950-2020",工作舎,202303
4295003255,新人エンジニアのためのインフラ入門,"BFT,BFT 著",インプレス,"Mon, 9 Apr 2018 23:56:19 +0900"
4788517981,２ちゃん化する世界,石井大智／編著 清義明／著 安田峰俊／著 藤倉善郎／著,新曜社,20230222
4865280685,わたしが先生の「ロリータ」だったころ,アリソン・ウッド／著者 服部理佳／訳者,左右社,20220307
4798068160,"Good Code,Bad Code : 持続可能な開発のためのソフトウェアエンジニア的思考","Long,Tom 秋,勇紀 高田,新山 山本,大祐,1983-",秀和システム,202302
1680502549,Domain modeling made functional : tackle software complexity with domain-driven design and F♯,"Wlaschin, Scott,MacDonald, Brian,Scott Wlaschin",The Pragmatic Bookshelf,"Thu, 21 Sep 2023 08:21:44 +0900"
0312383215,What people wore when : a complete illustrated history of costume from ancient times to the nineteenth century for every level of society,"Leventon, Melissa,Melissa Leventon",St. Martin's Griffin,"Thu, 21 Sep 2023 08:21:44 +0900"
4296111914,電子工作パーツ制御完全攻略 : ラズパイ自由自在,"松岡,貴志 日経BP",日経BPマーケティング (発売),202203
4562071990,ポワロと私 : デビッド・スーシェ自伝,"Suchet,David,1946- Wansell,Geoffrey,1945- ほか",原書房,202210
4562072547,世界を騙した女詐欺師たち,"Telfer,Tori 富原,まさ江,1965-",原書房,202302
3031004418,General Game Playing,"Michael Genesereth,Michael Thielscher",Springer,2014-03-18
4839967091,囲碁ディープラーニングプログラミング,"Pumperla,Max Ferguson,Kevin 山岡,忠夫",マイナビ出版,201904
4309460631,ホームズ贋作展覧会,"各務, 三郎, 1936-,各務三郎 編",河出書房新社,"Thu, 5 Oct 1989 09:00:00 +0900"
0321842685,Hacker's delight,"Warren, Henry S.,Henry S. Warren, Jr",Addison-Wesley,"Thu, 21 Sep 2023 08:21:44 +0900"
4814400160,自分だけのボードゲームを作ろう : ゲームをデザインして、作って、みんなでプレイする,"Daniels,JesseTerrance 金井,哲夫,1958-",オーム社 (発売),202212
4480438319,神田神保町書肆街考,鹿島茂／著,筑摩書房,20221013
4910612041,大学院・大学編入のための応用数学 : 基本事項の整理と問題演習および入試問題研究,"桜井,基晴",プレアデス出版,202209
4787210130,ボンデージ進化論,北原童夢／著,青弓社,19920401
4816357688,オールカラー普通免許〈ひっかけ対策〉問題集 : そのまま本試験,,ナツメ社,201502
4758017832,中谷友紀子東映アニメーションプリキュアワークス = Nakatani Yukiko TOEI ANIMATION PRECURE WORKS 2,"中谷,友紀子,1986-",講談社 (発売),202210
4274227170,縫うコンピュータグラフィックス : ぬいぐるみから学ぶ3DCGとシミュレーション,"五十嵐,悠紀,1982-",オーム社,202105
4297130343,リアルタイムグラフィックスの数学 = Mathematics of Real-Time Graphics : GLSLではじめるシェーダプログラミング,"巴山,竜来,1982-",技術評論社,202209
4121506197,サラブレッドに「心」はあるか,"楠瀬,良,1951-",中央公論新社,201804
4758017115,高橋晃東映アニメーションプリキュアワークス = : TAKAHASHI AKIRA TOEI ANIMATION PRECURE WORKS,"高橋,晃,1971-",講談社 (発売),202102
479806338X,最新アニメ業界の動向とカラクリがよ～くわかる本 : 業界人、就職、転職に役立つ情報満載,"谷口,功,1954- 麻生,はじめ,1955-",秀和システム,202012
4907162219,魔術の文法学 : Japanese edition,"前野, 佳彦,前野佳彦 著",テクネ,"Tue, 9 Dec 2014 20:48:21 +0900"
4295000965,Goプログラミング実践入門 : 標準ライブラリでゼロからWebアプリを作る,"鄭,兆雄 武舎,広幸 阿部,和也 上西,昌弘",インプレス,201703
4774146129,C言語入門書の次に読む本,"坂井,弘亮,1973-",技術評論社,201105
4873119693,実用Go言語 : システム開発の現場で知っておきたいアドバイス,"渋川,よしき 辻,大志郎,1990- 真野,隼記,1986-",オーム社 (発売),202204
4101311013,河童が覗いたヨーロッパ,"妹尾,河童,1930-",新潮社,198307
4065250390,アート展「初音ミク・クロニクル」公式ビジュアルブック,,講談社,202110
479862750X,塗りフェチ事典 : リアルな肉感キャラを描く! 女の子編,ホビージャパン,ホビージャパン,202202
4866808136,あなたを陰謀論者にする言葉,"雨宮,純",フォレスト出版,202110
4635047520,遊歩大全,"Fletcher, Colin, 1922-2007,芦沢, 一洋, 1938-1996,コリン・フレッチャー 著,芦沢一洋 訳",山と溪谷社,"Thu, 10 Jan 2013 23:21:11 +0900"
4327452831,文芸翻訳教室,"越前,敏弥,1961-",研究社,201804
4065267757,みんなのユニバーサル文章術 : 今すぐ役に立つ「最強」の日本語ライティングの世界,"安田,峰俊",講談社 (発売),202201
4802207174,赤羽駅周辺の失われし鉄路を求めて : 特集,,イカロス出版,"Thu, 21 Sep 2023 08:21:44 +0900"
4802207921,消散軌道風景 : あなたの知らない鉄道考古学,岡本憲之 総合プロデューサー,イカロス出版,"Mon, 2 Mar 2020 23:25:04 +0900"
4802208731,消散軌道風景 : あなたの知らない鉄道考古学,岡本憲之 総合プロデューサー,イカロス出版,"Fri, 21 Aug 2020 23:21:44 +0900"
4802210280,廃線系鉄道考古学 : あなたの知らない消散軌道風景.,岡本憲之 総合プロデューサー,イカロス出版,"Fri, 13 Aug 2021 19:14:41 +0900"
4062177358,究極のナローゲージ鉄道 : せまい鉄路の記録集,"岡本,憲之,1968-",講談社,201205
486320146X,実録鉄道連隊 : 知られざるその使命を解き明かす : 創設から終焉、路線から車両まで…,,イカロス出版,"Thu, 16 Nov 2023 20:26:30 +0900"
4533039812,"全国鉱山鉄道 : 鉄道の原点""ヤマ""軌道をもとめて","岡本,憲之,1968-",JTB,200110
4802209525,廃線系鉄道考古学 : あなたの知らない消散軌道風景.,岡本憲之 総合プロデューサー,イカロス出版,"Fri, 16 Apr 2021 00:20:06 +0900"
4802211015,廃線系鉄道考古学 : あなたの知らない消散軌道風景 2022Vol.3,,イカロス出版,202202
0764574817,Reversing : secrets of reverse engineering,"Eilam, Eldad,Eldad Eilam ; [foreward by Elliot Chikofsky]",Wiley,"Thu, 21 Sep 2023 08:21:44 +0900"
4065250455,なぜオナニーはうしろめたいのか,"赤川,学,1967- 小堀,善友,1975- シオリーヌ,1991- 典雅",講談社 (発売),202110
4863542755,組込みエンジニアの教科書 = The textbook of the Embedded engineer,"渡辺,登,pub.2019 牧野,進二",シーアンドアール研究所,201904
4106035952,拷問と処刑の西洋史,"浜本,隆志,1944-",新潮社,200712
4000298739,松坂和夫数学入門シリーズ = Kazuo Matsuzaka's Introduction to Mathematics 3,"松坂,和夫,1927-2012",岩波書店,201811
4798164739,ゲームメカニクス大全 : ボードゲームに学ぶ「おもしろさ」の仕掛け,"Engelstein,Geoffrey Shalev,Isaac 小野,卓也",翔泳社,202010
4866365366,ライトノベルの新・潮流 = LIGHT NOVEL NEW TIDE CURRENT : 黎明期→2021,"石井,ぜんじ 太田,祥暉,1996- 松浦,恵介,1980-",スタンダーズ,202201
4863543638,OSSライセンスを正しく理解するための本 = Understand the Open Source Software License Correctly,"姉崎,章博",シーアンドアール研究所,202111
4839977607,AWSではじめるクラウド開発入門 : コードを書いて学ぶエンジニア・科学者のためのハンズオン教材,"真野,智之",マイナビ出版,202109
4864718652,スーパーナチュラル・ウォー : 第一次世界大戦と驚異のオカルト・魔術・民間信仰,"Davies,Owen,1969- 江口,之隆,1958-",ヒカルランド,202004
4010377275,総合的研究問題文の読み取り方-数学1・A・2・B : 大学受験,,旺文社,202108
4150315000,異常論文,"樋口,恭介,1989-",早川書房,202110
4909466010,エヴァンゲリオンイラスト集 : 2007-2017,"「エヴァンゲリオンイラスト集2007-2017」編集部 編,カラー 監修",グラウンドワークス,"Wed, 25 Sep 2019 22:28:05 +0900"
4044006261,もっとヘンな論文,サンキュータツオ,KADOKAWA,202007
4044003343,ヘンな論文,サンキュータツオ,KADOKAWA,201711
4061975978,新約聖書外典,"荒井,献,1930-",講談社,199712
4046043938,"奇書の世界史 : 歴史を動かす""ヤバい書物""の物語","三崎,律日,1990-",KADOKAWA,201908
4426624096,世界の奇書 : 総解説,,自由国民社,199804
4480510443,キリスト教の幼年期,エチエンヌ・トロクメ／著 加藤隆／翻訳,筑摩書房,20210812
4151845518,ブート・バザールの少年探偵,"Anappara,Deepa 坂本,あおい",早川書房,202104
4151201009,地下鉄道,"Whitehead,Colson,1969- 谷崎,由依",早川書房,202010
4863134940,世界の幽霊出現録,"Innes,Brian,1928-2014 大島,聡子",日経BPマーケティング (発売),202108
4065135060,プリキュアコスチュームクロニクル = Precure Costume Chronicle : プリキュア15周年アニバーサリー,東映アニメーション株式会社,講談社,201810
4777519651,Java将棋のアルゴリズム : アルゴリズムの強化手法を探る,"池, 泰弘, 1971-,工学社,池泰弘 著,I O編集部 編集",工学社,"Mon, 12 Sep 2016 20:34:45 +0900"
4880655066,ダム建設と地域住民補償,古賀邦雄／著,水曜社,20210624
4767827779,すごいエスカレーター = SUPER ESCALATORS,"田村,美葉,1984-",エクスナレッジ,202009
4344983874,子どものまま中年化する若者たち : 根拠なき万能感とあきらめの心理,"鍋田,恭孝,1947-",幻冬舎,201507
4000298313,代数への出発,"松坂,和夫,1927-2012",岩波書店,201503
4314011521,中古典のすすめ,"斉藤,美奈子,1956-",紀伊國屋書店,202009
4905924405,19人の阿部定,"桑原, 稲敏, 1939-1993,桑原稲敏 著",現代書林,"Tue, 26 Jan 1982 09:00:00 +0900"
4865280111,戦前尖端語辞典,平山亜佐子／著・編集 山田参助／絵・漫画,左右社,20210131
4047308382,闇に這う者 = THE HAUNTER OF THE DARK : ラヴクラフト傑作集,"田邊,剛,1975-",KADOKAWA,201604
4757735804,アウトサイダー,"田邊,剛,1975-",エンターブレイン,200707
4839971056,マンガで学ぶ恐竜の生態,"金,渡潤 渡辺,麻土香",マイナビ出版,202005
433403795X,テキヤはどこからやってくるのか? : 露店商いの近現代を辿る,"厚,香苗,1975-",光文社,201404
4480098682,精講　漢文,前野直彬／著,筑摩書房,20180808
4480435921,「読まなくてもいい本」の読書案内,橘玲／著,筑摩書房,20190509
4040647343,VISIONS : ILLUSTRATORS BOOK 2021,ピクシブ株式会社,KADOKAWA,202011
4569841090,マルチ・ポテンシャライト : 好きなことを次々と仕事にして、一生食っていく方法,"Wapnick,Emilie 長澤,あかね",PHP研究所,201809
4044006202,自閉症は津軽弁を話さない : 自閉スペクトラム症のことばの謎を読み解く,"松本,敏治,1957-",KADOKAWA,202009
404735483X,時を超える影 : ラヴクラフト傑作集 2,"Lovecraft,HowardPhillips,1890-1937 田邊,剛,1975-",KADOKAWA,201901
4150505691,津波の霊たち : 3・11死と生の物語,"LloydParry,Richard,1969- 濱野,大道",早川書房,202101
4122052424,ピアニストという蛮族がいる,"中村,紘子,1944-2016",中央公論新社,200912
4635048861,マタギ奇談,"工藤,隆雄,1953-",山と溪谷社,202007
4480028188,路上観察学入門,赤瀬川原平／著 藤森照信／著 南伸坊／編集,筑摩書房,19930101
4480087044,快読１００万語！ペーパーバックへの道,酒井邦秀／著,筑摩書房,20020601
4315523275,"マス・アート : 真理,美,そして方程式","Ornes,Stephen 巴山,竜来,1982- 赤池,ともえ",ニュートンプレス,202102
4863134975,西洋アンティーク・ボードゲーム : 19世紀に愛された遊びの世界,"Seville,Adrian 鍋倉,僚介",日経BPマーケティング (発売),202101
4562059079,図説世界地下名所百科 : イスタンブールの沈没宮殿、メキシコの麻薬密輸トンネルから首都圏外郭放水路まで,"Fitch,Chris,1988- 上京,恵",原書房,202102
4802612168,Pythonでいかにして暗号を破るか : 古典暗号解読プログラムを自作する本,"Sweigart,Al IPUSIRON,1979-",ソシム,202101
4535606137,数学の言葉づかい100 : 数学地方のおもしろ方言,数学セミナー編集部,日本評論社,199904
4844379038,入門GUI : Webブラウザで作る本格インタラクション,"hashrock,daiiz,miyaoka,f_subal,hashrock, daiiz, miyaoka, f_subal 著","インプレスR&D,インプレス","Wed, 25 Jan 2023 06:16:45 +0900"
4299004507,塀の中の元極道YouTuberが明かすヤクザの裏知識,"懲役,太郎",宝島社,202006
4309228038,まじないの文化史 : 見るだけで楽しめる! : 日本の呪術を読み解く,新潟県立歴史博物館,河出書房新社,202005
4254102739,人間の許容限界事典,"山崎,昌廣,1953- 坂本,和義 関,邦博,1944-",朝倉書店,201507
4750516597,地下世界をめぐる冒険,ウィル・ハント／著 棚橋志行／翻訳,亜紀書房,20200826
4760151931,世界でいちばん虚無な場所 : 旅行に幻滅した人のためのガイドブック,"Rudd,Damien,1984- 菅野,楽章,1988-",柏書房,202004
4488564100,日本怪奇実話集 : 亡者会,"東,雅夫,1958-",東京創元社,202009
4044005907,日本俗信辞典 動物編,"鈴木,棠三,1911-1992",KADOKAWA,202004
4044005915,日本俗信辞典 植物編,"鈴木,棠三,1911-1992",KADOKAWA,202006
4044005303,贋札の世界史,"植村,峻,1935-",KADOKAWA,202003
4044005478,オノマトペ : 擬音語・擬態語の世界,"小野,正弘",KADOKAWA,201912
4140840412,将棋界奇々快々,"河口, 俊彦, 1936-2015,河口俊彦 著",日本放送出版協会,"Tue, 3 Feb 2015 07:04:14 +0900"
4389201395,ひとりで学べる地学,,清水書院,201909
4839970491,マンガで学ぶ昆虫の進化,"金,渡潤 山口,裕美子,pub.2020",マイナビ出版,202005
4480098844,中世の覚醒,リチャード・Ｅ．ルーベンスタイン／著 小沢千重子／翻訳,筑摩書房,20181010
4635320146,マタギ奇談,"工藤,隆雄,1953-",山と溪谷社,201610
448006513X,完全教祖マニュアル,架神恭介／著 辰巳一世／著,筑摩書房,20091101
4621063014,暗号の代数理論,"Koblitz, Neal,林, 彬,シュプリンガージャパン,N. コブリッツ著 ; 林彬訳 ; シュプリンガー・ジャパン編集",丸善出版,"Thu, 21 Sep 2023 08:21:44 +0900"
4781617417,ダークウェブ・アンダーグラウンド : 社会秩序を逸脱するネット暗部の住人たち,"木澤,佐登志,1988-",イースト・プレス,201901
4774197076,超有名進学校生の数学的発想力 : 日本最高峰の頭脳に迫る,"吉田, 信夫, 1977-,アップ,吉田信夫 著,アップ 編集",技術評論社,"Sat, 16 Jun 2018 01:18:59 +0900"
4041080606,怪と幽 = KWAI & yoo vol.003,,KADOKAWA,201912
4041080592,怪と幽 = KWAI & yoo vol.002,,KADOKAWA,201908
4041080584,怪と幽 = KWAI & yoo vol.001,,KADOKAWA,201904
4041091152,怪と幽 = KWAI & yoo vol.004,,KADOKAWA,202004
4286210456,1日30分であなたも現代の魔術師になれる : 混沌魔術入門,"黒野, 忍, 1971-,黒野忍 著",文芸社,"Mon, 6 Apr 2020 18:39:14 +0900"
4799325469,越前敏弥の日本人なら必ず誤訳する英文,越前敏弥 [著],ディスカヴァー・トゥエンティワン,"Mon, 30 Sep 2019 21:59:12 +0900"
4596551537,スパイダー・ネットワーク : 金融史に残る詐欺事件-LIBORスキャンダルの全内幕,"Enrich,David,1979- 高崎,拓哉,1979-",ハーパーコリンズ・ジャパン,202003
4047358533,クトゥルフの呼び声 = THE CALL OF CTHULHU : ラヴクラフト傑作集,"Lovecraft,HowardPhillips,1890-1937 田邊,剛,1975-",KADOKAWA,201912
4047299111,魔犬 = THE HOUND and Other Stories : ラヴクラフト傑作集,"田邊,剛,1975-",KADOKAWA,201409
4047352888,時を超える影 : ラヴクラフト傑作集 1,"Lovecraft,HowardPhillips,1890-1937 田邊,剛,1975-",KADOKAWA,201808
4047308048,異世界の色彩 = THE COLOUR OUT OF SPACE : ラヴクラフト傑作集,"田邊,剛,1975-",KADOKAWA,201510
4047283169,狂気の山脈にて = AT THE MOUNTAINS OF MADNESS : ラヴクラフト傑作集 1,"田邊,剛,1975-",KADOKAWA,201610
448009637X,居酒屋の誕生,飯野亮一／著,筑摩書房,20140801
4480433600,幕末単身赴任　下級武士の食日記　増補版,青木直己／著,筑摩書房,20160907
