isbn_or_asin,book_title,author,publisher,published_date
4635140075,感謝されない医者 : ある凍傷Dr.のモノローグ,"金田,正樹,1946-2019",山と溪谷社,200703
4798069744,ストレンジコード,"Ronald T. Kneusel,水野貴明,竹迫良範,Ronald T. Kneusel 著・文・その他,水野貴明 翻訳,竹迫良範 監修","秀和システム,秀和システム","Fri, 2 Feb 2024 00:38:12 +0900"
4908686165,プログラマーのためのCPU入門 : CPUは如何にしてソフトウェアを高速に実行するか,"Tani, Takenobu,Takenobu Tani著",ラムダノート,"Fri, 15 Dec 2023 14:10:48 +0900"
4313180656,公務員の議会答弁言いかえフレーズ,"森下,寿",学陽書房,202110
4560096392,ヨーロッパ中世象徴史,"Pastoureau,Michel,1947- 篠田,勝英,1948-",白水社,201805
4901007092,家政婦は見られた! : 土曜ワイド劇場(テレビ朝日系列)家政婦は見た!公式ガイドブック,"柴, 英三郎, 1926-,大沢家政婦研究所,柴英三郎 監修,大沢家政婦研究所 編",音羽出版,"Sat, 20 Mar 2010 08:59:59 +0900"
4815618593,体験しながら学ぶ ネットワーク技術入門,みやたひろし／著,ＳＢクリエイティブ,20240113
484437849X,はじめて学ぶバイナリ解析 : 不正なコードからコンピュータを守るサイバーセキュリティ技術,"小林, 佐保,岡田, 怜士,浅部, 佑,満永, 拓邦,小林佐保, 岡田怜士, 浅部佑, 満永拓邦 著","インプレスR&D,インプレス (発売)","Fri, 16 Oct 2020 04:54:12 +0900"
4594062539,マンガけもの道 : まんだらけ中野店副店長の珍作発掘探訪,"岩井, 道,岩井道 著",扶桑社,"Wed, 13 Oct 2010 00:10:12 +0900"
4320115589,組合せゲーム理論の世界 : 数学で解き明かす必勝法,安福智明／著 坂井公／著 末續鴻輝／著,共立出版,20240228
4469244082,これでいいのか大学入試英語 下,"Watkins,Gareth",大修館書店,199710
4469244074,これでいいのか大学入試英語 上,"Watkins,Gareth",大修館書店,199710
4309419267,屋根裏に誰かいるんですよ。 : 都市伝説の精神病理,"春日,武彦,1951-",河出書房新社,202210
4295013498,スーパーユーザーなら知っておくべきLINUXシステムの仕組み,"Ward,Brian,1972- 柴田,芳樹,1959-",インプレス,202203
4094083359,実録死体農場,"Bass, William M,Jefferson, Jon,相原, 真理子, 1947-2010,ビル・バス, ジョン・ジェファーソン 著,相原真理子 訳",小学館,"Thu, 24 Jan 2013 07:02:29 +0900"
4775313010,図解魔術の歴史,"草野,巧,1956-",新紀元社,201503
4814400586,Rustの練習帳 : コマンドラインツールの作成を通してRustを学ぶ,KenYouens-Clark／著 中山光樹／翻訳,オライリー・ジャパン,20240118
4876872112,鉄道重大事故の歴史,"久保田,博,1924-",グランプリ出版,200006
4876874123,鉄道重大事故の歴史―鉄道事故に見る安全技術の進化,久保田博／著,グランプリ出版,20231212
490868605X,数式組版,"木枝, 祐介,木枝祐介 著",ラムダノート,"Wed, 13 Jun 2018 18:33:52 +0900"
4789837513,ディジタル回路の設計入門 : ハードウェアの動きを理解しながら学ぶ,湯山俊夫,CQ出版,2005-4-1
4478117764,大学図鑑! 2024,,ダイヤモンド社,202303
4906529925,信州の秘境駅・小駅を巡る : 近代化から過疎化への100年旅,"久保田,稔,1960-",川辺書林,202203
4299042387,クセがスゴい不動産,あなたの理想不動産,宝島社,202306
4802213050,秘境駅で途方に暮れた,"カベルナリア吉田,1965-",イカロス出版,202306
0071752064,Practice Makes Perfect English Articles and Determiners Up Close,Mark Lester,McGraw Hill Professional,2013-08-07
4480056599,読み書きの技法,"小河原, 誠, 1947-,小河原誠 著",筑摩書房,"Tue, 30 Jul 1996 09:00:00 +0900"
4309416845,日本の偽書,"藤原,明,1958-",河出書房新社,201905
4798179809,なっとく!関数型プログラミング : 関数型プログラミングの基本概念の全容を把握し活用したい開発者に,"Płachta,Michał クイープ",翔泳社,202308
1837639965,Architecture and Design of the Linux Storage Stack: Gain a Deep Understanding of the Linux Storage Landscape and Its Well-coordinated Layers,Muhammad Umer,Packt Publishing,2023-07
4905033314,プロジェクト・シン・エヴァンゲリオン : 実績・省察・評価・総括,"カラー,カラー 編","カラー,グラウンドワークス","Thu, 10 Aug 2023 06:20:19 +0900"
4065324017,プリキュアコスチュームクロニクル = Precure Costume Chronicle : プリキュア20周年アニバーサリー,東映アニメーション株式会社,講談社,202310
9811379661,"Kawaii engineering : measurements, evaluations, and applications of attractiveness","大倉, 典子,Michiko Ohkura, editor",Springer,"Thu, 21 Sep 2023 08:21:44 +0900"
4309419690,日本怪談実話,"田中,貢太郎,1880-1941",河出書房新社,202306
4309419712,戦前のこわい話 : 怪奇実話集,"志村,有弘,1941-",河出書房新社,202306
4800307961,元報道記者が見た昭和事件史 : 歴史から抹殺された惨劇の記録,"石川,清,1964-",洋泉社,201511
4863135629,絶対に停まらない世界の廃墟駅,"Ross,David(DavidSoutherland) 大島,聡子",日経BPマーケティング (発売),202305
4761101857,仙人ワンダーランド : 和漢仙人列伝,"影山,純夫,1947-",河原書店,202305
4390114956,フランス怪奇民話集,"植田, 祐次, 1936-,山内, 淳, 1951-,植田祐次, 山内淳 訳編",社会思想社,"Wed, 30 Mar 1994 09:00:00 +0900"
4837967701,あなたの知らない「ヘン」な法律,"なかむら,いちろう",三笠書房,201512
4295003255,新人エンジニアのためのインフラ入門,"BFT,BFT 著",インプレス,"Mon, 9 Apr 2018 23:56:19 +0900"
4865280685,わたしが先生の「ロリータ」だったころ,アリソン・ウッド／著者 服部理佳／訳者,左右社,20220307
4798068160,"Good Code,Bad Code : 持続可能な開発のためのソフトウェアエンジニア的思考","Long,Tom 秋,勇紀 高田,新山 山本,大祐,1983-",秀和システム,202302
1680502549,Domain modeling made functional : tackle software complexity with domain-driven design and F♯,"Wlaschin, Scott,MacDonald, Brian,Scott Wlaschin",The Pragmatic Bookshelf,"Thu, 21 Sep 2023 08:21:44 +0900"
0312383215,What people wore when : a complete illustrated history of costume from ancient times to the nineteenth century for every level of society,"Leventon, Melissa,Melissa Leventon",St. Martin's Griffin,"Thu, 21 Sep 2023 08:21:44 +0900"
4296111914,電子工作パーツ制御完全攻略 : ラズパイ自由自在,"松岡,貴志 日経BP",日経BPマーケティング (発売),202203
4562072547,世界を騙した女詐欺師たち,"Telfer,Tori 富原,まさ江,1965-",原書房,202302
3031004418,General Game Playing,"Michael Genesereth,Michael Thielscher",Springer,2014-03-18
4839967091,囲碁ディープラーニングプログラミング,"Pumperla,Max Ferguson,Kevin 山岡,忠夫",マイナビ出版,201904
4309460631,ホームズ贋作展覧会,"各務, 三郎, 1936-,各務三郎 編",河出書房新社,"Thu, 5 Oct 1989 09:00:00 +0900"
0321842685,Hacker's delight,"Warren, Henry S.,Henry S. Warren, Jr",Addison-Wesley,"Thu, 21 Sep 2023 08:21:44 +0900"
4814400160,自分だけのボードゲームを作ろう : ゲームをデザインして、作って、みんなでプレイする,"Daniels,JesseTerrance 金井,哲夫,1958-",オーム社 (発売),202212
4480438319,神田神保町書肆街考,鹿島茂／著,筑摩書房,20221013
4787210130,ボンデージ進化論,北原童夢／著,青弓社,19920401
4816357688,オールカラー普通免許〈ひっかけ対策〉問題集 : そのまま本試験,,ナツメ社,201502
4758017832,中谷友紀子東映アニメーションプリキュアワークス = Nakatani Yukiko TOEI ANIMATION PRECURE WORKS 2,"中谷,友紀子,1986-",講談社 (発売),202210
4297130343,リアルタイムグラフィックスの数学 = Mathematics of Real-Time Graphics : GLSLではじめるシェーダプログラミング,"巴山,竜来,1982-",技術評論社,202209
4121506197,サラブレッドに「心」はあるか,"楠瀬,良,1951-",中央公論新社,201804
4758017115,高橋晃東映アニメーションプリキュアワークス = : TAKAHASHI AKIRA TOEI ANIMATION PRECURE WORKS,"高橋,晃,1971-",講談社 (発売),202102
479806338X,最新アニメ業界の動向とカラクリがよ～くわかる本 : 業界人、就職、転職に役立つ情報満載,"谷口,功,1954- 麻生,はじめ,1955-",秀和システム,202012
4907162219,魔術の文法学 : Japanese edition,"前野, 佳彦,前野佳彦 著",テクネ,"Tue, 9 Dec 2014 20:48:21 +0900"
4295000965,Goプログラミング実践入門 : 標準ライブラリでゼロからWebアプリを作る,"鄭,兆雄 武舎,広幸 阿部,和也 上西,昌弘",インプレス,201703
4774146129,C言語入門書の次に読む本,"坂井,弘亮,1973-",技術評論社,201105
4101311013,河童が覗いたヨーロッパ,"妹尾,河童,1930-",新潮社,198307
4065250390,アート展「初音ミク・クロニクル」公式ビジュアルブック,,講談社,202110
479862750X,塗りフェチ事典 : リアルな肉感キャラを描く! 女の子編,ホビージャパン,ホビージャパン,202202
4866808136,あなたを陰謀論者にする言葉,"雨宮,純",フォレスト出版,202110
4635047520,遊歩大全,"Fletcher, Colin, 1922-2007,芦沢, 一洋, 1938-1996,コリン・フレッチャー 著,芦沢一洋 訳",山と溪谷社,"Thu, 10 Jan 2013 23:21:11 +0900"
4065267757,みんなのユニバーサル文章術 : 今すぐ役に立つ「最強」の日本語ライティングの世界,"安田,峰俊",講談社 (発売),202201
4802207174,赤羽駅周辺の失われし鉄路を求めて : 特集,,イカロス出版,"Thu, 21 Sep 2023 08:21:44 +0900"
4802207921,消散軌道風景 : あなたの知らない鉄道考古学,岡本憲之 総合プロデューサー,イカロス出版,"Mon, 2 Mar 2020 23:25:04 +0900"
4802208731,消散軌道風景 : あなたの知らない鉄道考古学,岡本憲之 総合プロデューサー,イカロス出版,"Fri, 21 Aug 2020 23:21:44 +0900"
4802210280,廃線系鉄道考古学 : あなたの知らない消散軌道風景.,岡本憲之 総合プロデューサー,イカロス出版,"Fri, 13 Aug 2021 19:14:41 +0900"
4062177358,究極のナローゲージ鉄道 : せまい鉄路の記録集,"岡本,憲之,1968-",講談社,201205
486320146X,実録鉄道連隊 : 知られざるその使命を解き明かす : 創設から終焉、路線から車両まで…,,イカロス出版,"Thu, 16 Nov 2023 20:26:30 +0900"
4533039812,"全国鉱山鉄道 : 鉄道の原点""ヤマ""軌道をもとめて","岡本,憲之,1968-",JTB,200110
4802209525,廃線系鉄道考古学 : あなたの知らない消散軌道風景.,岡本憲之 総合プロデューサー,イカロス出版,"Fri, 16 Apr 2021 00:20:06 +0900"
4802211015,廃線系鉄道考古学 : あなたの知らない消散軌道風景 2022Vol.3,,イカロス出版,202202
0764574817,Reversing : secrets of reverse engineering,"Eilam, Eldad,Eldad Eilam ; [foreward by Elliot Chikofsky]",Wiley,"Thu, 21 Sep 2023 08:21:44 +0900"
4798164739,ゲームメカニクス大全 : ボードゲームに学ぶ「おもしろさ」の仕掛け,"Engelstein,Geoffrey Shalev,Isaac 小野,卓也",翔泳社,202010
4866365366,ライトノベルの新・潮流 = LIGHT NOVEL NEW TIDE CURRENT : 黎明期→2021,"石井,ぜんじ 太田,祥暉,1996- 松浦,恵介,1980-",スタンダーズ,202201
4863543638,OSSライセンスを正しく理解するための本 = Understand the Open Source Software License Correctly,"姉崎,章博",シーアンドアール研究所,202111
4839977607,AWSではじめるクラウド開発入門 : コードを書いて学ぶエンジニア・科学者のためのハンズオン教材,"真野,智之",マイナビ出版,202109
4864718652,スーパーナチュラル・ウォー : 第一次世界大戦と驚異のオカルト・魔術・民間信仰,"Davies,Owen,1969- 江口,之隆,1958-",ヒカルランド,202004
4010377275,総合的研究問題文の読み取り方-数学1・A・2・B : 大学受験,,旺文社,202108
4150315000,異常論文,"樋口,恭介,1989-",早川書房,202110
4909466010,エヴァンゲリオンイラスト集 : 2007-2017,"「エヴァンゲリオンイラスト集2007-2017」編集部 編,カラー 監修",グラウンドワークス,"Wed, 25 Sep 2019 22:28:05 +0900"
4044006261,もっとヘンな論文,サンキュータツオ,KADOKAWA,202007
4044003343,ヘンな論文,サンキュータツオ,KADOKAWA,201711
4046043938,"奇書の世界史 : 歴史を動かす""ヤバい書物""の物語","三崎,律日,1990-",KADOKAWA,201908
4426624096,世界の奇書 : 総解説,,自由国民社,199804
4480510443,キリスト教の幼年期,エチエンヌ・トロクメ／著 加藤隆／翻訳,筑摩書房,20210812
4151845518,ブート・バザールの少年探偵,"Anappara,Deepa 坂本,あおい",早川書房,202104
4863134940,世界の幽霊出現録,"Innes,Brian,1928-2014 大島,聡子",日経BPマーケティング (発売),202108
4065135060,プリキュアコスチュームクロニクル = Precure Costume Chronicle : プリキュア15周年アニバーサリー,東映アニメーション株式会社,講談社,201810
4777519651,Java将棋のアルゴリズム : アルゴリズムの強化手法を探る,"池, 泰弘, 1971-,工学社,池泰弘 著,I O編集部 編集",工学社,"Mon, 12 Sep 2016 20:34:45 +0900"
4767827779,すごいエスカレーター = SUPER ESCALATORS,"田村,美葉,1984-",エクスナレッジ,202009
4905924405,19人の阿部定,"桑原, 稲敏, 1939-1993,桑原稲敏 著",現代書林,"Tue, 26 Jan 1982 09:00:00 +0900"
4047308382,闇に這う者 = THE HAUNTER OF THE DARK : ラヴクラフト傑作集,"田邊,剛,1975-",KADOKAWA,201604
4757735804,アウトサイダー,"田邊,剛,1975-",エンターブレイン,200707
4839971056,マンガで学ぶ恐竜の生態,"金,渡潤 渡辺,麻土香",マイナビ出版,202005
4480435921,「読まなくてもいい本」の読書案内,橘玲／著,筑摩書房,20190509
4040647343,VISIONS : ILLUSTRATORS BOOK 2021,ピクシブ株式会社,KADOKAWA,202011
4569841090,マルチ・ポテンシャライト : 好きなことを次々と仕事にして、一生食っていく方法,"Wapnick,Emilie 長澤,あかね",PHP研究所,201809
4044006202,自閉症は津軽弁を話さない : 自閉スペクトラム症のことばの謎を読み解く,"松本,敏治,1957-",KADOKAWA,202009
404735483X,時を超える影 : ラヴクラフト傑作集 2,"Lovecraft,HowardPhillips,1890-1937 田邊,剛,1975-",KADOKAWA,201901
4150505691,津波の霊たち : 3・11死と生の物語,"LloydParry,Richard,1969- 濱野,大道",早川書房,202101
4122052424,ピアニストという蛮族がいる,"中村,紘子,1944-2016",中央公論新社,200912
4635048861,マタギ奇談,"工藤,隆雄,1953-",山と溪谷社,202007
4480087044,快読１００万語！ペーパーバックへの道,酒井邦秀／著,筑摩書房,20020601
4863134975,西洋アンティーク・ボードゲーム : 19世紀に愛された遊びの世界,"Seville,Adrian 鍋倉,僚介",日経BPマーケティング (発売),202101
4802612168,Pythonでいかにして暗号を破るか : 古典暗号解読プログラムを自作する本,"Sweigart,Al IPUSIRON,1979-",ソシム,202101
4535606137,数学の言葉づかい100 : 数学地方のおもしろ方言,数学セミナー編集部,日本評論社,199904
4844379038,入門GUI : Webブラウザで作る本格インタラクション,"hashrock,daiiz,miyaoka,f_subal,hashrock, daiiz, miyaoka, f_subal 著","インプレスR&D,インプレス","Wed, 25 Jan 2023 06:16:45 +0900"
4299004507,塀の中の元極道YouTuberが明かすヤクザの裏知識,"懲役,太郎",宝島社,202006
4309228038,まじないの文化史 : 見るだけで楽しめる! : 日本の呪術を読み解く,新潟県立歴史博物館,河出書房新社,202005
4254102739,人間の許容限界事典,"山崎,昌廣,1953- 坂本,和義 関,邦博,1944-",朝倉書店,201507
4760151931,世界でいちばん虚無な場所 : 旅行に幻滅した人のためのガイドブック,"Rudd,Damien,1984- 菅野,楽章,1988-",柏書房,202004
4488564100,日本怪奇実話集 : 亡者会,"東,雅夫,1958-",東京創元社,202009
4140840412,将棋界奇々快々,"河口, 俊彦, 1936-2015,河口俊彦 著",日本放送出版協会,"Tue, 3 Feb 2015 07:04:14 +0900"
4389201395,ひとりで学べる地学,,清水書院,201909
4839970491,マンガで学ぶ昆虫の進化,"金,渡潤 山口,裕美子,pub.2020",マイナビ出版,202005
4480098844,中世の覚醒,リチャード・Ｅ．ルーベンスタイン／著 小沢千重子／翻訳,筑摩書房,20181010
4635320146,マタギ奇談,"工藤,隆雄,1953-",山と溪谷社,201610
4621063014,暗号の代数理論,"Koblitz, Neal,林, 彬,シュプリンガージャパン,N. コブリッツ著 ; 林彬訳 ; シュプリンガー・ジャパン編集",丸善出版,"Thu, 21 Sep 2023 08:21:44 +0900"
4774197076,超有名進学校生の数学的発想力 : 日本最高峰の頭脳に迫る,"吉田, 信夫, 1977-,アップ,吉田信夫 著,アップ 編集",技術評論社,"Sat, 16 Jun 2018 01:18:59 +0900"
4041080606,怪と幽 = KWAI & yoo vol.003,,KADOKAWA,201912
4041080592,怪と幽 = KWAI & yoo vol.002,,KADOKAWA,201908
4041080584,怪と幽 = KWAI & yoo vol.001,,KADOKAWA,201904
4041091152,怪と幽 = KWAI & yoo vol.004,,KADOKAWA,202004
4286210456,1日30分であなたも現代の魔術師になれる : 混沌魔術入門,"黒野, 忍, 1971-,黒野忍 著",文芸社,"Mon, 6 Apr 2020 18:39:14 +0900"
4596551537,スパイダー・ネットワーク : 金融史に残る詐欺事件-LIBORスキャンダルの全内幕,"Enrich,David,1979- 高崎,拓哉,1979-",ハーパーコリンズ・ジャパン,202003
4047358533,クトゥルフの呼び声 = THE CALL OF CTHULHU : ラヴクラフト傑作集,"Lovecraft,HowardPhillips,1890-1937 田邊,剛,1975-",KADOKAWA,201912
4047299111,魔犬 = THE HOUND and Other Stories : ラヴクラフト傑作集,"田邊,剛,1975-",KADOKAWA,201409
4047352888,時を超える影 : ラヴクラフト傑作集 1,"Lovecraft,HowardPhillips,1890-1937 田邊,剛,1975-",KADOKAWA,201808
4047308048,異世界の色彩 = THE COLOUR OUT OF SPACE : ラヴクラフト傑作集,"田邊,剛,1975-",KADOKAWA,201510
4047283169,狂気の山脈にて = AT THE MOUNTAINS OF MADNESS : ラヴクラフト傑作集 1,"田邊,剛,1975-",KADOKAWA,201610
448009637X,居酒屋の誕生,飯野亮一／著,筑摩書房,20140801
4480433600,幕末単身赴任　下級武士の食日記　増補版,青木直己／著,筑摩書房,20160907
4065163188,未知なるカダスを夢に求めて,"Lovecraft,HowardPhillips,1890-1937 森瀬,繚,1972-",講談社,201909
4908468141,絶対に解けない受験世界史2,稲田義智／著,パブリブ,20170810
4784511016,絶対に解けない受験世界史 : 悪問・難問・奇問・出題ミス集,稲田義智 著,社会評論社,"Mon, 27 Oct 2014 18:49:13 +0900"
4150505489,行動経済学の逆襲 下,"Thaler,RichardH,1945- 遠藤,真美,1963-",早川書房,201910
4150505470,行動経済学の逆襲 上,"Thaler,RichardH,1945- 遠藤,真美,1963-",早川書房,201910
4166612417,総会屋とバブル,"尾島,正洋,1966-",文藝春秋,201911
4775300350,魔導具事典,"山北,篤,1960- 稲葉,義明,1970-",新紀元社,200112
4778316681,信長名鑑,"姫川,榴弾",太田出版,201911
4041035511,旧談,"根岸,守信,1737-1815 京極,夏彦,1963-",KADOKAWA,201601
4795244731,妖怪現わる : 現代妖怪談義,"中山, 市朗, 1959-,中山市朗 著",遊タイム出版,"Tue, 20 Sep 1994 09:00:00 +0900"
4758013241,拘束少女絵巻 学園編,,一迅社,201307
4758014140,拘束少女絵巻,,一迅社,"Fri, 16 Jan 2015 19:17:14 +0900"
4758013624,拘束少女絵巻 日本の歴史編,,一迅社,201404
4758014809,体育少女拘束絵巻,,一迅社,201602
4758012652,拘束少女絵巻 高潔編,,一迅社,201204
4758012113,拘束少女絵巻,,一迅社,201102
4837309127,モダリーナのファッションパーツ図鑑 : デザインの用語や特徴がイラストでわかる,"溝口,康彦 福地,宏子 數井,靖子",マール社,201907
4122065607,本で床は抜けるのか,"西牟田,靖,1970-",中央公論新社,201803
4041059291,外国人ヒットマン,"一橋,文哉",KADOKAWA,201909
4905158680,FANZA BOOK,FANZA／監修,スモール出版,20190730
4044000999,官能小説の奥義,"永田,守弘,1933-",KADOKAWA,201604
4331607739,女豹の危機 : 長篇ポリスミステリー,"竜, 一京, 1941-,龍一京 著",廣済堂出版,"Tue, 15 Aug 2000 00:05:00 +0900"
4062633604,アトポス,"島田,荘司,1948-",講談社,199610
4062632861,眠れぬ夜の殺人,"岡嶋, 二人,岡嶋二人 [著]",講談社,"Tue, 28 Jan 1997 09:00:00 +0900"
4048529080,それをなすもの : 「新世紀エヴァンゲリオン」コンセプトデザインワークス,"山下,いくと,1965-",角川書店ニュータイプ,199803
4791761030,天使の世界,"Godwin, Malcolm,大滝, 啓裕, 1952-,マルコム・ゴドウィン 著,大瀧啓裕 訳",青土社,"Wed, 1 Dec 2004 19:43:05 +0900"
4903713016,新世紀エヴァンゲリオン原画集 ,,,2000-12-22
4903713008,新世紀エヴァンゲリオン原画集,Gainax／著 庵野秀明／監修,ガイナックス,2000-10-14
4903713024,新世紀エヴァンゲリオン原画集 ,,,2001-03-30
4905033071,新世紀エヴァンゲリオンTVアニメーション設定資料集2015 edition,,グラウンドワークス,201508
4760150072,「舞姫」の主人公をバンカラとアフリカ人がボコボコにする最高の小説の世界が明治に存在したので20万字くらいかけて紹介する本,"山下, 泰平, 1977-,山下泰平 著",柏書房,"Thu, 15 Aug 2019 18:51:04 +0900"
4801303722,文豪たちの悪口本 文豪たちの悪口本,彩図社文芸部／編,彩図社,20190524
4756250122,陰翳礼讃,"谷崎,潤一郎,1886-1965 大川,裕弘",パイインターナショナル,201801
4905033209,ヱヴァンゲリヲン新劇場版: 破全記録全集 : 設定資料版,"轟木, 一騎,庵野秀明 企画・監修,轟木一騎 構成・編集,三好寛, 田渕浩久, 神村典子 編","カラー,グラウンドワークス (発売)","Sun, 24 Oct 2021 06:12:50 +0900"
4905033195,ヱヴァンゲリヲン新劇場版: 破全記録全集 : ビジュアルストーリー版,"轟木, 一騎,庵野秀明 企画・監修,轟木一騎 構成・編集,三好寛, 田渕浩久, 神村典子 編","カラー,グラウンドワークス (発売)","Thu, 15 Apr 2021 06:16:42 +0900"
4905033187,ヱヴァンゲリヲン新劇場版: 序全記録全集 : ビジュアルストーリー版・設定資料版,"轟木, 一騎,庵野秀明 企画・監修,轟木一騎 構成・編集,三好寛, 田渕浩久, 神村典子 編","カラー,グランドワークス (発売)","Thu, 26 Sep 2019 01:31:55 +0900"
4596550751,否定と肯定 : ホロコーストの真実をめぐる闘い,"Lipstadt,DeborahE 山本,やよい,1949-",ハーパーコリンズ・ジャパン,201711
4791769015,キャラの思考法 : 現代文化論のアップグレード,"さやわか,1974-",青土社,201512
4022505273,サザエさんパンダを見に行く : サザエさんをさがして その4,朝日新聞社,朝日新聞出版,200901
4022503556,またまたサザエさんをさがして,朝日新聞社,朝日新聞社,200711
4022502479,サザエさんをさがして その2,朝日新聞社,朝日新聞社,200612
402250076X,サザエさんをさがして,朝日新聞社,朝日新聞社,200512
4480098003,美少女美術史 人々を惑わせる究極の美,池上英洋／著 荒井咲紀／著,筑摩書房,20170606
4480096523,残酷美術史,池上英洋／著,筑摩書房,20141201
4480096515,官能美術史,池上英洋／著,筑摩書房,20141101
4865650075,『宅間守　精神鑑定書』を読む,飢餓陣営・佐藤幹夫／編,言視舎,20141225
4750513105,宅間守 精神鑑定書,岡江晃／著,亜紀書房,20130527
4101306354,残虐記,"桐野,夏生,1951-",新潮社,200708
4344410300,銀行籠城,"新堂, 冬樹, 1966-,新堂冬樹 [著]",幻冬舎,"Mon, 14 Apr 2008 18:13:15 +0900"
4062748851,魔笛,"野沢,尚,1960-2004",講談社,200409
4905325137,現代アニメ「超」講義,,第二次惑星開発委員会／PLANETS,20190630
4768308856,ヒロイン専用スーツ・武器の作りかた = HOW TO MAKE HEROINE SUITS AND WEAPONS,"西脇,直人,1971- 梅森,充 桜田,美和子",玄光社,201708
4480082344,グレン・グールド　孤独のアリア,ミシェル・シュネデール／著 千葉文夫／翻訳,筑摩書房,19950101
404892477X,姉なるもの = The sister of the woods with a Thousand Young 1,"飯田,ぽち",KADOKAWA,201612
4758013551,川村敏江東映アニメーションプリキュアワークス = KAWAMURA TOSHIE TOEI ANIMATION PRECURE WORKS,"川村,敏江",一迅社,201402
4758014221,高橋晃東映アニメーションプリキュアワークス = TAKAHASHI AKIRA TOEI ANIMATION PRECURE WORKS,"高橋,晃,1971-",一迅社,201503
4758015155,香川久東映アニメーションプリキュアワークス = KAGAWA HISASHI TOEI ANIMATION PRECURE WORKS,"香川,久,1963-",一迅社,201608
4758016364,宮本絵美子東映アニメーションプリキュアワークス,"宮本, 絵美子,宮本絵美子 画,東映アニメーション株式会社 監修","一迅社,講談社 (発売)","Thu, 11 Jul 2019 20:18:36 +0900"
433605777X,定本何かが空を飛んでいる,"稲生,平太郎,1954-",国書刊行会,201311
