isbn_or_asin,book_title,author,publisher,published_date
4866734477,世界のお弁当とソトごはん,"岡根谷, 実里, 1989-,岡根谷実里 著",三才ブックス,"Mon, 26 May 2025 23:17:32 +0900"
4487817463,Occult　神秘思想表象大全,ピーターフォーショー 栗田英彦 塩野谷恭輔,東京書籍,
4408651656,日本で唯一犯罪が許される場所,"勝丸　円覚,勝丸　円覚 著・文・その他",[object Object],"Tue, 1 Jul 2025 18:57:00 +0900"
4814401191,初めてのGo言語（第2版） : 他言語プログラマーのためのイディオマティックGo実践ガイド,JonBodner 武舎広幸,,
4274232581,「パワエレ、マジわからん」と思ったときに読む本,和田圭二,オーム社,
429520207X,色の大事典 : 基礎知識と配色・カラーチャート・伝統色・慣用色名 : DIGITAL COLORS for DESIGN,"井上,のきあ",インプレス (発売),202109
4875025793,本朝妖怪年代紀,工作舎,工作舎,202506
4798190209,Exercise JavaScript プログラマ脳を鍛える至高の問題集 (Exercise),FarazK.Kelhini 株式会社クイープ,翔泳社,
4798190195,Exercise C++ プログラマ脳を鍛える至高の問題集 (Exercise),AndersSchauKnatten 株式会社クイープ,翔泳社,
4005008836,生きづらい明治社会 : 不安と競争の時代 883 (岩波ジュニア新書),"松沢,裕作",岩波書店,201809
4771039755,大正教養主義の成立と末路 : 近代日本の教養幻想,松井健人,晃洋書房,
4296208004,ネット炎上事例300,,日経BP,
4562073764,シャーロック・ホームズと見るヴィクトリア朝英国の食卓と生活,"関矢,悦子",原書房,202312
4394904625,第2巻　イギリス寒雪夜がたり集 (荒俣宏 幻想文学翻訳集成 欧米幻想ファンタジー精華 ； 第2巻),荒俣宏,（株）春陽堂書店,
4469246840,英文読解を科学する : テキスト理解の認知メカニズムに基づく読解指導,細田雅也,大修館書店,
4867931047,呪文の言語学,角悠介／著,作品社,20250805
4798067881,対戦型麻雀ゲームAIのアルゴリズムと実装,"小林,聡,1964-",秀和システム,202301
4000069764,統計的テキストモデル : 言語へのベイズ的アプローチ (確率と情報の科学),持橋大地,岩波書店,
4814400861,スタッフエンジニアの道 : 優れた技術専門職になるためのガイド,TanyaReilly 島田浩二,オーム社,
4798184918,バックエンドエンジニアのためのインフラ・クラウド大全,株式会社X-Tech5 馬場俊彰,翔泳社,
4297148994,Docker & Kubernetesネットワークのしくみ　クラウドネイティブに求められる情報通信の知識,大隈峻太郎,技術評論社,
4991355826,Raspberry Pi2でスーパーコンピュータを作ってみた! ラズパイスパコンで円周率編,"D. M,D.M Entry Point,D.M 著,D.M Entry Point 編",D.M Entry Point,"Tue, 17 Jun 2025 23:22:40 +0900"
4479307095,申し訳ない、御社をつぶしたのは私です。 : コンサルタントはこうして組織をぐちゃぐちゃにする / だいわ文庫 ; 373-1G,"Phelan, Karen,神崎, 朗子,カレン・フェラン 著,神崎朗子 訳",大和書房,"Fri, 13 Jul 2018 23:57:58 +0900"
4814401132,LLMのプロンプトエンジニアリング : GitHub Copilotを生んだ開発者が教える生成AIアプリケーション開発,JohnBerryman AlbertZiegler 服部佑樹 佐藤直生,オーム社,
4814401159,直感 LLM : ハンズオンで動かして学ぶ大規模言語モデル入門,JayAlammar MaartenGrootendorst 中山光樹,オーム社,
4322134084,アルゴリズム取引の正体,"NTTデータフィナンシャルソリューションズ,NTTデータ・フィナンシャル・ソリューションズ先端金融工学センター 編著",[object Object],"Fri, 9 Nov 2018 18:43:37 +0900"
4908686203,型システムのしくみ : TypeScriptで実装しながら学ぶ型とプログラミング言語,"遠藤, 侑介,遠藤侑介 著",ラムダノート,"Tue, 17 Jun 2025 22:50:09 +0900"
4297148595,〈作って学ぶ〉OSのしくみ. 1 (WEB+DB PRESS plusシリーズ),hikalium,技術評論社,202505
453721869X,カクテルをたしなむ人のレッスン&400レシピ,LiquidLiquid,日本文芸社,202102
4478120498,自炊の壁 : 料理の「めんどい」を乗り越える100の方法,"佐々木, 典士, 1979-,佐々木典士, 山口祐加 著",ダイヤモンド社,"Tue, 18 Mar 2025 23:12:04 +0900"
4540810634,趣味の酒つくり―ドブロクをつくろう実際編,Koutarou Sasano,,
4862466087,職種と用途で探せる Blenderアドオン事典（仮）,3D人,ボーンデジタル,
4535559260,［新版］社会的選択理論への招待 : 投票と多数決の科学,坂井豊貴,,
4585303057,デジタルデータの長期保存・活用 : その理論と実践 / デジタルアーカイブ・ベーシックス,"嘉村, 哲郎, 1980-,嘉村哲郎 責任編集",勉誠社,"Thu, 29 May 2025 19:33:44 +0900"
4065172519,Pythonで学ぶ強化学習 = Reinforcement Learning by Python : 入門から実践まで (機械学習スタートアップシリーズ),"久保,隆宏",講談社,201909
4065392187,ヒューリスティック探索 : 合理的なAIをつくるためのアルゴリズム,"陣内,佑",講談社,202504
4794227663,古本屋の誕生 : 東京古書店史,"鹿島, 茂, 1949-,鹿島茂 著",草思社,"Tue, 11 Mar 2025 23:58:29 +0900"
4779518547,文系大学生は専門分野で何を学ぶのか,本田由紀／編集 小山治／著,ナカニシヤ出版,202503
4627872518,有理算術演算 = Rational Arithmetic : 高精度数値計算のためのアルゴリズムとプログラミング,"寒川,光 高橋,大介",森北出版,202310
4041155126,ニセコ化するニッポン,"谷頭,和希,1997-",KADOKAWA,202501
406117925X,現代数学小事典 Ｂ３２５ (ブルーバックス),寺阪‖英孝,講談社,1977-06
4130626280,進化の原理と基礎 : 計算機シミュレーションで理解する進化の物理,"市橋,伯一,1978- 金井,雄樹",東京大学出版会,202503
4779513103,文系大学教育は仕事の役に立つのか = Is University Education Useful for Job? : 職業的レリバンスの検討,"本田,由紀,1964-",ナカニシヤ出版,201808
4865284540,「女子マネージャー」の社会学,関めぐみ／著,左右社,20250314
4759823700,理系のための読解術入門 : 文章の構造から，論理展開，批判的読み方まで,西出利一,化学同人,
476783371X,世界の神話解剖図鑑,,エクスナレッジ,
4910612165,改訂増補版 イメージでとらえる ビジュアル複素関数入門,井澤裕司,プレアデス出版,
4087213501,新聞記者がネット記事をバズらせるために考えたこと (集英社新書),斉藤友彦,,
303002461X,"(Almost) Impossible Integrals, Sums, and Series (Problem Books in Mathematics)",Cornel Ioan Vălean,Springer,2019-05-24
4560091366,厨房から見たロシア : 包丁と鍋とおたまで帝国を築く方法,ヴィトルト・シャブウォフスキ 芝田文乃,白水社,
4334105874,文化系のための野球入門 : 「野球部はクソ」を解剖する (光文社新書),中野慧,光文社,
4814400918,Tidy First? : 個人で実践する経験主義的ソフトウェア設計,KentBeck 吉羽龍太郎 永瀬美穂 細澤あゆみ,オーム社,
4106038609,不寛容論 : アメリカが生んだ「共存」の哲学 (新潮選書),"森本,あんり,1956-",新潮社,202012
4106037645,反知性主義 : アメリカが生んだ「熱病」の正体 (新潮選書),"森本,あんり,1956-",新潮社,201502
1316629953,English Collocations in Use Advanced Book with Answers: How Words Work Together for Fluent and Natural English (Vocabulary in Use),"Felicity O'Dell,Michael McCarthy",Cambridge University Press,2017-08-04
4883031098,日本文化としての将棋,"尾本,恵市,1933-",三元社,200212
4309401880,中国の怪談 1 / 河出文庫,"田中, 貢太郎, 1880-1941,田中貢太郎 著",河出書房新社,"Thu, 29 Sep 1988 09:00:00 +0900"
4296119605,"数学の楽園 : 数独からトポロジー, 圏論まで",日経サイエンス編集部,日経BPマーケティング ,202402
462032826X,ルポ　秀和幡ヶ谷レジデンス,栗田シメイ,毎日新聞出版,
4407316969,情報セキュリティ教本 : 組織の情報セキュリティ対策実践の手引き,"土居,範久,1939- 情報処理推進機構",実教出版,200903
4798183962,つくって、壊して、直して学ぶKubernetes入門,"高橋,あおい 五十嵐,綾",翔泳社,202404
4103559918,図書館を建てる、図書館で暮らす : 本のための家づくり,橋本麻里 山本貴光,新潮社,
110759166X,Academic Vocabulary in Use Edition with Answers,"Michael McCarthy,Felicity O'Dell",Cambridge University Press,2016-02-12
4122069297,一杯のおいしい紅茶 : ジョージ・オーウェルのエッセイ オ3-1 (中公文庫),"Orwell,George,1903-1950 小野寺,健,1931-2018",中央公論新社,202008
404605252X,バイリンガルITエンジニアの英語 = A BILINGUAL SOFTWARE ENGINEER'S GUIDE TO ENGLISH FOR THE TECH INDUSTRY,,KADOKAWA,202501
4297132125,情報処理安全確保支援士午後問題徹底解説 : 「ネットワーク」+「認証」がわかれば絶対合格!,,技術評論社,202301
4046061979,ゼロからスタート!教育系YouTuberまさるの情報処理安全確保支援士1冊目の教科書,,KADOKAWA,202309
4046058153,アメリカ人教授に学ぶ英文ライティングのメタモルフォーゼ = ENGLISH WRITING METAMORPHOSIS LEARNING FROM AN AMERICAN PROFESSOR,,KADOKAWA,202301
4756921655,英語ライティングの鬼100則 : 論理的思考をつきつめる,,明日香出版社,202108
4801307337,教養としてのハイブランド,とあるショップのてんちょう／著,彩図社,20240927
4909718133,ZERRO[ゼロ] 増補新装版,松田行正／著,牛若丸,20241204
1506271189,1100 Words You Need to Know + Online Practice: Build Your Vocabulary in just 15 minutes a day!,"Rich Carriero,Murray Bromberg,Melvin Gordon",Barrons Educational Services,2022-06-07
4794224192,カルチャロミクス : 文化をビッグデータで計測する エ2-1 (草思社文庫),"Aiden,Erez Michel,Jean-Baptiste 阪本,芳久,1950-",草思社,201910
4907162200,魔術の文法学: 記号論的エッセー,"前野, 佳彦,前野佳彦著",テクネ,"Sun, 22 Dec 2024 00:00:10 +0900"
4576240471,津山三十人殺し最終報告書,"石川,清",二見書房,202411
4798074144,"ハロー“Hello, World” OSと標準ライブラリのシゴトとしくみ 第2版",坂井弘亮,秀和システム,
4087455955,謎の独立国家ソマリランド : そして海賊国家プントランドと戦国南部ソマリア た58-16 (集英社文庫),"高野,秀行,1966-",集英社,201706
4469042412,大修館英語学事典,"松浪,有 池上,嘉彦 今井,邦彦",大修館書店,198307
4004320380,象徴天皇の実像 「昭和天皇拝謁記」を読む (岩波新書 ； 新赤版 2038),原武史,岩波書店,
4582764975,「定本」発禁本 : 書物とその周辺 (平凡社ライブラリー. Offシリーズ),"城,市郎,1922-2016",平凡社,200404
4562074760,北朝鮮の食卓 : 食からみる歴史、文化、未来,キム・ヤンヒ 金知子,原書房,
4873768888,映像の原則 : ビギナーからプロまでのコンテ主義 / キネマ旬報ムック,富野由悠季 著,キネマ旬報社,"Thu, 3 Jul 2025 18:37:25 +0900"
4582468268,詰将棋の誕生 : 『詰むや詰まざるや』を読み解く,"若島,正,1952-",平凡社,202408
4787233076,夜食の文化誌 (青弓社ライブラリー　62),西村大志／編著,青弓社,20100117
4867800570,西洋文学にみる魔術の系譜,田中千惠子／著・編集,小鳥遊書房,20241210
4422202340,「図説」アラビア文字事典,"Mandel, Gabriele,矢島, 文夫, 1928-2006,緑, 慎也, 1976-,ガブリエル・マンデル・ハーン 著,矢島文夫 監修,緑慎也 訳",創元社,"Wed, 14 Feb 2024 18:57:39 +0900"
4766138511,ノスタルジア酒場 : 東欧旧社会主義国のお酒とおつまみ事情＆レシピ70,イスクラ,グラフィック社,
483998624X,暗号解読 実践ガイド,ElonkaDunin KlausSchmeh IPUSIRON 協力：Smoky,マイナビ出版,
4153400335,ネット怪談の民俗学 (ハヤカワ新書),廣田龍平,,
4757142846,謎のチェス指し人形「ターク」,"Standage,Tom,1969- 服部,桂,1951-",NTT出版,201112
4150506132,謎のチェス指し人形「ターク」 (ハヤカワ文庫NF),トム・スタンデージ 服部桂,,
4867800252,ハートの図像学,須藤温子／監修 木村三郎／著・編集 植月惠一郎／著・編集,小鳥遊書房,20240510
4130629573,線形代数の世界 抽象数学の入り口 (大学数学の入門),斎藤毅／著,東京大学出版会,20071001
4621061623,対称性からの群論入門,"Armstrong,M.A.(MarkAnthony) 佐藤,信哉",丸善出版,201205
4774183857,Linuxエンジニア養成読本 : IoTもクラウドも、システムの基礎と基盤はLinux! / Software Design plus. 10年先も役立つ力をつくる,,技術評論社,"Wed, 7 Sep 2016 23:23:14 +0900"
4764905671,計算折り紙入門 = Introduction to Computational Origami : あたらしい計算幾何学の世界,"上原,隆平",近代科学社,201806
4336076456,物語要素事典,神山重彦,国書刊行会,
4297138891,LATEX美文書作成入門,"奥村,晴彦,1951- 黒木,裕介,1982-",技術評論社,202312
4297145464,［作って学ぶ］ブラウザのしくみ──HTTP、HTML、CSS、JavaScriptの裏側,土井麻未,技術評論社,
4814400942,Effective Rust : Rustコードを改善し、エコシステムを最大限に活用するための35項目,DavidDrysdale 中田秀基,オーム社,
4781651062,とんねるずと『めちゃイケ』の終わり : 〈ポスト平成〉のテレビバラエティ論 106 (イースト新書),ラリー遠田,イースト・プレス,201808
4798153222,プログラマのためのDocker教科書 : インフラの基礎知識&コードによる環境構築の自動化,"阿佐,志保 山田,祥寛",翔泳社,201804
4814400217,入門モダンLinux : オンプレミスからクラウドまで、幅広い知識を会得する,"Hausenblas,Michael 武内,覚 大岩,尚宏",オーム社 (発売),202304
4798071501,開発系エンジニアのためのDocker絵とき入門 : 定番技術の基本をビジュアルで理解する : Dockerの「なぜ」を解決!,"鈴木,亮,pub.2024",秀和システム,202401
4576221477,オカルト・クロニクル = OCCULT CHRONICLE : 奇妙な事件奇妙な出来事奇妙な人物,"松閣,オルタ",二見書房,202210
4873117208,作ることで学ぶ : Makerを育てる新しい教育のメソッド (Make : Japan Books),"Martinez,SylviaLibow Stager,Gary 阿部,和広 酒匂,寛,1958-",オーム社,201503
4910038965,創られたキリシタン像 (西南学院大学博物館研究叢書),鬼束芽依／編集,西南学院大学博物館,20240830
4910315314,とるにたらない美術,原田裕規／著,ケンエレブックス,20231128
4845913143,ラッセンとは何だったのか? : 消費とアートを越えた「先」,"原田, 裕規, 1989-,原田裕規 編著",フィルムアート社,"Fri, 8 Mar 2024 17:31:33 +0900"
4798177849,絵で見てわかるLinuxカーネルの仕組み (絵で見てわかる),市川正美 大岩尚宏 島本裕志 武内覚 田中隆久 丸山翔平,翔泳社,
4167257033,田宮模型の仕事 (文春文庫),"田宮,俊作,1934-",文藝春秋,200005
4908468702,エセ商標権事件簿 Vol.2 (過剰権利主張ケーススタディーズ),友利昴／著,パブリブ,20231215
441662378X,スイッチバック大全 : 日本の“折り返し停車場”140ヶ所の魅力と歴史を全紹介,江上英樹 栗原景,誠文堂新光社,
4480427457,絶滅寸前季語辞典,夏井いつき／著,筑摩書房,20100801
4163918949,コード・ブッダ = CODE BUDDHA : 機械仏教史縁起,"円城,塔",文藝春秋,202409
4297143097,深層ニューラルネットワークの高速化,佐藤竜馬,技術評論社,
4903474496,コンピュータグラフィックス = Computer graphics,画像情報教育振興協会,画像情報教育振興協会,201503
4903474577,ビジュアル情報処理 : CG・画像処理入門 : CGエンジニア検定・画像処理エンジニア検定ベーシック対応書籍,画像情報教育振興協会,画像情報教育振興協会,"Thu, 22 Jun 2017 02:37:43 +0900"
4839984166,大規模データセットのためのアルゴリズムとデータ構造 (Compass),DzejlaMedjedovic EminTahirovic InesDedovic ほか,マイナビ出版,
4814400853,Binary Hacks Rebooted : 低レイヤの世界を探検するテクニック89選,河田旺 小池悠生 渡邉慶一 佐伯学哉 荒田実樹,,
4764907070,統計学再入門ー科学哲学から探る統計思考の原点ー (統計スポットライト・シリーズ　 ； 第7巻),森元良太,近代科学社,
4910292020,言語学者、外の世界へ羽ばたく : ラッパー・声優・歌手とのコラボからプリキュア・ポケモン名の分析まで 2 (リベラルアーツコトバ双書),"川原,繁人,1980-",教養検定会議,202204
462130898X,ネットワーク科学入門 : Pythonで学ぶデータ分析とモデリング,"Menczer,Filippo Fortunato,Santo Davis,ClaytonA ほか",丸善出版,202312
406512476X,コンパクトデータ構造 : 実践的アプローチ,"Navarro,Gonzalo,1969- 定兼,邦彦,1971-",講談社,202307
4339013722,音楽情報処理 = Music Information Processing 2 (メディアテクノロジーシリーズ),"後藤,真孝 北原,鉄朗 深山,覚 竹川,佳成 吉井,和佳",コロナ社,202309
4320017382,これなら分かる応用数学教室 : 最小二乗法からウェーブレットまで,"金谷,健一,1947-",共立出版,200306
4297137690,ビジュアルでわかる 信号処理入門,井澤裕司／著,技術評論社,20231018
456962457X,素人のように考え、玄人として実行する : 問題解決のメタ技術,"金出,武雄,1945-",PHP研究所,200306
4336075514,ナポレオン時代の犯罪,ジャン・チュラール 辻谷泰志,国書刊行会,
4065356350,暗号の理論と技術 = Theory and Practice of Cryptography : 量子時代のセキュリティ理解のために,"國廣,昇,1971-",講談社,202405
4826902131,事実はなぜ人の意見を変えられないのか : 説得力と影響力の科学,"Sharot,Tali 上原,直子",白揚社,201908
491125601X,絶望からの新聞論,南彰／著,地平社,20240430
462205051X,ロビンソン変形譚小史 : 物語の漂流 (みすずライブラリー),"岩尾,竜太郎,1952-2010",みすず書房,200003
4000612468,社会科学のためのデータ分析入門. 下,"今井,耕介 粕谷,祐子,1968- 原田,勝孝 久保,浩樹",岩波書店,201804
400061245X,社会科学のためのデータ分析入門. 上,"今井,耕介 粕谷,祐子,1968- 原田,勝孝",岩波書店,201803
4297125625,コンセプトから理解するRust,"原,旅人,1975-",技術評論社,202202
4863135939,地球史マップ : 誕生・進化・流転の全記録,"Grataloup,Christian 藤村,奈緒美 瀧下,哉代 辻森,樹,1972-",日経BPマーケティング,202401
4065221382,統計力学入門 = Introduction to Statistical Mechanics : 愚問からのアプローチ,"高橋,康,1923-2013",講談社,202104
4798635758,アクションポーズ大全　アクション漫画家が欲しかった魅せるポーズ5000,霧月,ホビージャパン,
4480430695,中華料理の文化史,張競／著,筑摩書房,20130601
4000298968,テキストアナリティクスの基礎と実践 1 (テキストアナリティクス),"金,明哲,1954- 金,明哲,1954-",岩波書店,202103
4309421121,日本怪奇物語 と13-1 (河出文庫),"富岡,直方",河出書房新社,202406
479520120X,数論を学ぶ人のための相互法則入門 18 (数理情報科学シリーズ),"平松,豊一,1937-",星雲社,199805
4535559473,地域データ分析入門 = Introduction to Regional Data Analysis : すぐに役立つEBPM実践ガイドブック,"林,宜嗣,1951- 林,亮輔,1983- 高林,喜久生,1953- 林,勇貴,1988- ほか",日本評論社,202112
0714111538,Ancient Board Games in Perspective,Irving Finkel,British Museum Press,2007
4845921324,映像クリエイターのための完全独学マニュアル,,フィルムアート社,20221026
4048931164,関数型ドメインモデリング : ドメイン駆動設計とF#でソフトウェアの複雑さに立ち向かおう,"Wlaschin,Scott 猪股,健太郎,1975-",KADOKAWA,202406
4845921170,色のコードを読む,ポール・シンプソン／著 中山ゆかり／翻訳,フィルムアート社,20221224
482400702X,ただのぽんこつ母さんだと思っていたらADHDグレーでした。 (はちみつコミックエッセイ),はなゆい,オーバーラップ,202401
477752275X,よくわかる世界のサイバー犯罪 : フェイクニュース、スパイウェア、個人情報の流出から身を守る : サイバー犯罪の現在を知り自分の身を守ろう (I/O BOOKS),"御池,鮎樹",工学社,202404
4864260524,調査されるという迷惑　増補版,宮本常一 安渓遊地,みずのわ出版,
4791714636,特集民俗学の現在,,青土社,202405
4774143731,3分間ネットワーク基礎講座 : 世界一わかりやすいネットワークの授業,"網野,衛二",技術評論社,201010
4802613903,発達障害・メンタル不調などに気づいたときに読む本 : 精神科の受診や特徴までがわかる,"浜内,彩乃",ソシム,202212
4150506094,ヴィクトリア朝時代のインターネット 609 (ハヤカワ文庫 NF),"Standage,Tom,1969- 服部,桂,1951-",早川書房,202405
4908686106,Webブラウザセキュリティ : Webアプリケーションの安全性を支える仕組みを整理する,"米内,貴志",ラムダノート,202101
4005007929,キリスト教入門 792 (岩波ジュニア新書),"山我,哲雄,1951-",岩波書店,201412
4798068853,Blender Python完全ガイド,ぬっち,秀和システム,202401
4022618655,関西人の正体 い45-4 (朝日文庫),"井上,章一,1955-",朝日新聞出版,201607
4535540489,データ駆動型回帰分析 : 計量経済学と機械学習の融合,"末石,直也",日本評論社,202404
4254161395,Pythonによる気象・気候データ解析. 2,"神山,翼",朝倉書店,202405
4254161387,Pythonによる気象・気候データ解析. 1,"神山,翼",朝倉書店,202405
4535788987,楕円積分と楕円関数 : おとぎの国の歩き方,"武部,尚志",日本評論社,201909
4627061714,よくわかるトポロジー,"山本,修身",森北出版,201504
4062573962,制御工学の考え方 : 産業革命は「制御」からはじまった (ブルーバックス),"木村,英紀,1941-",講談社,200212
4274231534,Pythonによる制御工学入門,"南,裕樹,1982-",オーム社,202401
4065301211,はじめての現代制御理論 = A 1st Course in Modern Control Theory,"佐藤,和也,制御工学 下本,陽一 熊澤,典良",講談社,202212
4065137470,はじめての制御工学 = A 1st Course in Control Engineering,"佐藤,和也,制御工学 平元,和彦 平田,研二",講談社,201811
4274224309,実践ロボット制御 : 基礎から動力学まで,"細田,耕,1965-",オーム社,201911
4263731638,マイナーエマージェンシー,"大滝,純司,1958- 齊藤,裕之 Buttaravoli,PhilipM Leffler,StephenM",医歯薬出版,201503
4065146852,"線形性・固有値・テンソル = Linearity,Eigenvalue,Tensor : 〈線形代数〉応用への最短コース","原,啓介,1968-",講談社,201902
4903342611,整数の分割,G.アンドリュース／著 Ｋ．エリクソン／著 佐藤文広／訳,数学書房,20060531
4480512233,ガロアの夢 群論と微分方程式 ク-36-1 (ちくま学芸文庫),久賀道郎／本文,筑摩書房,20231211
4087211169,著作権とは何か : 文化と創造のゆくえ 1016 (集英社新書),"福井,健策,1965-",集英社,202003
4635140075,感謝されない医者 : ある凍傷Dr.のモノローグ,"金田,正樹,1946-2019",山と溪谷社,200703
4320125673,データ分析失敗事例集 = Data Analytics Nightmare : 失敗から学び、成功を手にする,"尾花山,和哉 ホクソエム",共立出版,202308
4535559961,医療の経済学 = Health Economics : 経済学の視点で日本の医療政策を考える,"河口,洋行",日本評論社,202012
4798069744,ストレンジコード : 難解プログラミング言語を巡る不思議な旅,"Kneusel,RonaldT 水野,貴明,1973- 竹迫,良範,1977-",秀和システム,202402
4320113845,実解析の助け舟 : 証明の理解に必要なすべてのツール,"Grinberg,Raffi,1990- 蟹江,幸博,1948-",共立出版,201909
4062576201,高校数学でわかるボルツマンの原理 : 熱力学と統計力学を理解しよう B-1620 (ブルーバックス),"竹内,淳,1960-",講談社,200811
4062575450,高校数学でわかる半導体の原理 : 電子の動きを知って理解しよう B-1545 (ブルーバックス),"竹内,淳,1960-",講談社,200703
4062574705,高校数学でわかるシュレディンガー方程式 : 量子力学を学びたい人、ほんとうに理解したい人へ (ブルーバックス),"竹内,淳,1960-",講談社,200503
4621309048,アルゴリズム設計マニュアル. 下,"Skiena,StevenS 平田,富夫,1949-",丸善出版,202401
462130903X,アルゴリズム設計マニュアル. 上,"Skiena,StevenS 平田,富夫,1949-",丸善出版,202401
4908686165,プログラマーのためのCPU入門 : CPUは如何にしてソフトウェアを高速に実行するか,TakenobuTani,ラムダノート,202301
