isbn_or_asin,book_title,author,publisher,published_date
4339013730,"可視化と科学・文化・社会 = Visualization for Science,Digital Humanities,and Sociology 3 (メディアテクノロジーシリーズ)","竹島,由里子 伊藤,貴之 宮地,英生 田中,覚",コロナ社,202310
4339013749,ゲームグラフィックス表現技法 = Creative Techniques for Game Graphics 4 (メディアテクノロジーシリーズ),"金久保,哲也",コロナ社,202402
4492313702,現代マクロ経済学講義 : 動学的一般均衡モデル入門,"加藤,涼",東洋経済新報社,200701
4313180656,公務員の議会答弁言いかえフレーズ,"森下,寿",学陽書房,202110
4627852614,"超高速グラフ列挙アルゴリズム : 〈フカシギの数え方〉が拓く,組合せ問題への新アプローチ","湊,真一 科学技術振興機構",森北出版,201504
4478113408,Science Fictionsあなたが知らない科学の真実,"Ritchie,Stuart(StuartJ.) 矢羽野,薫,1969-",ダイヤモンド社,202401
4274224473,マスタリングTCP/IP 入門編,"井上,直也,1974- 村山,公保,1967- 竹下,降史,1965-",オーム社,201911
4560096392,ヨーロッパ中世象徴史,"Pastoureau,Michel,1947- 篠田,勝英,1948-",白水社,201805
4621061453,統計のための行列代数 1 上,,丸善出版,201201
4621061526,統計のための行列代数 2 下,,丸善出版,201201
4901007092,家政婦は見られた! : 土曜ワイド劇場(テレビ朝日系列)家政婦は見た!公式ガイドブック,"柴, 英三郎, 1926-,大沢家政婦研究所,柴英三郎 監修,大沢家政婦研究所 編",音羽出版,"Sat, 20 Mar 2010 08:59:59 +0900"
4815604975,図解入門TCP/IP = An Illustrated Introduction to TCP/IP : 仕組み・動作が見てわかる,"みやた,ひろし",SBクリエイティブ,202012
4815618593,体験しながら学ぶネットワーク技術入門,"みやた,ひろし",SBクリエイティブ,202401
4130606077,光の物理　新装版,小林浩一／著,東京大学出版会,20231102
484437849X,はじめて学ぶバイナリ解析 : 不正なコードからコンピュータを守るサイバーセキュリティ技術 / Next Publishing. OnDeck Books,"小林, 佐保,岡田, 怜士,浅部, 佑,満永, 拓邦,小林佐保, 岡田怜士, 浅部佑, 満永拓邦 著",[object Object],"Fri, 16 Oct 2020 04:54:12 +0900"
4594062539,マンガけもの道 : まんだらけ中野店副店長の珍作発掘探訪,"岩井, 道,岩井道 著",扶桑社,"Wed, 13 Oct 2010 00:10:12 +0900"
1786347849,Science Research Writing: For Native And Non-native Speakers Of English (second Edition),Hilary Glasman-deal,WSPC (EUROPE),2020-11-27
4469244082,これでいいのか大学入試英語 下,"Watkins,Gareth",大修館書店,199710
4469244074,これでいいのか大学入試英語 上,"Watkins,Gareth",大修館書店,199710
4309419267,屋根裏に誰かいるんですよ。 : 都市伝説の精神病理 か17-4 (河出文庫),"春日,武彦,1951-",河出書房新社,202210
4295013498,スーパーユーザーなら知っておくべきLINUXシステムの仕組み,"Ward,Brian,1972- 柴田,芳樹,1959-",インプレス,202203
4094083359,実録死体農場 / 小学館文庫,"Bass, William M,Jefferson, Jon,相原, 真理子, 1947-2010,ビル・バス, ジョン・ジェファーソン 著,相原真理子 訳",小学館,"Thu, 24 Jan 2013 07:02:29 +0900"
4775313010,図解魔術の歴史 No.048 (F FILES),"草野,巧,1956-",新紀元社,201503
4867660264,予言獣大図鑑,長野栄俊／編著 岩間理紀／著 笹方政紀／著 峰守ひろかず／著,文学通信,20231206
4873117437,メタプログラミングRuby,"Perrotta,Paolo 角,征典",オーム社,201510
4876872112,鉄道重大事故の歴史,"久保田,博,1924-",グランプリ出版,200006
4876874123,鉄道重大事故の歴史 : 鉄道事故に見る安全技術の進化,"久保田,博",グランプリ出版,202401
4588022180,最古の料理 (りぶらりあ選書),J.ボテロ／著 松島英子／訳,法政大学出版局,20031201
4560028729,悪魔の布 : 縞模様の歴史,"Pastoureau,Michel,1947- 松村,剛,1960- 松村,恵理,1962-",白水社,199305
4622087936,測りすぎ : なぜパフォーマンス評価は失敗するのか?,"Muller,JerryZ.,1954- 松本,裕",みすず書房,201904
4305708795,SP盤落語レコードがひらく近代日本語研究,金澤裕之・矢島正浩／編集,笠間書院,20190902
4274227553,凸解析と最適化理論 = Convex Analysis and Optimization Theory,"田中,謙輔,1933-2000",オーム社,202109
4562053151,悪魔と悪魔学の事典,"Guiley,Rosemary 金井,美子 木村,浩美 白須,清美,1969-",原書房,201604
4814400411,ルールズ・オブ・プログラミング : より良いコードを書くための21のルール,"Zimmerman,Chris 久富木,隆一",オーム社 (発売),202308
490868605X,数式組版 = Mathematical typography,"木枝,祐介",ラムダノート,201804
4862761593,フェアトレードのおかしな真実 : 僕は本当に良いビジネスを探す旅に出た,"Woodman,Conor 松本,裕",英治出版,201308
406527978X,Pythonではじめるベイズ機械学習入門 = Introduction to Bayesian Machine Learning with Python,"森賀,新 木田,悠歩 須山,敦志",講談社,202205
4065337631,Pythonでスラスラわかるベイズ推論「超」入門 = A super basic introduction to Bayesian inference in Python,"赤石,雅典 須山,敦志",講談社,202311
4780607892,線形代数学,"溝畑,潔 多久和,英樹 浦部,治一郎,1950-",学術図書出版社,201912
4065212707,しっかり学ぶ数理最適化 : モデルからアルゴリズムまで,"梅谷,俊治",講談社,202010
4336065772,怪異の表象空間 : メディア・オカルト・サブカルチャー,"一柳,広孝,1959-",国書刊行会,202003
4865283838,セミコロン　かくも控えめであまりにもやっかいな句読点,セシリア・ワトソン／著 萩澤大輝／翻訳 倉林秀男／翻訳,左右社,20230830
4768705251,アントンのやさしい線型代数,"Anton, Howard,山下, 純一, 1948-,H.アントン 著,山下純一 訳",現代数学社,"Mon, 10 Feb 2020 18:58:14 +0900"
4297123835,アートで魅せる数学の世界 = THE WORLD OF MATHEMATICS FASCINATED WITH ART,"岡本,健太郎,1990-",技術評論社,202111
4062577380,物理数学の直観的方法 : 理工系で学ぶ数学「難所突破」の特効薬 B-1738 (ブルーバックス),"長沼,伸一郎,1961-",講談社,201109
448084323X,当事者は嘘をつく,小松原織香／著,筑摩書房,20220131
4588200313,からくり 3 (ものと人間の文化史),立川昭二／著,法政大学出版局,19690601
4320114973,測度論からの数理統計学,綿森葉子／著 田中秀和／著 田中潮／著,共立出版,20230928
4802613199,統計学入門 : データ分析に必須の知識・考え方 : 仮説検定から統計モデリングまで重要トピックを完全網羅,"阿部,真人,1984-",ソシム,202112
4874249582,言語教育における多読,I.S.P.Nation／著 RobWaring／著 MitsueTabata-Sandom／監修 ほか,くろしお出版,20231025
4588200615,結び 6 (ものと人間の文化史),額田巌／著,法政大学出版局,19720301
4254111371,美しい不等式の世界 : 数学オリンピックの問題を題材として,"BulajichManfrino,Radmila／著 GómezOrtega,JoséAntonio／著 ほか",朝倉書店,2013-01
4627097212,確率的シミュレーション,"大久保,潤",森北出版,202312
4431712143,解析教程 下,"Hairer,Ernst Wanner,Gerhard 蟹江,幸博,1948-",シュプリンガー・ジャパン,200610
4431712135,解析教程 上,"Hairer,Ernst Wanner,Gerhard 蟹江,幸博,1948-",シュプリンガー・ジャパン,200610
4789837513,ディジタル回路の設計入門 : ハードウェアの動きを理解しながら学ぶ (トランジスタ技術special no.90),湯山俊夫,CQ出版,2005-4-1
4478117764,大学図鑑! 2024,,ダイヤモンド社,202303
4044007527,神秘学講義 G124-1 (角川ソフィア文庫),"高橋,巌,1928-2024",KADOKAWA,202303
4906529925,信州の秘境駅・小駅を巡る : 近代化から過疎化への100年旅,"久保田,稔,1960-",川辺書林,202203
4299042387,クセがスゴい不動産,あなたの理想不動産,宝島社,202306
4802213050,秘境駅で途方に暮れた,"カベルナリア吉田,1965-",イカロス出版,202306
4065332834,中世ヨーロッパの色彩世界 2784 (講談社学術文庫),"徳井,淑子,1949-",講談社,202309
4798027979,わかる!電子工作の基本100,"遠藤,敏夫,1949-",秀和システム,201012
0071752064,Practice Makes Perfect English Articles and Determiners Up Close (Practice Makes Perfect Series),Mark Lester,McGraw-Hill Education,2013-08-07
4480056599,読み書きの技法 / ちくま新書,"小河原, 誠, 1947-,小河原誠 著",筑摩書房,"Tue, 30 Jul 1996 09:00:00 +0900"
4480084886,日本文学史序説　（下）,加藤周一／著,筑摩書房,19990401
4480084878,日本文学史序説　（上）,加藤周一／著,筑摩書房,19990401
4320124006,ENIAC : 現代計算技術のフロンティア,"Haigh,Thomas,1972- Priestley,PeterMark Rope,Crispin ほか",共立出版,201606
4002710807,検証ナチスは「良いこと」もしたのか? No.1080 (岩波ブックレット),"小野寺,拓也,1975- 田野,大輔,1970-",岩波書店,202307
450246371X,デジタル技術の進展と会計情報,"奥村,雅史",中央経済グループパブリッシング (発売),202307
4309416845,日本の偽書 ふ19-1 (河出文庫),"藤原,明,1958-",河出書房新社,201905
4798179809,なっとく!関数型プログラミング : 関数型プログラミングの基本概念の全容を把握し活用したい開発者に,"Płachta,Michał クイープ",翔泳社,202308
1837639965,Architecture and Design of the Linux Storage Stack: Gain a deep understanding of the Linux storage landscape and its well-coordinated layers,Muhammad Umer,Packt Publishing,2023-07-28
4102184716,ケプラー予想 : 四百年の難問が解けるまで シ-38-12 (新潮文庫),"Szpiro,George,1950- 青木,薫,1956-",新潮社,201401
4764903881,コンピュータ・ジオメトリ : 計算幾何学:アルゴリズムと応用,"Berg, Mark de,Cheong, Otfried,Kreveld, Marc van,浅野, 哲夫, 1949-,M.ドバーグ, O.チョン, M.ファン・クリベルド, M.オーバマーズ 著,浅野哲夫 訳",近代科学社,"Fri, 26 Mar 2010 00:14:09 +0900"
4320094700,なぜ壁のシミが顔に見えるのか : パレイドリアとアニマシーの認知心理学 10 (越境する認知科学),日本認知科学会／編集 高橋康介／著,共立出版,20230912
4785322799,理工系学生のための量子力学・統計力学入門,"小鍋,哲,1979-",裳華房,202307
4815809798,ヨーロッパ中世の想像界,池上俊一／著,名古屋大学出版会,20200305
4905033314,プロジェクト・シン・エヴァンゲリオン : 実績・省察・評価・総括,"カラー,カラー 編",[object Object],"Thu, 10 Aug 2023 06:20:19 +0900"
4585303022,共振するデジタル人文学とデジタルアーカイブ (デジタルアーカイブ・ベーシックス),"鈴木,親彦,1980-",勉誠社,202307
4873117283,ヘルシープログラマ : プログラミングを楽しく続けるための健康Hack,"Kutner,Joe 玉川,竜司,1964-",オーム社,201507
4798918431,企業が求める〈主体性〉とは何か : 教育と労働をつなぐ〈主体性〉言説の分析,"武藤,浩子",東信堂,202304
4903966364,ホガースの時代 : 版画で読むイギリス,"中村, 隆, 1961-,中村隆 著",山形大学出版会,"Sat, 13 May 2023 06:29:24 +0900"
4787292749,怪談の仕掛け,伊藤龍平／著,青弓社,20230620
4065324017,プリキュアコスチュームクロニクル = Precure Costume Chronicle : プリキュア20周年アニバーサリー,東映アニメーション株式会社,講談社,202310
9811379661,"Kawaii Engineering: Measurements, Evaluations, and Applications of Attractiveness (Springer Series on Cultural Computing)",Michiko Ohkura,Springer,2020-08-15
425420163X,"「かわいい」工学 = ""KAWAII"" Engineering","大倉,典子,1953-",朝倉書店,201703
4309419690,日本怪談実話 た52-1 (河出文庫),"田中,貢太郎,1880-1941",河出書房新社,202306
4309419712,戦前のこわい話 : 怪奇実話集 し10-3 (河出文庫),"志村,有弘,1941-",河出書房新社,202306
481440039X,RustとWebAssemblyによるゲーム開発 : 安全・高速・プラットフォーム非依存のWebアプリ開発入門,"Smith,Eric 中田,秀基,1967-",オーム社 (発売),202307
4331150526,プログラム学習による基礎電気工学 交流編 / 電気基礎講座 ; 3,"松下電器工学院,松下電器工学院 編著",[object Object],"Thu, 17 Apr 1997 00:00:00 +0900"
4331150518,プログラム学習による基礎電気工学 直流編 / 電気基礎講座 1,"松下電器工学院,松下電器工学院 編著",松下電器産業,"Thu, 3 Dec 2009 09:00:00 +0900"
433115050X,基礎電子工学 : プログラム学習による 電子回路編　１ ５ (電気基礎講座),松下電器工学院 末武国弘,松下電器産業,1975
4641150044,金融のエッセンス = THE ESSENCE OF BANKING & FINANCE (有斐閣ストゥディア),"川西,諭 山崎,福寿,1954-",有斐閣,201312
4872596447,アーカイブズとアーキビスト 76 (阪大リーブル),大阪大学アーカイブズ／編 高橋明男／著 菅真城／著 三阪佳弘／著 矢切努／著 三輪宗弘／著 ほか,大阪大学出版会,20210410
4800307961,元報道記者が見た昭和事件史 : 歴史から抹殺された惨劇の記録,"石川,清,1964-",洋泉社,201511
4814400225,プログラミング文体練習 : Pythonで学ぶ40のプログラミングスタイル,"Lopes,CristinaVideira 菊池,彰",オーム社 (発売),202306
4863135629,絶対に停まらない世界の廃墟駅 (NATIONAL GEOGRAPHIC),"Ross,David(DavidSoutherland) 大島,聡子",日経BPマーケティング (発売),202305
4622095556,デジタル時代のアーカイブ系譜学,"柳,与志夫,1954- 加藤,諭,1978- 宮本,隆史,1979-",みすず書房,202212
4761101857,仙人ワンダーランド : 和漢仙人列伝,"影山,純夫,1947-",河原書店,202305
4390114956,フランス怪奇民話集 / 現代教養文庫 ; 1495,"植田, 祐次, 1936-,山内, 淳, 1951-,植田祐次, 山内淳 訳編",社会思想社,"Wed, 30 Mar 1994 09:00:00 +0900"
4040667956,東京大学の学術遺産捃拾帖 103 (メディアファクトリー新書),"モリナガ,ヨウ,1966-",KADOKAWA,201406
4837967701,あなたの知らない「ヘン」な法律 A86-1 (王様文庫),"なかむら,いちろう",三笠書房,201512
4295003255,新人エンジニアのためのインフラ入門 / Think IT BOOKS,"BFT,BFT 著",インプレス,"Mon, 9 Apr 2018 23:56:19 +0900"
400500850X,聖徳太子 : ほんとうの姿を求めて 850 (岩波ジュニア新書),"東野,治之,1946-",岩波書店,201704
4834013871,昔話の語法,"小沢,俊夫,1930-",福音館書店,199910
4908468605,エセ著作権事件簿 Vol.1 (過剰権利主張ケーススタディーズ),友利昴／著,パブリブ,20220711
4061592432,ケルト妖精学 (講談社学術文庫),"井村,君江,1932-",講談社,199608
4480087966,ケルト妖精学 / ちくま学芸文庫,"井村, 君江, 1932-,井村君江 著",筑摩書房,"Tue, 20 Jan 2004 01:54:48 +0900"
4862464831,ゲームエンジンアーキテクチャ,"Gregory,Jason 今給黎,隆,1972- 湊,和久 大貫,宏美 田中,幸,翻訳家",ボーンデジタル,202012
4771036934,就活の社会学 : 大学生と「やりたいこと」,"妹尾,麻美,1988-",晃洋書房,202301
4865280685,わたしが先生の「ロリータ」だったころ,アリソン・ウッド／著者 服部理佳／訳者,左右社,20220307
4422215450,奇妙な国境や境界の世界地図,"Nikolić,Zoran,1975- 松田,和也,1963-",創元社,202301
4798068160,"Good Code,Bad Code : 持続可能な開発のためのソフトウェアエンジニア的思考","Long,Tom 秋,勇紀 高田,新山 山本,大祐,1983-",秀和システム,202302
4873119650,Googleのソフトウェアエンジニアリング : 持続可能なプログラミングを支える技術、文化、プロセス,"Winters,Titus Manshreck,Tom Wright,Hyrum 竹辺,靖昭 ほか",オーム社 (発売),202111
448068431X,私たちはどう学んでいるのか ４０３ (ちくまプリマー新書),鈴木宏昭／著,筑摩書房,20220609
4334035086,難解な本を読む技術 406 (光文社新書),"高田,明典,1961-",光文社,200905
415050251X,火星の人類学者 : 脳神経科医と7人の奇妙な患者 (ハヤカワ文庫 : NF),"Sacks,Oliver,1933-2015 吉田,利子,1946-",早川書房,200104
400006343X,拡散モデル = Diffusion Models : データ生成技術の数理,"岡野原,大輔,1982-",岩波書店,202302
4622089513,患者の話は医師にどう聞こえるのか : 診察室のすれちがいを科学する,"Ofri,Danielle,1965- 原井,宏明 勝田,さよ",みすず書房,202011
1680502549,Domain Modeling Made Functional: Tackle Software Complexity with Domain-Driven Design and F#,Scott Wlaschin,Pragmatic Bookshelf,2018-03-06
4320035763,実践計算物理学 = Computational Physics Practical Use of Python for Studying Physics : 物理を理解するためのPython活用法 22 (フロー式物理演習シリーズ),"野本,拓也 是常,隆 有田,亮太郎 須藤,彰三 岡,真,1953-",共立出版,202301
4764905132,IT技術者の長寿と健康のために,"情報通信医学研究所 長野,宏宣,1945- 中川,晋一,1961- 蒲池,孝一,1947-",近代科学社,201606
0312383215,What People Wore When: A Complete Illustrated History of Costume from Ancient Times to the Nineteenth Century for Every Level of Society,Melissa Leventon,St. Martin's Griffin,2008-07-08
4883842266,はじめての人のための経済学史 (経済学叢書Introductory),"江頭,進,1966-",サイエンス社,201506
4798061700,実践Rustプログラミング入門 = introduction to rust programming,"初田,直也 山口,聖弘 吉川,哲史 豊田,優貴 松本,健太郎,webエンジニア 原,将己 ほか",秀和システム,202009
4562071990,ポワロと私 : デビッド・スーシェ自伝,"Suchet,David,1946- Wansell,Geoffrey,1945- ほか",原書房,202210
4814000480,科学論文の英語用法百科　第２編,グレン・パケット／著,京都大学学術出版会,20161017
4535787603,学んでみよう!記号論理,"高崎,金久,1956-",日本評論社,201408
4562072547,世界を騙した女詐欺師たち,"Telfer,Tori 富原,まさ江,1965-",原書房,202302
4344953304,幼なじみ萌え : ラブコメ恋愛文化史,"玉井,建也",幻冬舎,201711
3031004418,General Game Playing (Synthesis Lectures on Artificial Intelligence and Machine Learning),"Michael Genesereth,Michael Thielscher",Springer,2014-03-18
4798125393,実践プログラミングDSL : ドメイン特化言語の設計と実装のノウハウ (Programmer's SELECTION),"Ghosh,Debasish,1953- 佐藤,竜一,1972-",翔泳社,201206
4839967091,囲碁ディープラーニングプログラミング,"Pumperla,Max Ferguson,Kevin 山岡,忠夫",マイナビ出版,201904
4788508427,神、人を喰う : 人身御供の民俗学,"六車,由実,1970-",新曜社,200303
4641163642,比較制度分析・入門 (単行本),中林真幸／編集 石黒真吾／編集,有斐閣,20101223
4896944712,図説数の文化史 : 世界の数字と計算法,"Menninger,Karl,1898-1963 内林,政夫,1930-",八坂書房,200104
4309460631,ホームズ贋作展覧会 / 河出文庫,"各務, 三郎, 1936-,各務三郎 編",河出書房新社,"Thu, 5 Oct 1989 09:00:00 +0900"
4641165483,実証のための計量時系列分析 (単行本),ウォルター・エンダース（Walter／著 新谷元嗣／翻訳 藪友良／翻訳,有斐閣,20191212
0321842685,Hacker's Delight,Henry Warren,Addison-Wesley Professional,2012-09-25
4434046683,ハッカーのたのしみ : 本物のプログラマはいかにして問題を解くか,"Warren,HenryS 滝沢,徹",星雲社,200409
4774153265,人間に勝つコンピュータ将棋の作り方,コンピュータ将棋協会,技術評論社,201211
4814400160,自分だけのボードゲームを作ろう : ゲームをデザインして、作って、みんなでプレイする (Make : Japan Books),"Daniels,JesseTerrance 金井,哲夫,1958-",オーム社 (発売),202212
4002710521,「私物化」される国公立大学 No.1052 (岩波ブックレット),"駒込,武,1962-",岩波書店,202109
4480438319,神田神保町書肆街考 か－２７－２ (ちくま文庫),鹿島茂／著,筑摩書房,20221013
4787210130,ボンデージ進化論,北原童夢／著,青弓社,19920401
4297102838,逆引きPIC電子工作やりたいこと事典,"後閑, 哲也, 1947-,後閑哲也 著",技術評論社,"Thu, 13 Jun 2019 19:43:25 +0900"
4816357688,オールカラー普通免許〈ひっかけ対策〉問題集 : そのまま本試験,,ナツメ社,201502
4588276476,鉄道旅行の歴史　〈新装版〉,W.シヴェルブシュ／著 加藤二郎／訳,法政大学出版局,20111209
4758017832,中谷友紀子東映アニメーションプリキュアワークス = Nakatani Yukiko TOEI ANIMATION PRECURE WORKS 2,"中谷,友紀子,1986-",講談社 (発売),202210
4297130343,リアルタイムグラフィックスの数学 = Mathematics of Real-Time Graphics : GLSLではじめるシェーダプログラミング,"巴山,竜来,1982-",技術評論社,202209
4320122992,量子情報科学入門 = Introduction to Quantum Information Science,"石坂,智 小川,朋宏 河内,亮周",共立出版,201206
4297129140,作って学ぶコンピュータアーキテクチャ : LLVMとRISC-5による低レイヤプログラミングの基礎,"木村,優之",技術評論社,202207
4484121034,性欲の科学 : なぜ男は「素人」に興奮し、女は「男同士」に萌えるのか,"Ogas,Ogi Gaddam,Sai 坂東,智子,1955-",阪急コミュニケーションズ,201202
4121506197,サラブレッドに「心」はあるか 619 (中公新書ラクレ),"楠瀬,良,1951-",中央公論新社,201804
4642080937,日本近代史を学ぶための文語文入門 : 漢文訓読体の地平,"古田島,洋介,1957-",吉川弘文館,201309
412101216X,理科系のための英文作法 : 文章をなめらかにつなぐ四つの法則 (中公新書),"杉原,厚吉,1948-",中央公論社,199411
4326504927,経済学の哲学入門 : 選好、価値、選択、および厚生,"Hausman,DanielM.,1947- 橋本,努,1967- ニキ,リンコ,1965-",勁草書房,202205
4000059416,ファインマン計算機科学,"Feynman,RichardPhillips,1918-1988 Hey,AnthonyJ.G ほか",岩波書店,199901
4492313605,政策評価ミクロモデル 15 (経済政策分析シリーズ),"金本,良嗣,1950- 蓮池,勝人 藤原,徹 経済産業研究所",東洋経済新報社,200603
4274223132,Rによる計量政治学,"浅野,正彦 矢内,勇生,1982-",オーム社,201812
4140912723,論文の教室 : レポートから卒論まで 1272 (NHKブックス),"戸田山,和久,1958-",NHK出版,202201
4297128462,達人が教えるWebパフォーマンスチューニング : ISUCONから学ぶ高速化の実践,"藤原,俊一郎 馬場,俊彰 中西,建登 長野,雅広 金子,達哉,1991- 草野,翔",技術評論社,202206
490381419X,これならわかる工学部で学ぶ数学,"千葉,逸人,1982-",プレアデス出版,200902
4320111397,確率的グラフィカルモデル = Probabilistic Graphical Model,"鈴木,譲 植野,真臣",共立出版,201607
4254122144,はじめての統計データ分析 : ベイズ的〈ポストp値時代〉の統計学,"豊田,秀樹,1961-",朝倉書店,201605
4254295405,入門ベイズ統計学 10 (ファイナンス・ライブラリー),"中妻,照雄,1968-",朝倉書店,200706
4254122209,実践ベイズモデリング : 解析技法と認知モデル,"豊田,秀樹,1961-",朝倉書店,201701
4478013322,完全独習ベイズ統計学入門,"小島,寛之,1958-",ダイヤモンド社,201511
4320113446,ゲームで大学数学入門 = A Glimpse into University Math Through Games : スプラウトからオイラー・ゲッターまで,"安田,健彦",共立出版,201812
4434042408,素因数分解と素数判定,"Bressoud,DavidM,1950- 玉井,浩",星雲社,200403
4641053855,計量経済学 (New Liberal Arts Selection),西山慶彦／著・文・その他 新谷元嗣／著・文・その他 川口大司／著・文・その他 奥井亮／著・文・その他,有斐閣,20190729
490965819X,デジタル学術空間の作り方,下田正弘／編著 永﨑研宣／編著,文学通信,20191218
4759821678,理工系のAI英作文術 : 誰でも簡単に正確な英文が書ける,"西山,聖久",化学同人,202205
439329162X,魔法少女はなぜ変身するのか : ポップカルチャーのなかの宗教,"石井,研士,1954-",春秋社,202206
4750352861,現代日本のエリートの平等観,竹中佳彦／編 山本英弘／編 濱本真輔／編,明石書店,20211227
4758017115,高橋晃東映アニメーションプリキュアワークス = : TAKAHASHI AKIRA TOEI ANIMATION PRECURE WORKS,"高橋,晃,1971-",講談社 (発売),202102
4562071818,緯度を測った男たち : 18世紀、世界初の国際科学遠征隊の記録,"Crane,Nicholas,1954- 上京,恵",原書房,202205
4562071826,古代ワインの謎を追う : ワインの起源と幻の味をめぐるサイエンス・ツアー,"Begos,Kevin(KevinPaul) 矢沢,聖子,1951-",原書房,202206
4335358857,情報刑法 1,"鎮目,征樹,1973- 西貝,吉晃,1981- 北條,孝佳 荒木,泰貴 遠藤,聡太 ほか",弘文堂,202206
4806714453,〈図説〉日本の結び,"藤原,覚一,1895-1990",築地書館,201210
