isbn_or_asin,book_title,author,publisher,published_date
4297138891,LATEX美文書作成入門,"奥村,晴彦,1951- 黒木,裕介,1982-",技術評論社,202312
4297145464,［作って学ぶ］ブラウザのしくみ──HTTP、HTML、CSS、JavaScriptの裏側,土井麻未,技術評論社,
4814400942,Effective Rust : Rustコードを改善し、エコシステムを最大限に活用するための35項目,DavidDrysdale 中田秀基,オーム社,
4781651062,とんねるずと『めちゃイケ』の終わり : 〈ポスト平成〉のテレビバラエティ論 106 (イースト新書),ラリー遠田,イースト・プレス,201808
4798153222,プログラマのためのDocker教科書 : インフラの基礎知識&コードによる環境構築の自動化,"阿佐,志保 山田,祥寛",翔泳社,201804
4814400217,入門モダンLinux : オンプレミスからクラウドまで、幅広い知識を会得する,"Hausenblas,Michael 武内,覚 大岩,尚宏",オーム社 (発売),202304
4814400500,Raspberry Piクックブック (Make : PROJECTS),"Monk,Simon 水原,文",オーム社,202401
4798071501,開発系エンジニアのためのDocker絵とき入門 : 定番技術の基本をビジュアルで理解する : Dockerの「なぜ」を解決!,"鈴木,亮,pub.2024",秀和システム,202401
4814400756,生成 Deep Learning 第2版 : 絵を描き、物語や音楽を作り、ゲームをプレイする,DavidFoster 松田晃一 小沼千絵,,
4576221477,オカルト・クロニクル = OCCULT CHRONICLE : 奇妙な事件奇妙な出来事奇妙な人物,"松閣,オルタ",二見書房,202210
4588364057,ファランの痙攣派,中村浩巳／著,法政大学出版局,19940601
4000058894,地力をつける 微分と積分,小林俊行,岩波書店,
4873117208,作ることで学ぶ : Makerを育てる新しい教育のメソッド (Make : Japan Books),"Martinez,SylviaLibow Stager,Gary 阿部,和広 酒匂,寛,1958-",オーム社,201503
4254131526,学習物理学入門,橋本幸士,朝倉書店,
4910038965,創られたキリシタン像 (西南学院大学博物館研究叢書),鬼束芽依／編集,西南学院大学博物館,20240830
4910315314,とるにたらない美術,原田裕規／著,ケンエレブックス,20231128
4845913143,ラッセンとは何だったのか? : 消費とアートを越えた「先」,"原田, 裕規, 1989-,原田裕規 編著",フィルムアート社,"Fri, 8 Mar 2024 17:31:33 +0900"
4798177849,絵で見てわかるLinuxカーネルの仕組み (絵で見てわかる),市川正美 大岩尚宏 島本裕志 武内覚 田中隆久 丸山翔平,翔泳社,
4167257033,田宮模型の仕事 (文春文庫),"田宮,俊作,1934-",文藝春秋,200005
4908468702,エセ商標権事件簿 Vol.2 (過剰権利主張ケーススタディーズ),友利昴／著,パブリブ,20231215
441662378X,スイッチバック大全 : 日本の“折り返し停車場”140ヶ所の魅力と歴史を全紹介,江上英樹 栗原景,誠文堂新光社,
4480427457,絶滅寸前季語辞典,夏井いつき／著,筑摩書房,20100801
4163918949,コード・ブッダ = CODE BUDDHA : 機械仏教史縁起,"円城,塔",文藝春秋,202409
4297143097,深層ニューラルネットワークの高速化,佐藤竜馬,技術評論社,
4903474496,コンピュータグラフィックス = Computer graphics,画像情報教育振興協会,画像情報教育振興協会,201503
4903474577,ビジュアル情報処理 : CG・画像処理入門 : CGエンジニア検定・画像処理エンジニア検定ベーシック対応書籍,画像情報教育振興協会,画像情報教育振興協会,"Thu, 22 Jun 2017 02:37:43 +0900"
4839984166,大規模データセットのためのアルゴリズムとデータ構造 (Compass),DzejlaMedjedovic EminTahirovic InesDedovic ほか,マイナビ出版,
456962457X,素人のように考え、玄人として実行する : 問題解決のメタ技術,"金出,武雄,1945-",PHP研究所,200306
4336075514,ナポレオン時代の犯罪,ジャン・チュラール 辻谷泰志,国書刊行会,
4065356350,暗号の理論と技術 = Theory and Practice of Cryptography : 量子時代のセキュリティ理解のために,"國廣,昇,1971-",講談社,202405
4826902131,事実はなぜ人の意見を変えられないのか : 説得力と影響力の科学,"Sharot,Tali 上原,直子",白揚社,201908
491125601X,絶望からの新聞論,南彰／著,地平社,20240430
462205051X,ロビンソン変形譚小史 : 物語の漂流 (みすずライブラリー),"岩尾,竜太郎,1952-2010",みすず書房,200003
4000612468,社会科学のためのデータ分析入門. 下,"今井,耕介 粕谷,祐子,1968- 原田,勝孝 久保,浩樹",岩波書店,201804
400061245X,社会科学のためのデータ分析入門. 上,"今井,耕介 粕谷,祐子,1968- 原田,勝孝",岩波書店,201803
4297125625,コンセプトから理解するRust,"原,旅人,1975-",技術評論社,202202
4863135939,地球史マップ : 誕生・進化・流転の全記録,"Grataloup,Christian 藤村,奈緒美 瀧下,哉代 辻森,樹,1972-",日経BPマーケティング,202401
4065221382,統計力学入門 = Introduction to Statistical Mechanics : 愚問からのアプローチ,"高橋,康,1923-2013",講談社,202104
4798635758,アクションポーズ大全　アクション漫画家が欲しかった魅せるポーズ5000,霧月,ホビージャパン,
4480430695,中華料理の文化史,張競／著,筑摩書房,20130601
4000298968,テキストアナリティクスの基礎と実践 1 (テキストアナリティクス),"金,明哲,1954- 金,明哲,1954-",岩波書店,202103
4309421121,日本怪奇物語 と13-1 (河出文庫),"富岡,直方",河出書房新社,202406
479520120X,数論を学ぶ人のための相互法則入門 18 (数理情報科学シリーズ),"平松,豊一,1937-",星雲社,199805
4535559473,地域データ分析入門 = Introduction to Regional Data Analysis : すぐに役立つEBPM実践ガイドブック,"林,宜嗣,1951- 林,亮輔,1983- 高林,喜久生,1953- 林,勇貴,1988- ほか",日本評論社,202112
0714111538,Ancient Board Games in Perspective,Irving Finkel,British Museum Press,2007
4845921324,映像クリエイターのための完全独学マニュアル,,フィルムアート社,20221026
4297141922,Rustで作るプログラミング言語 —— コンパイラ／インタプリタの基礎からプログラミング言語の新潮流まで,佐久田昌博,技術評論社,
4048931164,関数型ドメインモデリング : ドメイン駆動設計とF#でソフトウェアの複雑さに立ち向かおう,"Wlaschin,Scott 猪股,健太郎,1975-",KADOKAWA,202406
4254122128,基礎からのベイズ統計学 : ハミルトニアンモンテカルロ法による実践的入門,"豊田,秀樹,1961-",朝倉書店,201506
4845921170,色のコードを読む,ポール・シンプソン／著 中山ゆかり／翻訳,フィルムアート社,20221224
4814400799,脳に収まるコードの書き方 : 複雑さを避け持続可能にするための経験則とテクニック,"Seemann,Mark 吉羽,龍太郎 原田,騎郎",オーム社,202406
4771036543,聖家族の終焉とおじさんの逆襲 = Das Ende der Heiligen Familie und der Gegenangriff des Onkels : 両大戦間期ドイツ児童文学の世界,"佐藤,文彦,1973-",晃洋書房,202212
427423116X,Pythonで学ぶ効果検証入門 = Learn Impact Evaluation With Python,"安井,翔太 伊藤,寛武 金子,雄祐",オーム社,202405
4320124960,機械学習 : ベイズと最適化の観点から,"Theodoridis,Sergios,1951- 岩野,和生 中島,秀之,1952-",共立出版,202212
4065225493,これならわかる機械学習入門 = Understanding Machine Learning from Scratch,"富谷,昭夫",講談社,202103
4297111179,効果検証入門 : 正しい比較のための因果推論/計量経済学の基礎,"安井,翔太 ホクソエム",技術評論社,202001
4758121214,基礎から学ぶ統計学,"中原,治,1966-",羊土社,202209
4807920294,データサイエンスと機械学習 : 理論からPythonによる実装まで (DIGITAL FOREST),"Kroese,DirkP Botev,ZdravkoI.,1982- Taimre,Thomas,1983- ほか",東京化学同人,202212
4627097034,ベイズデータ解析,"Gelman,Andrew Carlin,JohnB Stern,HalSteven ほか",森北出版,202406
4903814874,時系列分析と状態空間モデルの基礎 = Foundations of Time Series Analysis and State Space Models : RとStanで学ぶ理論と実装,"馬場,真哉,1990-",プレアデス出版,201803
482400702X,ただのぽんこつ母さんだと思っていたらADHDグレーでした。 (はちみつコミックエッセイ),はなゆい,オーバーラップ,202401
4334044689,日本の少子化対策はなぜ失敗したのか? : 結婚・出産が回避される本当の原因 1067 (光文社新書),"山田,昌弘,1957-",光文社,202005
4065347823,グラフニューラルネットワーク = Graph Neural Networks (機械学習プロフェッショナルシリーズ),"佐藤,竜馬,1996- 杉山,将",講談社,202404
477752275X,よくわかる世界のサイバー犯罪 : フェイクニュース、スパイウェア、個人情報の流出から身を守る : サイバー犯罪の現在を知り自分の身を守ろう (I/O BOOKS),"御池,鮎樹",工学社,202404
4864260524,調査されるという迷惑　増補版,宮本常一 安渓遊地,みずのわ出版,
4791714636,特集民俗学の現在,,青土社,202405
4774143731,3分間ネットワーク基礎講座 : 世界一わかりやすいネットワークの授業,"網野,衛二",技術評論社,201010
4802613903,発達障害・メンタル不調などに気づいたときに読む本 : 精神科の受診や特徴までがわかる,"浜内,彩乃",ソシム,202212
4150506094,ヴィクトリア朝時代のインターネット 609 (ハヤカワ文庫 NF),"Standage,Tom,1969- 服部,桂,1951-",早川書房,202405
4908686106,Webブラウザセキュリティ : Webアプリケーションの安全性を支える仕組みを整理する,"米内,貴志",ラムダノート,202101
4005007929,キリスト教入門 792 (岩波ジュニア新書),"山我,哲雄,1951-",岩波書店,201412
4798068853,Blender Python完全ガイド,ぬっち,秀和システム,202401
4022618655,関西人の正体 い45-4 (朝日文庫),"井上,章一,1955-",朝日新聞出版,201607
4263731638,マイナーエマージェンシー,"大滝,純司,1958- 齊藤,裕之 Buttaravoli,PhilipM Leffler,StephenM",医歯薬出版,201503
4480512233,ガロアの夢 群論と微分方程式 ク-36-1 (ちくま学芸文庫),久賀道郎／本文,筑摩書房,20231211
4635140075,感謝されない医者 : ある凍傷Dr.のモノローグ,"金田,正樹,1946-2019",山と溪谷社,200703
4798069744,ストレンジコード : 難解プログラミング言語を巡る不思議な旅,"Kneusel,RonaldT 水野,貴明,1973- 竹迫,良範,1977-",秀和システム,202402
4320113845,実解析の助け舟 : 証明の理解に必要なすべてのツール,"Grinberg,Raffi,1990- 蟹江,幸博,1948-",共立出版,201909
4062576201,高校数学でわかるボルツマンの原理 : 熱力学と統計力学を理解しよう B-1620 (ブルーバックス),"竹内,淳,1960-",講談社,200811
4062575450,高校数学でわかる半導体の原理 : 電子の動きを知って理解しよう B-1545 (ブルーバックス),"竹内,淳,1960-",講談社,200703
4062574705,高校数学でわかるシュレディンガー方程式 : 量子力学を学びたい人、ほんとうに理解したい人へ (ブルーバックス),"竹内,淳,1960-",講談社,200503
4621309048,アルゴリズム設計マニュアル. 下,"Skiena,StevenS 平田,富夫,1949-",丸善出版,202401
462130903X,アルゴリズム設計マニュアル. 上,"Skiena,StevenS 平田,富夫,1949-",丸善出版,202401
4908686165,プログラマーのためのCPU入門 : CPUは如何にしてソフトウェアを高速に実行するか,TakenobuTani,ラムダノート,202301
4339013730,"可視化と科学・文化・社会 = Visualization for Science,Digital Humanities,and Sociology 3 (メディアテクノロジーシリーズ)","竹島,由里子 伊藤,貴之 宮地,英生 田中,覚",コロナ社,202310
4339013749,ゲームグラフィックス表現技法 = Creative Techniques for Game Graphics 4 (メディアテクノロジーシリーズ),"金久保,哲也",コロナ社,202402
4492313702,現代マクロ経済学講義 : 動学的一般均衡モデル入門,"加藤,涼",東洋経済新報社,200701
4313180656,公務員の議会答弁言いかえフレーズ,"森下,寿",学陽書房,202110
4627852614,"超高速グラフ列挙アルゴリズム : 〈フカシギの数え方〉が拓く,組合せ問題への新アプローチ","湊,真一 科学技術振興機構",森北出版,201504
4478113408,Science Fictionsあなたが知らない科学の真実,"Ritchie,Stuart(StuartJ.) 矢羽野,薫,1969-",ダイヤモンド社,202401
4274224473,マスタリングTCP/IP 入門編,"井上,直也,1974- 村山,公保,1967- 竹下,降史,1965-",オーム社,201911
4782706863,大学の化学への招待,"井上,亨,1947- 川田,知,1960- 栗原,寬人,1933-",三共出版,201303
4585390340,今昔物語集の怪異を読む : 巻第二十七「霊鬼」,"森,正人,1948-",勉誠社,202312
4589043041,無作為抽出ウェブ調査の挑戦,"杉野,勇 平沢,和司,1962-",法律文化社,202401
4863544332,改訂新版 インフラエンジニアの教科書,佐野裕／著,シーアンドアール研究所,20231114
4480857745,王を殺した豚王が愛した象 : 歴史に名高い動物たち,"Pastoureau, Michel, 1947-,松村, 恵理, 1962-,松村, 剛, 1960-,ミシェル・パストゥロー 著,松村恵理, 松村剛 訳",筑摩書房,"Mon, 7 Jul 2003 20:02:08 +0900"
4560096392,ヨーロッパ中世象徴史,"Pastoureau,Michel,1947- 篠田,勝英,1948-",白水社,201805
4621061453,統計のための行列代数 1 上,,丸善出版,201201
4621061526,統計のための行列代数 2 下,,丸善出版,201201
4431709398,楽器の物理学,"Fletcher,NevilleHorner Rossing,ThomasD,1929- ほか",シュプリンガー・フェアラーク東京,200210
4560026386,ヨーロッパ中世象徴史,"Pastoureau,Michel,1947- 篠田,勝英,1948-",白水社,200810
4901007092,家政婦は見られた! : 土曜ワイド劇場(テレビ朝日系列)家政婦は見た!公式ガイドブック,"柴, 英三郎, 1926-,大沢家政婦研究所,柴英三郎 監修,大沢家政婦研究所 編",音羽出版,"Sat, 20 Mar 2010 08:59:59 +0900"
4320114558,組合せ論の発見 : 古代から現代へ,"Wilson,RobinJ.,1943- Watkins,JohnJ 高瀬,正仁,1951- ほか",共立出版,202106
4785315652,複素関数論の基礎,"山本,直樹,1976-",裳華房,201511
432745317X,読解のための上級英文法,,研究社,202312
4815604975,図解入門TCP/IP = An Illustrated Introduction to TCP/IP : 仕組み・動作が見てわかる,"みやた,ひろし",SBクリエイティブ,202012
4815618593,体験しながら学ぶネットワーク技術入門,"みやた,ひろし",SBクリエイティブ,202401
4130606077,光の物理　新装版,小林浩一／著,東京大学出版会,20231102
484437849X,はじめて学ぶバイナリ解析 : 不正なコードからコンピュータを守るサイバーセキュリティ技術 / Next Publishing. OnDeck Books,"小林, 佐保,岡田, 怜士,浅部, 佑,満永, 拓邦,小林佐保, 岡田怜士, 浅部佑, 満永拓邦 著",[object Object],"Fri, 16 Oct 2020 04:54:12 +0900"
4594062539,マンガけもの道 : まんだらけ中野店副店長の珍作発掘探訪,"岩井, 道,岩井道 著",扶桑社,"Wed, 13 Oct 2010 00:10:12 +0900"
1786347849,Science Research Writing For Native and Non-native Speakers of English,Hilary Glasman-Deal,World Scientific,2020
4469244082,これでいいのか大学入試英語 下,"Watkins,Gareth",大修館書店,199710
4469244074,これでいいのか大学入試英語 上,"Watkins,Gareth",大修館書店,199710
4309419267,屋根裏に誰かいるんですよ。 : 都市伝説の精神病理 か17-4 (河出文庫),"春日,武彦,1951-",河出書房新社,202210
4295013498,スーパーユーザーなら知っておくべきLINUXシステムの仕組み,"Ward,Brian,1972- 柴田,芳樹,1959-",インプレス,202203
4094083359,実録死体農場 / 小学館文庫,"Bass, William M,Jefferson, Jon,相原, 真理子, 1947-2010,ビル・バス, ジョン・ジェファーソン 著,相原真理子 訳",小学館,"Thu, 24 Jan 2013 07:02:29 +0900"
4775313010,図解魔術の歴史 No.048 (F FILES),"草野,巧,1956-",新紀元社,201503
4867660264,予言獣大図鑑,長野栄俊／編著 岩間理紀／著 笹方政紀／著 峰守ひろかず／著,文学通信,20231206
4873117437,メタプログラミングRuby,"Perrotta,Paolo 角,征典",オーム社,201510
4876872112,鉄道重大事故の歴史,"久保田,博,1924-",グランプリ出版,200006
4876874123,鉄道重大事故の歴史 : 鉄道事故に見る安全技術の進化,"久保田,博",グランプリ出版,202401
4274227553,凸解析と最適化理論 = Convex Analysis and Optimization Theory,"田中,謙輔,1933-2000",オーム社,202109
490868605X,数式組版 = Mathematical typography,"木枝,祐介",ラムダノート,201804
4588200313,からくり 3 (ものと人間の文化史),立川昭二／著,法政大学出版局,19690601
4320114973,測度論からの数理統計学,綿森葉子／著 田中秀和／著 田中潮／著,共立出版,20230928
4802613199,統計学入門 : データ分析に必須の知識・考え方 : 仮説検定から統計モデリングまで重要トピックを完全網羅,"阿部,真人,1984-",ソシム,202112
4874249582,言語教育における多読,I.S.P.Nation／著 RobWaring／著 MitsueTabata-Sandom／監修 ほか,くろしお出版,20231025
4588200615,結び 6 (ものと人間の文化史),額田巌／著,法政大学出版局,19720301
4254111371,美しい不等式の世界 : 数学オリンピックの問題を題材として,"BulajichManfrino,Radmila／著 GómezOrtega,JoséAntonio／著 ほか",朝倉書店,2013-01
4627097212,確率的シミュレーション,"大久保,潤",森北出版,202312
4431712143,解析教程 下,"Hairer,Ernst Wanner,Gerhard 蟹江,幸博,1948-",シュプリンガー・ジャパン,200610
4431712135,解析教程 上,"Hairer,Ernst Wanner,Gerhard 蟹江,幸博,1948-",シュプリンガー・ジャパン,200610
4492312986,経済学・経営学のための数学,"岡田,章,1954-",東洋経済新報社,200110
4789837513,ディジタル回路の設計入門 : ハードウェアの動きを理解しながら学ぶ (トランジスタ技術special no.90),湯山俊夫,CQ出版,2005-4-1
4130230808,歴史学の作法,池上俊一／著,東京大学出版会,20221226
4791765370,魔術師たちのルネサンス : 錬金術からコスモロジーへ,"沢井,繁男,1954-",青土社,201003
4802612494,データ分析のための数理モデル入門 : 本質をとらえた分析のために,"江崎,貴裕",ソシム,202005
4582768717,江戸の読書会 : 会読の思想史 871 (平凡社ライブラリー),"前田,勉,1956-",平凡社,201809
4861007836,ビジュアル・コンプレキシティ : 情報パターンのマッピング,"Lima,Manuel,1978- 奥,いずみ,1973- 久保田,晃弘,1960-",ビー・エヌ・エヌ新社,201203
481440042X,ポートスキャナ自作ではじめるペネトレーションテスト : Linux環境で学ぶ攻撃者の思考,株式会社ステラセキュリティ小竹泰一／著,オライリー・ジャパン,20230920
4297136333,大規模言語モデル入門 = Introduction to Large Language Models,"山田,育矢 鈴木,正敏ソフトウェアエンジニア 山田,康輔 李,凌寒",技術評論社,202308
4274227332,人工知能が俳句を詠む : AI一茶くんの挑戦,"川村,秀憲,1973- 山下,倫央 横山,想一郎",オーム社,202107
4274229629,仕事ですぐに使える!DaVinci Resolveによる動画編集,"小寺,信良,1963-",オーム社,202211
4764906635,ベイズ最適化 = Bayesian Optimization : 適応的実験計画の基礎と実践,"今村,秀明 松井,孝太",近代科学社,202308
4274230104,Optunaによるブラックボックス最適化,"佐野,正太郎,ソフトウェアエンジニア 秋葉,拓哉 今村,秀明 太田,健 水野,尚人 ほか",オーム社,202302
4274227782,スモールデータ解析と機械学習,"藤原,幸一",オーム社,202202
4480093583,情報理論,甘利俊一／著,筑摩書房,20110401
4478117764,大学図鑑! 2024,,ダイヤモンド社,202303
4320114981,証明の読み方・考え方〔原著第6版〕 : 数学的思考過程への手引き,DanielSolow／著 西村康一／翻訳 服部久美子／翻訳,共立出版,20231125
4759823522,殺人は容易ではない : アガサ・クリスティーの法科学,"Valentine,Carla,解剖病理技師 久保,美代子,翻訳家",化学同人,202312
400006973X,データ解析のための統計モデリング入門 : 一般化線形モデル・階層ベイズモデル・MCMC (確率と情報の科学),"久保,拓弥,1969- 甘利,俊一,1936- 麻生,英樹,1958- 伊庭,幸人,1959-",岩波書店,201205
4065245532,新しい電気回路 = A New Approach to Electrical Circuits 下,"松澤,昭",講談社,202109
4065232708,新しい電気回路 = A New Approach to Electrical Circuits. 上,"松澤,昭1952-",講談社,202105
4535787654,CGは数学でできている = CG:Your view into math! : 映像数学の展望,"安生,健一",日本評論社,202308
4044007527,神秘学講義 G124-1 (角川ソフィア文庫),"高橋,巌,1928-2024",KADOKAWA,202303
4906529925,信州の秘境駅・小駅を巡る : 近代化から過疎化への100年旅,"久保田,稔,1960-",川辺書林,202203
4299042387,クセがスゴい不動産,あなたの理想不動産,宝島社,202306
4802213050,秘境駅で途方に暮れた,"カベルナリア吉田,1965-",イカロス出版,202306
4065332834,中世ヨーロッパの色彩世界 2784 (講談社学術文庫),"徳井,淑子,1949-",講談社,202309
4798027979,わかる!電子工作の基本100,"遠藤,敏夫,1949-",秀和システム,201012
4274231089,"機械学習のための確率過程入門 = An Introduction to stochastic processes for machine learning : 確率微分方程式からベイズモデル,拡散モデルまで","内山,祐介",オーム社,202309
0071752064,Practice Makes Perfect English Articles and Determiners Up Close,Mark Lester,McGraw Hill Professional,2013-08-07
4480056599,読み書きの技法 / ちくま新書,"小河原, 誠, 1947-,小河原誠 著",筑摩書房,"Tue, 30 Jul 1996 09:00:00 +0900"
4480084886,日本文学史序説　（下）,加藤周一／著,筑摩書房,19990401
4480084878,日本文学史序説　（上）,加藤周一／著,筑摩書房,19990401
4309416845,日本の偽書 ふ19-1 (河出文庫),"藤原,明,1958-",河出書房新社,201905
4798179809,なっとく!関数型プログラミング : 関数型プログラミングの基本概念の全容を把握し活用したい開発者に,"Płachta,Michał クイープ",翔泳社,202308
1837639965,Architecture and Design of Linux Storage Stack A Comprehensive Guide to the Linux Storage Landscape and Its Well-Coordinated Layers,Muhammad Umer,"Packt Publishing, Limited",2023-07-28
4102184716,ケプラー予想 : 四百年の難問が解けるまで シ-38-12 (新潮文庫),"Szpiro,George,1950- 青木,薫,1956-",新潮社,201401
4905033314,プロジェクト・シン・エヴァンゲリオン : 実績・省察・評価・総括,"カラー,カラー 編",[object Object],"Thu, 10 Aug 2023 06:20:19 +0900"
4065324017,プリキュアコスチュームクロニクル = Precure Costume Chronicle : プリキュア20周年アニバーサリー,東映アニメーション株式会社,講談社,202310
9811379661,"Kawaii Engineering Measurements, Evaluations, and Applications of Attractiveness",Michiko Ohkura,Springer Nature Singapore,2020-08-15
4309419690,日本怪談実話 た52-1 (河出文庫),"田中,貢太郎,1880-1941",河出書房新社,202306
4309419712,戦前のこわい話 : 怪奇実話集 し10-3 (河出文庫),"志村,有弘,1941-",河出書房新社,202306
4331150526,プログラム学習による基礎電気工学 交流編 / 電気基礎講座 ; 3,"松下電器工学院,松下電器工学院 編著",[object Object],"Thu, 17 Apr 1997 00:00:00 +0900"
4331150518,プログラム学習による基礎電気工学 直流編 / 電気基礎講座 1,"松下電器工学院,松下電器工学院 編著",松下電器産業,"Thu, 3 Dec 2009 09:00:00 +0900"
433115050X,基礎電子工学 : プログラム学習による 電子回路編　１ ５ (電気基礎講座),松下電器工学院 末武国弘,松下電器産業,1975
4641150044,金融のエッセンス = THE ESSENCE OF BANKING & FINANCE (有斐閣ストゥディア),"川西,諭 山崎,福寿,1954-",有斐閣,201312
4872596447,アーカイブズとアーキビスト 76 (阪大リーブル),大阪大学アーカイブズ／編 高橋明男／著 菅真城／著 三阪佳弘／著 矢切努／著 三輪宗弘／著 ほか,大阪大学出版会,20210410
4800307961,元報道記者が見た昭和事件史 : 歴史から抹殺された惨劇の記録,"石川,清,1964-",洋泉社,201511
4814400225,プログラミング文体練習 : Pythonで学ぶ40のプログラミングスタイル,"Lopes,CristinaVideira 菊池,彰",オーム社 (発売),202306
4863135629,絶対に停まらない世界の廃墟駅 (NATIONAL GEOGRAPHIC),"Ross,David(DavidSoutherland) 大島,聡子",日経BPマーケティング (発売),202305
4622095556,デジタル時代のアーカイブ系譜学,"柳,与志夫,1954- 加藤,諭,1978- 宮本,隆史,1979-",みすず書房,202212
