isbn_or_asin,book_title,author,publisher,published_date
4760154426,攻撃される知識の歴史 : なぜ図書館とアーカイブは破壊され続けるのか,"Ovenden,Richard 五十嵐,加奈子",柏書房,202205
4254163584,地図の事典,"森田,喬,1946- 日本地図学会(2013年)",朝倉書店,202111
4623093891,政策にエビデンスは必要なのか : EBPMと政治のあいだ 251 (MINERVA人文・社会科学叢書),"杉谷,和哉,1990-",ミネルヴァ書房,202203
4254122675,標準ベイズ統計学,"Hoff,PeterD 入江,薫,1987- 菅澤,翔之助,1990- 橋本,真太郎,1987-",朝倉書店,202206
4814003013,学術書を読む,鈴木哲也／著,京都大学学術出版会,20201010
4472406012,サブカルチャーを消費する,貞包英之／著,玉川大学出版部,20211201
4588011227,肥満男子の身体表象 1122 (叢書・ウニベルシタス),サンダー・Ｌ・ギルマン／著 小川公代／訳 小澤央／訳,法政大学出版局,20200928
4815809445,質的研究の考え方,大谷尚／著,名古屋大学出版会,20190403
4812221250,コロナ禍を生きる大学生 : 留学中のパンデミック経験を語り合う,"北野,真帆 内藤,直樹,1974-",昭和堂,202205
479806338X,最新アニメ業界の動向とカラクリがよ～くわかる本 : 業界人、就職、転職に役立つ情報満載 (図解入門業界研究. How-nual),"谷口,功,1954- 麻生,はじめ,1955-",秀和システム,202012
4873119790,Pythonからはじめるアルゴリズムトレード : 自動売買の基礎と機械学習の本格導入に向けたPythonプログラミング,"Hilpisch,YvesJ 村上,振一郎",オーム社 (発売),202204
4295000965,Goプログラミング実践入門 : 標準ライブラリでゼロからWebアプリを作る (impress top gear),"鄭,兆雄 武舎,広幸 阿部,和也 上西,昌弘",インプレス,201703
4765318699,診察室の陰性感情,"加藤, 温,加藤温 著",金芳堂,"Wed, 23 Jun 2021 19:16:34 +0900"
458276763X,職人歌合 763 (平凡社ライブラリー),"網野,善彦,1928-2004",平凡社,201205
4798044784,"ハロー""Hello,World""OSと標準ライブラリのシゴトとしくみ : たった7行のCプログラムから解き明かす","坂井,弘亮,1973-",秀和システム,201509
4774146129,C言語入門書の次に読む本 (プログラミングの教科書),"坂井,弘亮,1973-",技術評論社,201105
4779516269,なぜあなたは国際誌に論文を掲載できないのか : 誰も教えてくれなかった本当に必要なこと,"加藤,司,心理学",ナカニシヤ出版,202203
0472034758,Academic writing for graduate students : essential tasks and skills (Michigan series in English for academic and professional purposes),"Swales,John Feak,ChristineB.",University of Michigan Press,c2012-01
4101311013,河童が覗いたヨーロッパ (新潮文庫),"妹尾,河童,1930-",新潮社,198307
4065250390,アート展「初音ミク・クロニクル」公式ビジュアルブック,,講談社,202110
4044004951,秘境旅行 [J110-4] ([角川ソフィア文庫]),"芳賀,日出男,1921-",KADOKAWA,202001
479862750X,塗りフェチ事典 : リアルな肉感キャラを描く! 女の子編,ホビージャパン,ホビージャパン,202202
415209558X,世界を破綻させた経済学者たち : 許されざる七つの大罪,"Madrick,JeffreyG 池村,千秋,1971-",早川書房,201508
4866808136,あなたを陰謀論者にする言葉 145 (Forest 2545 Shinsyo),"雨宮,純",フォレスト出版,202110
4535787719,線型代数 = Linear Algebra,"長谷川,浩司,1963-",日本評論社,201503
4768704727,入門入門群論 : 代数的構造への第一歩,"石谷,茂,1913-",現代数学社,201706
4635047520,遊歩大全 / ヤマケイ文庫,"Fletcher, Colin, 1922-2007,芦沢, 一洋, 1938-1996,コリン・フレッチャー 著,芦沢一洋 訳",山と溪谷社,"Thu, 10 Jan 2013 23:21:11 +0900"
4535787557,数学ビギナーズマニュアル : これだけは知っておきたい,"佐藤,文広,1949-",日本評論社,201402
4563011029,ヴィジュアル複素解析,"Needham,Tristan 今吉,洋一,1947-",培風館,200201
4490210639,迷宮と迷路の文化史,"Matthews,W.H.,1882-1948 和泉,雅人,1951- 宇沢,美子,1958-",東京堂出版,202202
4327452831,文芸翻訳教室,"越前,敏弥,1961-",研究社,201804
4627054513,逆数学 : 定理から公理を「証明」する,"Stillwell,John 田中,一之,1955- 川辺,治之",森北出版,201902
4560098883,『その他の外国文学』の翻訳者,白水社,白水社,202202
4065267757,みんなのユニバーサル文章術 : 今すぐ役に立つ「最強」の日本語ライティングの世界 208 (星海社新書),"安田,峰俊",講談社,202201
4065259797,迷走しない!英語論文の書き方 : 秘密は「構造」作りにあり,"Chaubey,Varanya 成田,悠輔 布施,雄士",講談社,202201
4336073198,法の書　〔増補新訳〕　【普及版】,アレイスター・クロウリー／著 植松靖夫／翻訳,国書刊行会,20220222
4336072779,オカルトタロットの歴史 : 1870-1970年,"Decker,Ronald,1943- Dummett,Michael,1925-2011 ほか",国書刊行会,202201
4562059818,船の食事の歴史物語 : 丸木舟、ガレー船、戦艦から豪華客船まで,"Spalding,Simon 大間知,知子",原書房,202112
456205980X,鉄道の食事の歴史物語 : 蒸気機関車、オリエント急行から新幹線まで,"Quinzio,Jeri 大槻,敦子",原書房,202112
4562059826,空と宇宙の食事の歴史物語 : 気球、旅客機からスペースシャトルまで,"Foss,Richard 浜本,隆三,1979- 藤原,崇,1980-",原書房,202202
4334044654,搾取される研究者たち : 産学共同研究の失敗学 1055 (光文社新書),"山田,剛志,1965-",光文社,202003
4802207174,赤羽駅周辺の失われし鉄路を求めて : 特集,,イカロス出版,"Sun, 22 Dec 2024 00:00:10 +0900"
4802207921,消散軌道風景 : あなたの知らない鉄道考古学 Vol.2(2020) / イカロスMOOK,岡本憲之 総合プロデューサー,イカロス出版,"Mon, 2 Mar 2020 23:25:04 +0900"
4802208731,消散軌道風景 : あなたの知らない鉄道考古学 Vol.3(2020) / イカロスMOOK,岡本憲之 総合プロデューサー,イカロス出版,"Fri, 21 Aug 2020 23:21:44 +0900"
4802210280,廃線系鉄道考古学 : あなたの知らない消散軌道風景 2021Vol.2 / イカロスMOOK,岡本憲之 総合プロデューサー,イカロス出版,"Fri, 13 Aug 2021 19:14:41 +0900"
4062177358,究極のナローゲージ鉄道 : せまい鉄路の記録集,"岡本,憲之,1968-",講談社,201205
486320146X,実録鉄道連隊 : 知られざるその使命を解き明かす : 創設から終焉、路線から車両まで… / イカロスmook,,イカロス出版,"Thu, 16 Nov 2023 20:26:30 +0900"
4533039812,"全国鉱山鉄道 : 鉄道の原点""ヤマ""軌道をもとめて (JTBキャンブックス)","岡本,憲之,1968-",JTB,200110
4802209525,廃線系鉄道考古学 : あなたの知らない消散軌道風景 Vol.1(2021) / イカロスMOOK,岡本憲之 総合プロデューサー,イカロス出版,"Fri, 16 Apr 2021 00:20:06 +0900"
4802211015,廃線系鉄道考古学 : あなたの知らない消散軌道風景 2022Vol.3 (イカロスMOOK),,イカロス出版,202202
0764574817,Reversing: Secrets of Reverse Engineering,Eldad Eilam,Wiley,2005-04-15
4004314844,エピジェネティクス : 新しい生命像をえがく 1484 (岩波新書 新赤版),"仲野,徹,1957-",岩波書店,201405
4044005664,身体の大衆文化 : 描く・着る・歌う,"安井,眞奈美,1967- HernándezHernández,ÁlvaroDavid,1983-",KADOKAWA,202111
4065250455,なぜオナニーはうしろめたいのか 199 (星海社新書),"赤川,学,1967- 小堀,善友,1975- シオリーヌ,1991- 典雅",講談社 (発売),202110
4863542755,組込みエンジニアの教科書 = The textbook of the Embedded engineer,"渡辺,登,pub.2019 牧野,進二",シーアンドアール研究所,201904
4106035952,拷問と処刑の西洋史 (新潮選書),"浜本,隆志,1944-",新潮社,200712
4798164739,ゲームメカニクス大全 : ボードゲームに学ぶ「おもしろさ」の仕掛け,"Engelstein,Geoffrey Shalev,Isaac 小野,卓也",翔泳社,202010
4866365366,ライトノベルの新・潮流 = LIGHT NOVEL NEW TIDE CURRENT : 黎明期→2021,"石井,ぜんじ 太田,祥暉,1996- 松浦,恵介,1980-",スタンダーズ,202201
4863543638,OSSライセンスを正しく理解するための本 = Understand the Open Source Software License Correctly,"姉崎,章博",シーアンドアール研究所,202111
4839977607,AWSではじめるクラウド開発入門 : コードを書いて学ぶエンジニア・科学者のためのハンズオン教材 (Compass Data Science),"真野,智之",マイナビ出版,202109
4480097635,数学基礎論 (ちくま学芸文庫),前原昭二／著 竹内外史／著,筑摩書房,20170110
4873117127,コンピュータシステムの理論と実装 : モダンなコンピュータの作り方,"Nisan,Noam Schocken,Shimon 斎藤,康毅,1984-",オーム社,201503
4839909865,CPUの創りかた : IC10個のお手軽CPU設計超入門 : 初歩のデジタル回路動作の基本原理と製作,"渡波,郁",毎日コミュニケーションズ,200309
4864718652,スーパーナチュラル・ウォー : 第一次世界大戦と驚異のオカルト・魔術・民間信仰,"Davies,Owen,1969- 江口,之隆,1958-",ヒカルランド,202004
4404035861,危ない食卓 : 十九世紀イギリス文学にみる食と毒,"横山,茂雄,1954-",新人物往来社,200812
4297125161,"暗号から学ぶ代数学 (数学のみかた,考え方)","川添,充,1968- 上野,健爾,1945-",技術評論社,202112
4010377275,総合的研究問題文の読み取り方-数学1・A・2・B : 大学受験,,旺文社,202108
4150315000,異常論文 1500 (ハヤカワ文庫 JA),"樋口,恭介,1989-",早川書房,202110
4627851618,計算論的神経科学 : 脳の運動制御・感覚処理機構の理論的理解へ,"田中,宏和,pub.2019",森北出版,201906
432625131X,計算論的精神医学 : 情報処理過程から読み解く精神障害,"国里,愛彦,1983- 片平,健太郎,1979- 沖村,宰,1972-",勁草書房,201901
4322139884,飲みの技法,"Opsopäus,Vincentius 原澤,隆三郎,1951-",きんざい,202110
4335358334,AI時代の法学入門 = Introduction to law in the age of artificial intelligence : 学際的アプローチ,"太田,勝造,1957- 笠原,毅彦,1957- 佐藤,健 西貝,吉晃,1981- 新田,克己 ほか",弘文堂,202007
4422390058,フィールド言語学者、巣ごもる。,"吉岡,乾",創元社,202106
4909466010,エヴァンゲリオンイラスト集 : 2007-2017,"「エヴァンゲリオンイラスト集2007-2017」編集部 編,カラー 監修",グラウンドワークス,"Wed, 25 Sep 2019 22:28:05 +0900"
4320009304,神経美学 = Neuroaesthetics : 美と芸術の脳科学 30 (共立スマートセレクション),"石津,智大",共立出版,201908
4044006261,もっとヘンな論文 さ70-3 (角川文庫),サンキュータツオ,KADOKAWA,202007
4044003343,ヘンな論文 さ70-2 (角川文庫),サンキュータツオ,KADOKAWA,201711
4061975978,新約聖書外典 (講談社文芸文庫),"荒井,献,1930-2024",講談社,199712
4046043938,"奇書の世界史 : 歴史を動かす""ヤバい書物""の物語","三崎,律日,1990-",KADOKAWA,201908
4426624096,世界の奇書 : 総解説,,自由国民社,199804
4480510443,キリスト教の幼年期 ト－１９－１ (ちくま学芸文庫),エチエンヌ・トロクメ／著 加藤隆／翻訳,筑摩書房,20210812
4121101200,日本の私立大学はなぜ生き残るのか : 人口減少社会と同族経営:1992-2030 120 (中公選書),"Breaden,Jeremy,1973- Goodman,Roger,1960- 石澤,麻子,1989-",中央公論新社,202109
4320096398,経済物理学,"青山,秀明,1954- 家富,洋 池田,裕一",共立出版,200810
4151845518,ブート・バザールの少年探偵 HM 487-1 (ハヤカワ・ミステリ文庫),"Anappara,Deepa 坂本,あおい",早川書房,202104
4094070400,安楽死を遂げた日本人 み20-2 (小学館文庫),"宮下,洋一,1976-",小学館,202107
4151201009,地下鉄道 100 (ハヤカワepi文庫),"Whitehead,Colson,1969- 谷崎,由依",早川書房,202010
4062920484,図説金枝篇. 下 2048 (講談社学術文庫),"Frazer,JamesGeorge,1854-1941 MacCormack,Sabine ほか",講談社,201105
4062920476,図説金枝篇. 上 2047 (講談社学術文庫),"Frazer,JamesGeorge,1854-1941 MacCormack,Sabine ほか",講談社,201104
4314010827,誤差論,"Gauss,CarlFriedrich 飛田,武幸 石川,耕春",紀伊國屋書店,198105
4909783806,親の手で病気にされる子どもたち,南部さおり／著,学芸みらい社,20210618
4863134940,世界の幽霊出現録,"Innes,Brian,1928-2014 大島,聡子",日経BPマーケティング (発売),202108
4750351334,大図鑑　コードの秘密,ポール・ルンダ／編 浜口稔／訳,明石書店,20210318
4839973490,詳解セキュリティコンテスト : CTFで学ぶ脆弱性攻略の技術 (Compass Security),"梅内,翼 清水,祐太郎 藤原,裕大 前田,優人 米内,貴志 渡部,裕",マイナビ出版,202107
4000614835,アカデミアを離れてみたら : 博士、道なき道をゆく,岩波書店,岩波書店,202108
4492314970,行動経済学入門,"筒井,義郎,1950- 佐々木,俊一郎,1973- 山根,承子,1984-",東洋経済新報社,201705
4787234781,アニメと声優のメディア史,石田美紀／著,青弓社,20201221
4065135060,プリキュアコスチュームクロニクル = Precure Costume Chronicle : プリキュア15周年アニバーサリー,東映アニメーション株式会社,講談社,201810
4838233825,桃太郎の発生 : 世界との比較からみる日本の昔話、説話,"花部,英雄,1950-",三弥井書店,202103
4791773829,悪魔学大全,"Robbins,RossellHope,1912-1990 松田,和也,1963-",青土社,202105
4991119006,数理物理研究 1,"田中, 俊行,小西, 巌,相原, 典明,横山, 賢, 1952-,片桐, 奏羽, 1977-,近藤, 弘, pub. 2020,田中俊行, 小西巌, 相原典明, 横山賢, 片桐奏羽, 近藤弘 著",数理物理出版会,"Tue, 23 May 2023 21:59:32 +0900"
4003367618,比較言語学入門 (岩波文庫),"高津,春繁,1908-1973",岩波書店,199205
4296000195,プログラムはなぜ動くのか : 知っておきたいプログラミングの基礎知識,"矢沢,久雄,1961-",日経BPマーケティング (発売),202105
4000056530,多変量解析入門 : 線形から非線形へ,"小西,貞則,1948-",岩波書店,201001
4839965412,将棋AIで学ぶディープラーニング : 人より強い将棋プログラムを作る!,"山岡,忠夫",マイナビ出版,201803
4777519651,Java将棋のアルゴリズム : アルゴリズムの強化手法を探る / I/O BOOKS,"池, 泰弘, 1971-,工学社,池泰弘 著,I O編集部 編集",工学社,"Mon, 12 Sep 2016 20:34:45 +0900"
4336070903,「探偵小説(ディテクティヴ・ノヴェル)」の考古学 : セレンディップの三人の王子たちからシャーロック・ホームズまで,"Messac,Régis,1893-1945 石橋,正孝 池田,潤,1984- 佐々木,匠,1983- ほか",国書刊行会,202106
4798106577,教科書には載らないニッポンのインターネットの歴史教科書 (NT2X),ばるぼら,翔泳社,200505
430946730X,ヒーラ細胞の数奇な運命 : 医学の革命と忘れ去られた黒人女性 ス4-1 (河出文庫),"Skloot,Rebecca,1972- 中里,京子,1955-",河出書房新社,202103
4767827779,すごいエスカレーター = SUPER ESCALATORS,"田村,美葉,1984-",エクスナレッジ,202009
4065225450,異端審問 2648 (講談社学術文庫),"渡辺,昌美,1930-2016",講談社,202102
4621061860,"暗号理論入門 : 暗号アルゴリズム, 署名と認証, その数学的基礎","Buchmann,Johannes 林,芳樹",丸善出版,201201
4905924405,19人の阿部定,"桑原, 稲敏, 1939-1993,桑原稲敏 著",現代書林,"Tue, 26 Jan 1982 09:00:00 +0900"
4480864369,テキヤと社会主義 (単行本),猪野健治／著,筑摩書房,20150225
4757735804,アウトサイダー (ビームコミックス),"田邊,剛,1975-",エンターブレイン,200707
4297112744,スペースキーで見た目を整えるのはやめなさい : 8割の社会人が見落とす資料作成のキホン,,技術評論社,202006
4839971056,マンガで学ぶ恐竜の生態 (サイエンスコミックシリーズ),"金,渡潤 渡辺,麻土香",マイナビ出版,202005
4797386673,この一冊で全部わかるネットワークの基本 (Informatics & IDEA. イラスト図解式 : わかりやすさにこだわった),"福永,勇二,1966-",SBクリエイティブ,201604
4480435921,「読まなくてもいい本」の読書案内 た－９２－１ (ちくま文庫),橘玲／著,筑摩書房,20190509
4040647343,VISIONS : ILLUSTRATORS BOOK. 2021,ピクシブ株式会社,KADOKAWA,202011
4569841090,マルチ・ポテンシャライト : 好きなことを次々と仕事にして、一生食っていく方法,"Wapnick,Emilie 長澤,あかね",PHP研究所,201809
4044006202,自閉症は津軽弁を話さない : 自閉スペクトラム症のことばの謎を読み解く L129-1 (角川ソフィア文庫),"松本,敏治,1957-",KADOKAWA,202009
4150505691,津波の霊たち : 3・11死と生の物語 569 (ハヤカワ文庫 NF),"LloydParry,Richard,1969- 濱野,大道",早川書房,202101
4122052424,ピアニストという蛮族がいる な27-4 (中公文庫),"中村,紘子,1944-2016",中央公論新社,200912
4778315928,エロマンガ表現史 = The Expression History of Ero-Manga,"稀見,理都",太田出版,201711
4635048861,マタギ奇談 (ヤマケイ文庫),"工藤,隆雄,1953-",山と溪谷社,202007
4816919813,入門・アーカイブズの世界 : 記憶と記録を未来に : 翻訳論文集,記録管理学会 日本アーカイブズ学会,日外アソシエーツ,200606
4339009393,ひたすら楽して音響信号解析 = Beginning Acoustic Signal Analysis : MATLABで学ぶ基礎理論と実装,"森勢,将雅",コロナ社,202102
4480087044,快読１００万語！ペーパーバックへの道,酒井邦秀／著,筑摩書房,20020601
4315523275,"マス・アート : 真理,美,そして方程式","Ornes,Stephen 巴山,竜来,1982- 赤池,ともえ",ニュートンプレス,202102
4863134975,西洋アンティーク・ボードゲーム : 19世紀に愛された遊びの世界 (NATIONAL GEOGRAPHIC),"Seville,Adrian 鍋倉,僚介",日経BPマーケティング (発売),202101
4865592334,踊るバロック (叢書ビブリオムジカ),赤塚健太郎／著,アルテスパブリッシング,20210225
4404042167,最新日本古代史の論争51,新人物往来社,新人物往来社,201206
4562059079,図説世界地下名所百科 : イスタンブールの沈没宮殿、メキシコの麻薬密輸トンネルから首都圏外郭放水路まで,"Fitch,Chris,1988- 上京,恵",原書房,202102
4876987971,データ同化,,京都大学学術出版会,20090820
430941172X,中世幻想世界への招待 い27-1 (河出文庫),"池上,俊一,1956-",河出書房新社,201209
4873119332,計算できるもの、計算できないもの : 実践的アプローチによる計算理論入門,"MacCormick,John,1972- 松崎,公紀 長尾,高弘,1960-",オーム社 (発売),202012
4802612168,Pythonでいかにして暗号を破るか : 古典暗号解読プログラムを自作する本,"Sweigart,Al IPUSIRON,1979-",ソシム,202101
4873119294,初めてのマルウェア解析 : Windowsマルウェアを解析するための概念、ツール、テクニックを探る,"K.A.,Monnappa 石川,朝久 北原,憲 中津留,勇",オーム社 (発売),202012
4000201018,漢文入門 ２３３ (岩波全書),小川‖環樹,岩波書店,0000-01-01
4862852319,地獄と煉獄のはざまで : 中世イタリアの例話から心性を読む,"石坂,尚武,1947-",知泉書館,201603
400311521X,量子力学と私 (岩波文庫),"朝永,振一郎,1906-1979 江沢,洋,1932-",岩波書店,199701
4121025237,古代オリエントの神々 : 文明の興亡と宗教の起源 2523 (中公新書),"小林,登志子,1949-",中央公論新社,201901
4535606137,数学の言葉づかい100 : 数学地方のおもしろ方言,数学セミナー編集部,日本評論社,199904
4276123739,新版 音楽の科学,ホアンＧローダラー／著 髙野光司／翻訳 安藤四一／翻訳,音楽之友社,20141008
4276123119,新版　楽器の音響学,安藤由典／著,音楽之友社,19960201
4873119200,生成Deep Learning : 絵を描き、物語や音楽を作り、ゲームをプレイする,"Foster,David 松田,晃一,1960- 小沼,千絵",オーム社,202010
4422203436,フィッシュ・アンド・チップスの歴史 : 英国の食と移民 (創元世界史ライブラリー),"Panayi,Panikos 栢木,清吾",創元社,202009
4844379038,入門GUI : Webブラウザで作る本格インタラクション / Next Publishing. 技術の泉SERIES,"hashrock,daiiz,miyaoka,f_subal,hashrock, daiiz, miyaoka, f_subal 著",[object Object],"Wed, 25 Jan 2023 06:16:45 +0900"
4299004507,塀の中の元極道YouTuberが明かすヤクザの裏知識,"懲役,太郎",宝島社,202006
4309228038,まじないの文化史 : 見るだけで楽しめる! : 日本の呪術を読み解く (視点で変わるオモシロさ!),新潟県立歴史博物館,河出書房新社,202005
4297116014,揚げて炙ってわかるコンピュータのしくみ = Fry and Roast to understand how computer works,"秋田,純一,1970-",技術評論社,202009
4309463037,人間はどこまで耐えられるのか (河出文庫),"Ashcroft,FrancesM,1952- 矢羽野,薫,1969-",河出書房新社,200805
4254102739,人間の許容限界事典,"山崎,昌廣,1953- 坂本,和義 関,邦博,1944-",朝倉書店,201507
483188779X,なぜ人はカルトに惹かれるのか : 脱会支援の現場から,"瓜生,崇,1974-",法藏館,202005
4385107564,世界音声記号辞典,"Pullum,GeoffreyK,1945- Ladusaw,WilliamA,1952- ほか",三省堂,200305
4760151931,世界でいちばん虚無な場所 : 旅行に幻滅した人のためのガイドブック,"Rudd,Damien,1984- 菅野,楽章,1988-",柏書房,202004
4488564100,日本怪奇実話集 : 亡者会 Fん3-7. 東西怪奇実話 (創元推理文庫),"東,雅夫,1958-",東京創元社,202009
4062922819,最暗黒の東京 2281 (講談社学術文庫),"松原,岩五郎,1866-1935",講談社,201502
448009993X,叙任権闘争 フ－４３－１ (ちくま学芸文庫),オーギュスタン・フリシュ／著 野口洋二／翻訳,筑摩書房,20200713
4140840412,将棋界奇々快々 / NHKライブラリー ; 41,"河口, 俊彦, 1936-2015,河口俊彦 著",日本放送出版協会,"Tue, 3 Feb 2015 07:04:14 +0900"
4389201395,ひとりで学べる地学 (COLOR LECTURE),,清水書院,201909
4839970491,マンガで学ぶ昆虫の進化 (サイエンスコミックシリーズ),"金,渡潤 山口,裕美子,pub.2020",マイナビ出版,202005
4480098844,中世の覚醒 (ちくま学芸文庫),リチャード・Ｅ．ルーベンスタイン／著 小沢千重子／翻訳,筑摩書房,20181010
4588140051,中世の食生活　〈新装版〉 断食と宴 378 (叢書・ウニベルシタス),B.A.ヘニッシュ／著 藤原保明／訳,法政大学出版局,20150223
4635320146,マタギ奇談,"工藤,隆雄,1953-",山と溪谷社,201610
4152091665,予想どおりに不合理 : 行動経済学が明かす「あなたがそれを選ぶわけ」,"Ariely,Dan,1967- 熊谷,淳子",早川書房,201010
4150503915,予想どおりに不合理 : 行動経済学が明かす「あなたがそれを選ぶわけ」 391 (ハヤカワ文庫 NF),"Ariely,Dan,1967- 熊谷,淳子",早川書房,201308
4582761089,日本残酷物語 4 (保障なき社会) (平凡社ライブラリー),,平凡社,199507
4582761046,日本残酷物語 3 (鎖国の悲劇) (平凡社ライブラリー),,平凡社,199506
4582761127,日本残酷物語 5 (近代の暗黒) (平凡社ライブラリー),,平凡社,199508
4582760996,日本残酷物語 2 (忘れられた土地) (平凡社ライブラリー),,平凡社,199505
4582760953,日本残酷物語 1 (貧しき人々のむれ) (平凡社ライブラリー),,平凡社,199504
448006513X,完全教祖マニュアル,架神恭介／著 辰巳一世／著,筑摩書房,20091101
4621063014,暗号の代数理論,"Koblitz, Neal,林, 彬,シュプリンガージャパン,N. コブリッツ著 ; 林彬訳 ; シュプリンガー・ジャパン編集",丸善出版,"Sun, 22 Dec 2024 00:00:10 +0900"
4781617417,ダークウェブ・アンダーグラウンド : 社会秩序を逸脱するネット暗部の住人たち,"木澤,佐登志,1988-",イースト・プレス,201901
476490408X,"アルゴリズムイントロダクション : 世界標準MIT教科書. 総合版 (第1巻+第2巻+精選トピックス〈第1～35章,付録〉)","Cormen,ThomasH Leiserson,CharlesEric Rivest,RonaldL ほか",近代科学社,201312
4309224881,憑き物耳袋,"倉光,清六,1894-1963",河出書房新社,200808
4000111442,時空の力学 : 一般相対論の物理 4 (岩波講座物理の世界 素粒子と時空),"細谷,暁夫,1946- 佐藤,文隆,1938-",岩波書店,200204
4774197076,超有名進学校生の数学的発想力 : 日本最高峰の頭脳に迫る / 数学への招待,"吉田, 信夫, 1977-,アップ,吉田信夫 著,アップ 編集",技術評論社,"Sat, 16 Jun 2018 01:18:59 +0900"
4041080606,怪と幽 = KWAI & yoo. vol.003 805 (カドカワムック),,KADOKAWA,201912
4041080592,怪と幽 = KWAI & yoo. vol.002 795 (カドカワムック),,KADOKAWA,201908
4041080584,怪と幽 = KWAI & yoo. vol.001 781 (カドカワムック),,KADOKAWA,201904
4041091152,怪と幽 = KWAI & yoo. vol.004 828 (カドカワムック),,KADOKAWA,202004
