isbn_or_asin,book_title,author,publisher,published_date
4326000481,デジタルアーカイブの理論と政策 : デジタル文化資源の活用に向けて,"柳,与志夫,1954-",勁草書房,202001
4883673790,デジタルアーカイブの理論と実践 : デジタルアーキビスト入門,"日本デジタルアーキビスト資格認定機構 井上,透,1952- 大井,将生 細川,季穂",樹村房,202304
4130502077,メディア考古学とは何か？,ユッシパリッカ／著 梅田拓也／翻訳 大久保遼／翻訳 近藤和都／翻訳 光岡寿郎／翻訳,東京大学出版会,20230725
4761101857,仙人ワンダーランド : 和漢仙人列伝,"影山,純夫,1947-",河原書店,202305
4758925992,イギリス哲学者の英語 : 通時的研究 99 (開拓社言語・文化選書),"秋元,実治,1941-",開拓社,202305
4422701274,コンスピリチュアリティ入門 : スピリチュアルな人は陰謀論を信じやすいか 03 (叢書パルマコン・ミクロス),"横山,茂雄,1954- 竹下,節子,1951- 清,義明,1967- 堀江,宗正,1969- ほか",創元社,202303
4797681217,亜宗教 : オカルト、スピリチュアル、疑似科学から陰謀論まで 121 (インターナショナル新書),"中村,圭志,1958-",集英社 (発売),202304
4339027979,CGによるシミュレーションと可視化 = Simulation and Visualization with Computer Graphics 11 (メディア学大系),"菊池,司 竹島,由里子",コロナ社,202304
4339029092,キャラクタアニメーションの数理とシステム = Mathematical Models and Systems for Character Animation : 3次元ゲームにおける身体運動生成と人工知能,"向井,智彦 川地,克明 三宅,陽一郎,1975-",コロナ社,202008
4339013714,3DCGの数理と応用 = Mathematics and Applications of 3DCG 1 (メディアテクノロジーシリーズ),"三谷,純,1975- 高山,健志 土橋,宜典,1969- 向井,智彦 藤澤,誠",コロナ社,202307
4087212610,「イクメン」を疑え! 1161 (集英社新書),"関口,洋平,1980-",集英社,202304
4812222133,経済学史入門 : 経済学方法論からのアプローチ,"久保,真 中澤,信彦,1968-",昭和堂,202304
406530993X,物理のためのデータサイエンス入門 = Introduction to Data Science for Physics,"植村,誠,1977-",講談社,202303
4489022212,研究計画書デザイン : 大学院入試から修士論文完成まで,"細川,英雄,1949-",東京図書,201510
4788518007,６歳と３歳のおまけシール騒動,麻生武／著,新曜社,20230313
4326250720,伝えるための心理統計 : 効果量・信頼区間・検定力,"大久保,街亜 岡田,謙介,1981-",勁草書房,201201
4390114956,フランス怪奇民話集 / 現代教養文庫 ; 1495,"植田, 祐次, 1936-,山内, 淳, 1951-,植田祐次, 山内淳 訳編",社会思想社,"Wed, 30 Mar 1994 09:00:00 +0900"
476642803X,地下出版のメディア史,大尾侑子／著,慶應義塾大学出版会,20220325
4003101308,"飯待つ間 : 正岡子規随筆選 (岩波文庫, 緑(31)-013-0)","正岡,子規 阿部,昭",岩波書店,198503
4794226144,映画を追え : フィルムコレクター歴訪の旅,"山根,貞男,1939-2023",草思社,202302
4588151320,人文学・社会科学の社会的インパクト,加藤泰史／編 松塚ゆかり／編,法政大学出版局,20230327
4040667956,東京大学の学術遺産捃拾帖 103 (メディアファクトリー新書),"モリナガ,ヨウ,1966-",KADOKAWA,201406
4837967701,あなたの知らない「ヘン」な法律 A86-1 (王様文庫),"なかむら,いちろう",三笠書房,201512
4295003255,新人エンジニアのためのインフラ入門 / Think IT BOOKS,"BFT,BFT 著",インプレス,"Mon, 9 Apr 2018 23:56:19 +0900"
400500850X,聖徳太子 : ほんとうの姿を求めて 850 (岩波ジュニア新書),"東野,治之,1946-",岩波書店,201704
4834013871,昔話の語法,"小沢,俊夫,1930-",福音館書店,199910
4908468605,エセ著作権事件簿 Vol.1 (過剰権利主張ケーススタディーズ),友利昴／著,パブリブ,20220711
4061592432,ケルト妖精学 (講談社学術文庫),"井村,君江,1932-",講談社,199608
4480087966,ケルト妖精学 / ちくま学芸文庫,"井村, 君江, 1932-,井村君江 著",筑摩書房,"Tue, 20 Jan 2004 01:54:48 +0900"
4862464831,ゲームエンジンアーキテクチャ,"Gregory,Jason 今給黎,隆,1972- 湊,和久 大貫,宏美 田中,幸,翻訳家",ボーンデジタル,202012
4865280685,わたしが先生の「ロリータ」だったころ,アリソン・ウッド／著者 服部理佳／訳者,左右社,20220307
1680502549,Domain Modeling Made Functional Tackle Software Complexity with Domain-Driven Design and F#,Scott Wlaschin,Pragmatic Bookshelf,2018-02-04
4764905132,IT技術者の長寿と健康のために,"情報通信医学研究所 長野,宏宣,1945- 中川,晋一,1961- 蒲池,孝一,1947-",近代科学社,201606
0312383215,What People Wore When A Complete Illustrated History of Costume from Ancient Times to the Nineteenth Century for Every Level of Society,Melissa Leventon,Macmillan,2008-07-08
4798061700,実践Rustプログラミング入門 = introduction to rust programming,"初田,直也 山口,聖弘 吉川,哲史 豊田,優貴 松本,健太郎,webエンジニア 原,将己 ほか",秀和システム,202009
4535787603,学んでみよう!記号論理,"高崎,金久,1956-",日本評論社,201408
4562072547,世界を騙した女詐欺師たち,"Telfer,Tori 富原,まさ江,1965-",原書房,202302
4344953304,幼なじみ萌え : ラブコメ恋愛文化史,"玉井,建也",幻冬舎,201711
3031004418,General Game Playing,"Michael Genesereth,Michael Thielscher",Springer International Publishing,2014-03-18
4798125393,実践プログラミングDSL : ドメイン特化言語の設計と実装のノウハウ (Programmer's SELECTION),"Ghosh,Debasish,1953- 佐藤,竜一,1972-",翔泳社,201206
4839967091,囲碁ディープラーニングプログラミング,"Pumperla,Max Ferguson,Kevin 山岡,忠夫",マイナビ出版,201904
4788508427,神、人を喰う : 人身御供の民俗学,"六車,由実,1970-",新曜社,200303
4641163642,比較制度分析・入門 (単行本),中林真幸／編集 石黒真吾／編集,有斐閣,20101223
4896944712,図説数の文化史 : 世界の数字と計算法,"Menninger,Karl,1898-1963 内林,政夫,1930-",八坂書房,200104
4309460631,ホームズ贋作展覧会 / 河出文庫,"各務, 三郎, 1936-,各務三郎 編",河出書房新社,"Thu, 5 Oct 1989 09:00:00 +0900"
4641165483,実証のための計量時系列分析 (単行本),ウォルター・エンダース（Walter／著 新谷元嗣／翻訳 藪友良／翻訳,有斐閣,20191212
0321842685,Hacker's Delight,Henry S. Warren,Pearson Education,2013
4434046683,ハッカーのたのしみ : 本物のプログラマはいかにして問題を解くか,"Warren,HenryS 滝沢,徹",星雲社,200409
4774153265,人間に勝つコンピュータ将棋の作り方,コンピュータ将棋協会,技術評論社,201211
4814400160,自分だけのボードゲームを作ろう : ゲームをデザインして、作って、みんなでプレイする (Make : Japan Books),"Daniels,JesseTerrance 金井,哲夫,1958-",オーム社 (発売),202212
4002710521,「私物化」される国公立大学 No.1052 (岩波ブックレット),"駒込,武,1962-",岩波書店,202109
4774407763,調べる技術,小林昌樹／著,皓星社,20221209
4480438319,神田神保町書肆街考 か－２７－２ (ちくま文庫),鹿島茂／著,筑摩書房,20221013
4274229181,Pythonで始める機器分析データの解析とケモメトリックス = Chemometrics Starting with Python,"森田,成昭",オーム社,202209
4910612041,大学院・大学編入のための応用数学 : 基本事項の整理と問題演習および入試問題研究,"桜井,基晴",プレアデス出版,202209
453554042X,経済論文の書き方 = The Craft of Economic Research Writing,日本評論社,日本評論社,202209
4627083114,数理人口学入門 = Introduction to Mathematical Demography,"稲葉,寿,1957-",森北出版,202209
4121027221,陰謀論 : 民主主義を揺るがすメカニズム 2722 (中公新書),"秦,正樹,1988-",中央公論新社,202210
4320115317,数学ソフトウェアの作り方 = Developing Mathematical Software (コンピュータと数学の織りなす革新),"高山,信毅,1959- 野呂,正行,1960- 小原,功任,1970- 藤本,光史,1968- ほか",共立出版,202210
4000256696,歴史を学ぶ人々のために : 現在をどう生きるか,東京歴史科学研究会,岩波書店,201703
4787210130,ボンデージ進化論,北原童夢／著,青弓社,19920401
4826902433,情報セキュリティの敗北史 : 脆弱性はどこから来たのか,"Stewart,Andrew,1975- 小林,啓倫",白揚社,202210
4873118654,Raspberry Piで学ぶコンピュータアーキテクチャ (Make : PROJECTS),"Upton,Eben Duntemann,Jeff Roberts,Ralph,1945- ほか",オーム社,201909
4623094332,はじめて学ぶ西洋古代史,"長谷川,岳男,1959-",ミネルヴァ書房,202210
4297102838,逆引きPIC電子工作やりたいこと事典,"後閑, 哲也, 1947-,後閑哲也 著",技術評論社,"Thu, 13 Jun 2019 19:43:25 +0900"
4816357688,オールカラー普通免許〈ひっかけ対策〉問題集 : そのまま本試験,,ナツメ社,201502
4003751337,サラゴサ手稿. 上 37-519-1 (岩波文庫),"Potocki,Jan,1761-1815 畑,浩一郎",岩波書店,202209
429713148X,試して理解Linuxのしくみ : 実験と図解で学ぶOS、仮想マシン、コンテナの基礎知識,"武内,覚",技術評論社,202210
4796702792,ファッションの文化社会学,"Finkelstein,Joanne 成実,弘至,1964-",せりか書房,200709
4588276476,鉄道旅行の歴史　〈新装版〉,W.シヴェルブシュ／著 加藤二郎／訳,法政大学出版局,20111209
4758017832,中谷友紀子東映アニメーションプリキュアワークス = Nakatani Yukiko TOEI ANIMATION PRECURE WORKS 2,"中谷,友紀子,1986-",講談社 (発売),202210
4297130343,リアルタイムグラフィックスの数学 = Mathematics of Real-Time Graphics : GLSLではじめるシェーダプログラミング,"巴山,竜来,1982-",技術評論社,202209
4320122992,量子情報科学入門 = Introduction to Quantum Information Science,"石坂,智 小川,朋宏 河内,亮周",共立出版,201206
4297129140,作って学ぶコンピュータアーキテクチャ : LLVMとRISC-5による低レイヤプログラミングの基礎,"木村,優之",技術評論社,202207
4484121034,性欲の科学 : なぜ男は「素人」に興奮し、女は「男同士」に萌えるのか,"Ogas,Ogi Gaddam,Sai 坂東,智子,1955-",阪急コミュニケーションズ,201202
4121506197,サラブレッドに「心」はあるか 619 (中公新書ラクレ),"楠瀬,良,1951-",中央公論新社,201804
4297128462,達人が教えるWebパフォーマンスチューニング : ISUCONから学ぶ高速化の実践,"藤原,俊一郎 馬場,俊彰 中西,建登 長野,雅広 金子,達哉,1991- 草野,翔",技術評論社,202206
490381419X,これならわかる工学部で学ぶ数学,"千葉,逸人,1982-",プレアデス出版,200902
4478013322,完全独習ベイズ統計学入門,"小島,寛之,1958-",ダイヤモンド社,201511
4759821678,理工系のAI英作文術 : 誰でも簡単に正確な英文が書ける,"西山,聖久",化学同人,202205
439329162X,魔法少女はなぜ変身するのか : ポップカルチャーのなかの宗教,"石井,研士,1954-",春秋社,202206
4750352861,現代日本のエリートの平等観,竹中佳彦／編 山本英弘／編 濱本真輔／編,明石書店,20211227
4758017115,高橋晃東映アニメーションプリキュアワークス = : TAKAHASHI AKIRA TOEI ANIMATION PRECURE WORKS,"高橋,晃,1971-",講談社 (発売),202102
4562071818,緯度を測った男たち : 18世紀、世界初の国際科学遠征隊の記録,"Crane,Nicholas,1954- 上京,恵",原書房,202205
4562071826,古代ワインの謎を追う : ワインの起源と幻の味をめぐるサイエンス・ツアー,"Begos,Kevin(KevinPaul) 矢沢,聖子,1951-",原書房,202206
4335358857,情報刑法 1,"鎮目,征樹,1973- 西貝,吉晃,1981- 北條,孝佳 荒木,泰貴 遠藤,聡太 ほか",弘文堂,202206
4806714453,〈図説〉日本の結び,"藤原,覚一,1895-1990",築地書館,201210
4760154426,攻撃される知識の歴史 : なぜ図書館とアーカイブは破壊され続けるのか,"Ovenden,Richard 五十嵐,加奈子",柏書房,202205
4254163584,地図の事典,"森田,喬,1946- 日本地図学会(2013年)",朝倉書店,202111
4623093891,政策にエビデンスは必要なのか : EBPMと政治のあいだ 251 (MINERVA人文・社会科学叢書),"杉谷,和哉,1990-",ミネルヴァ書房,202203
4254122675,標準ベイズ統計学,"Hoff,PeterD 入江,薫,1987- 菅澤,翔之助,1990- 橋本,真太郎,1987-",朝倉書店,202206
4814003013,学術書を読む,鈴木哲也／著,京都大学学術出版会,20201010
4472406012,サブカルチャーを消費する,貞包英之／著,玉川大学出版部,20211201
4588011227,肥満男子の身体表象 1122 (叢書・ウニベルシタス),サンダー・Ｌ・ギルマン／著 小川公代／訳 小澤央／訳,法政大学出版局,20200928
4815809445,質的研究の考え方,大谷尚／著,名古屋大学出版会,20190403
4812221250,コロナ禍を生きる大学生 : 留学中のパンデミック経験を語り合う,"北野,真帆 内藤,直樹,1974-",昭和堂,202205
479806338X,最新アニメ業界の動向とカラクリがよ～くわかる本 : 業界人、就職、転職に役立つ情報満載 (図解入門業界研究. How-nual),"谷口,功,1954- 麻生,はじめ,1955-",秀和システム,202012
4873119790,Pythonからはじめるアルゴリズムトレード : 自動売買の基礎と機械学習の本格導入に向けたPythonプログラミング,"Hilpisch,YvesJ 村上,振一郎",オーム社 (発売),202204
4792414962,伝承文学を学ぶ,"小川,直之,1953- 大石,泰夫,1959- 服部,比呂美 飯倉,義之,1975-",清文堂出版,202112
4152093854,国家はなぜ衰退するのか : 権力・繁栄・貧困の起源 下,"Acemoglu,Daron,1967- Robinson,JamesA.,1960- ほか",早川書房,201306
4152093846,国家はなぜ衰退するのか : 権力・繁栄・貧困の起源 上,"Acemoglu,Daron,1967- Robinson,JamesA.,1960- ほか",早川書房,201306
4065178029,統計モデルと推測 = Statistical Model and Inference (データサイエンス入門シリーズ),"松井,秀俊 小泉,和之 竹村,彰通,1952-",講談社,201911
4787234528,趣味とジェンダー,神野由紀／編著 辻泉／編著 飯田豊／編著,青弓社,20190618
4065280869,基礎からわかる論文の書き方 2660 (講談社現代新書),"小熊,英二,1962-",講談社,202205
4130802569,記号と再帰　新装版,田中久美子／著,東京大学出版会,20170401
4295000965,Goプログラミング実践入門 : 標準ライブラリでゼロからWebアプリを作る (impress top gear),"鄭,兆雄 武舎,広幸 阿部,和也 上西,昌弘",インプレス,201703
4757143605,古典の中の地球儀 : 海外から見た日本文学 4 (人文知の復興),"荒木,浩,1959-",NTT出版,202203
4765318699,診察室の陰性感情,"加藤, 温,加藤温 著",金芳堂,"Wed, 23 Jun 2021 19:16:34 +0900"
4393332385,知能低下の人類史 : 忍び寄る現代文明クライシス,"Dutton,Edward,1980- WoodleyofMenie,MichaelA.,1984- ほか",春秋社,202110
4863134894,愛書狂の本棚 : 異能と夢想が生んだ奇書・偽書・稀覯書 (NATIONAL GEOGRAPHIC),"Brooke-Hitching,Edward 髙作,自子",日経BPマーケティング (発売),202203
4326152176,合理的な愚か者 : 経済学=倫理学的探究,"Sen,Amartya,1933- 大庭,健,1946-2018 川本,隆史,1951-",勁草書房,198904
4327453072,英語学習の科学 : Q&A,"中田,達也 鈴木,祐一",研究社,202204
458276763X,職人歌合 763 (平凡社ライブラリー),"網野,善彦,1928-2004",平凡社,201205
4480091998,贈与論,マルセル・モース／著 吉田禎吾／翻訳 江川純一／翻訳,筑摩書房,20090201
4532324483,ANTHRO VISION : 人類学的思考で視るビジネスと世界,"Tett,Gillian,1967- 土方,奈美",日経BPマーケティング,202201
4560097305,大学教授のように小説を読む方法,"Foster,ThomasC 矢倉,尚子,1951-",白水社,201911
4779514614,「趣味に生きる」の文化論 : シリアスレジャーから考える,"宮入,恭平 杉山,昂平",ナカニシヤ出版,202104
4130633740,数理は世界を創造できるか,横倉祐貴／著 ジェフリフォーセット／著 土井琢身／著 瀧雅人／著 初田哲男／編集 坪井俊／編集,東京大学出版会,20210601
4622090376,刑務所の精神科医 : 治療と刑罰のあいだで考えたこと,"野村,俊明",みすず書房,202109
4798044784,"ハロー""Hello,World""OSと標準ライブラリのシゴトとしくみ : たった7行のCプログラムから解き明かす","坂井,弘亮,1973-",秀和システム,201509
4774146129,C言語入門書の次に読む本 (プログラミングの教科書),"坂井,弘亮,1973-",技術評論社,201105
4779516269,なぜあなたは国際誌に論文を掲載できないのか : 誰も教えてくれなかった本当に必要なこと,"加藤,司,心理学",ナカニシヤ出版,202203
0472034758,Academic writing for graduate students : essential tasks and skills (Michigan series in English for academic and professional purposes),"Swales,John Feak,ChristineB.",University of Michigan Press,c2012-01
4101311013,河童が覗いたヨーロッパ (新潮文庫),"妹尾,河童,1930-",新潮社,198307
4065250390,アート展「初音ミク・クロニクル」公式ビジュアルブック,,講談社,202110
4044004951,秘境旅行 [J110-4] ([角川ソフィア文庫]),"芳賀,日出男,1921-",KADOKAWA,202001
479862750X,塗りフェチ事典 : リアルな肉感キャラを描く! 女の子編,ホビージャパン,ホビージャパン,202202
415209558X,世界を破綻させた経済学者たち : 許されざる七つの大罪,"Madrick,JeffreyG 池村,千秋,1971-",早川書房,201508
4866808136,あなたを陰謀論者にする言葉 145 (Forest 2545 Shinsyo),"雨宮,純",フォレスト出版,202110
4635047520,遊歩大全 / ヤマケイ文庫,"Fletcher, Colin, 1922-2007,芦沢, 一洋, 1938-1996,コリン・フレッチャー 著,芦沢一洋 訳",山と溪谷社,"Thu, 10 Jan 2013 23:21:11 +0900"
4065267757,みんなのユニバーサル文章術 : 今すぐ役に立つ「最強」の日本語ライティングの世界 208 (星海社新書),"安田,峰俊",講談社,202201
4065259797,迷走しない!英語論文の書き方 : 秘密は「構造」作りにあり,"Chaubey,Varanya 成田,悠輔 布施,雄士",講談社,202201
4336073198,法の書　〔増補新訳〕　【普及版】,アレイスター・クロウリー／著 植松靖夫／翻訳,国書刊行会,20220222
4802207174,赤羽駅周辺の失われし鉄路を求めて : 特集,,イカロス出版,"Fri, 12 Sep 2025 14:43:04 +0900"
4802207921,消散軌道風景 : あなたの知らない鉄道考古学 Vol.2(2020) / イカロスMOOK,岡本憲之 総合プロデューサー,イカロス出版,"Mon, 2 Mar 2020 23:25:04 +0900"
4802208731,消散軌道風景 : あなたの知らない鉄道考古学 Vol.3(2020) / イカロスMOOK,岡本憲之 総合プロデューサー,イカロス出版,"Fri, 21 Aug 2020 23:21:44 +0900"
4802210280,廃線系鉄道考古学 : あなたの知らない消散軌道風景 2021Vol.2 / イカロスMOOK,岡本憲之 総合プロデューサー,イカロス出版,"Fri, 13 Aug 2021 19:14:41 +0900"
4062177358,究極のナローゲージ鉄道 : せまい鉄路の記録集,"岡本,憲之,1968-",講談社,201205
486320146X,実録鉄道連隊 : 知られざるその使命を解き明かす : 創設から終焉、路線から車両まで… / イカロスmook,,イカロス出版,"Thu, 16 Nov 2023 20:26:30 +0900"
4533039812,"全国鉱山鉄道 : 鉄道の原点""ヤマ""軌道をもとめて (JTBキャンブックス)","岡本,憲之,1968-",JTB,200110
4802209525,廃線系鉄道考古学 : あなたの知らない消散軌道風景 Vol.1(2021) / イカロスMOOK,岡本憲之 総合プロデューサー,イカロス出版,"Fri, 16 Apr 2021 00:20:06 +0900"
4802211015,廃線系鉄道考古学 : あなたの知らない消散軌道風景 2022Vol.3 (イカロスMOOK),,イカロス出版,202202
0764574817,Reversing Secrets of Reverse Engineering,Eldad Eilam,John Wiley & Sons,2005-04-15
4004314844,エピジェネティクス : 新しい生命像をえがく 1484 (岩波新書 新赤版),"仲野,徹,1957-",岩波書店,201405
4044005664,身体の大衆文化 : 描く・着る・歌う,"安井,眞奈美,1967- HernándezHernández,ÁlvaroDavid,1983-",KADOKAWA,202111
4065250455,なぜオナニーはうしろめたいのか 199 (星海社新書),"赤川,学,1967- 小堀,善友,1975- シオリーヌ,1991- 典雅",講談社 (発売),202110
4863542755,組込みエンジニアの教科書 = The textbook of the Embedded engineer,"渡辺,登,pub.2019 牧野,進二",シーアンドアール研究所,201904
4106035952,拷問と処刑の西洋史 (新潮選書),"浜本,隆志,1944-",新潮社,200712
4750515183,性表現規制の文化史,白田秀彰／著,亜紀書房,20170724
4000298739,松坂和夫数学入門シリーズ = Kazuo Matsuzaka's Introduction to Mathematics. 3,"松坂,和夫,1927-2012",岩波書店,201811
4785312092,ルベーグ積分と測度 (数学のとびら),"山上,滋,1955-",裳華房,202202
4297125218,問題解決のための「アルゴリズム×数学」が基礎からしっかり身につく本,"米田,優峻,2002-",技術評論社,202201
4627856415,コンピュータサイエンスにおける様相論理 = Modal Logics in Computer Science,"鹿島,亮",森北出版,202201
4535067554,佐藤隆三著作集 = The Selected Works of Ryuzo Sato 第5巻,"佐藤,隆三,1931-",日本評論社,201611
4798164739,ゲームメカニクス大全 : ボードゲームに学ぶ「おもしろさ」の仕掛け,"Engelstein,Geoffrey Shalev,Isaac 小野,卓也",翔泳社,202010
4106038757,怪異猟奇ミステリー全史 (新潮選書),"風間,賢二,1953-",新潮社,202201
4760151710,ユダヤ神話・呪術・神秘思想事典,"Dennis,GeoffreyW 木村,光二,1949-",柏書房,202002
4326504331,ダメな統計学 : 悲惨なほど完全なる手引書,"Reinhart,Alex,1991- 西原,史暁,1985-",勁草書房,201701
478531592X,手を動かしてまなぶε-δ論法 = Epsilon-Delta Method,"藤岡,敦",裳華房,202112
4866365366,ライトノベルの新・潮流 = LIGHT NOVEL NEW TIDE CURRENT : 黎明期→2021,"石井,ぜんじ 太田,祥暉,1996- 松浦,恵介,1980-",スタンダーズ,202201
4863543638,OSSライセンスを正しく理解するための本 = Understand the Open Source Software License Correctly,"姉崎,章博",シーアンドアール研究所,202111
4839977607,AWSではじめるクラウド開発入門 : コードを書いて学ぶエンジニア・科学者のためのハンズオン教材 (Compass Data Science),"真野,智之",マイナビ出版,202109
4489021291,入門確率解析とルベーグ積分,"森,真,1948-",東京図書,201206
4004319102,民俗学入門 1910 (岩波新書 新赤版),"菊地,暁,1969-",岩波書店,202201
4480097635,数学基礎論 (ちくま学芸文庫),前原昭二／著 竹内外史／著,筑摩書房,20170110
4873117127,コンピュータシステムの理論と実装 : モダンなコンピュータの作り方,"Nisan,Noam Schocken,Shimon 斎藤,康毅,1984-",オーム社,201503
4839909865,CPUの創りかた : IC10個のお手軽CPU設計超入門 : 初歩のデジタル回路動作の基本原理と製作,"渡波,郁",毎日コミュニケーションズ,200309
4864718652,スーパーナチュラル・ウォー : 第一次世界大戦と驚異のオカルト・魔術・民間信仰,"Davies,Owen,1969- 江口,之隆,1958-",ヒカルランド,202004
4404035861,危ない食卓 : 十九世紀イギリス文学にみる食と毒,"横山,茂雄,1954-",新人物往来社,200812
4297125161,"暗号から学ぶ代数学 (数学のみかた,考え方)","川添,充,1968- 上野,健爾,1945-",技術評論社,202112
4010377275,総合的研究問題文の読み取り方-数学1・A・2・B : 大学受験,,旺文社,202108
4150315000,異常論文 1500 (ハヤカワ文庫 JA),"樋口,恭介,1989-",早川書房,202110
4322139884,飲みの技法,"Opsopäus,Vincentius 原澤,隆三郎,1951-",きんざい,202110
4909466010,エヴァンゲリオンイラスト集 : 2007-2017,"「エヴァンゲリオンイラスト集2007-2017」編集部 編,カラー 監修",グラウンドワークス,"Wed, 25 Sep 2019 22:28:05 +0900"
4044006261,もっとヘンな論文 さ70-3 (角川文庫),サンキュータツオ,KADOKAWA,202007
4044003343,ヘンな論文 さ70-2 (角川文庫),サンキュータツオ,KADOKAWA,201711
4046043938,"奇書の世界史 : 歴史を動かす""ヤバい書物""の物語","三崎,律日,1990-",KADOKAWA,201908
4426624096,世界の奇書 : 総解説,,自由国民社,199804
4480510443,キリスト教の幼年期 ト－１９－１ (ちくま学芸文庫),エチエンヌ・トロクメ／著 加藤隆／翻訳,筑摩書房,20210812
4151845518,ブート・バザールの少年探偵 HM 487-1 (ハヤカワ・ミステリ文庫),"Anappara,Deepa 坂本,あおい",早川書房,202104
4094070400,安楽死を遂げた日本人 み20-2 (小学館文庫),"宮下,洋一,1976-",小学館,202107
4062920484,図説金枝篇. 下 2048 (講談社学術文庫),"Frazer,JamesGeorge,1854-1941 MacCormack,Sabine ほか",講談社,201105
